FMACHA0080011851,Chemin de Fer Touristique du Sud des Ardennes - Le Tréport,Fêtes et Manifestations,Animation locale,Divers,,,,,,,Gare,,,8300,AMAGNE,FRANCE,03.24.71.47.60,,,atva-info@orange.fr,,,,49.51888,4.50608,,,,Chemin de Fer Touristique du Sud des Ardennes - Le Tréport,,Association  Les Amis de la Traction Vapeur en Ardenne  (ATVA),"Au départ d'Amagne-Lucquy, Rethel et Reims, Laon, Tergnier, Amiens et Abbeville profitez de notre voyage pour découvrir la cité balnéaire du TréportAprès un voyage confortable à bord de notre autorail des années 70, vous arrivez directement au bord de la mer pour profiter de l'air marin, du paysage et déguster les spécialités locales.Afin d'agrémenter votre voyage, nous vous proposerons des boissons et viennoiseries au cours des voyages aller et retour.L'exploitation de la ligne est assurée par des bénévoles formés à la conduite et à la sécurité. Matériel et personnel font l'objet de contrôles périodiques par la SNCF.",,,,,,,,,,,,,,,,,http://cnstlltn.com/master/57a5faa7-9644-4a6a-9bee-0ef27f3bf0fd/treport+1.png,http://cnstlltn.com/master/41302e6b-a06a-4260-a286-92acb961c241/treport+1.png,http://cnstlltn.com/master/3c1e028b-9857-488a-bb75-e7bcb4ec86f7/treport+1.png,,,,,,,,,,,28/05/16,28/05/16,,,,,,,,,,,,,,,,,,,,,,,,,,,,,français,,,,,,,,,,,,,,,,,,,,,,,,,,,,,,,,,,,,,,,,,,,,,,,,,,,,,,,,,,,,,,,,,,,,,,,,,,,,,,,,,,,,,,,,,,,,,,,,,,,,,,,,,,,,,,,,,,,,,,,,,,,,,,,,,,
FMACHA0080011974,Chouette nuit !,Fêtes et Manifestations,Nature et détente,Randonnée,,,,,,,91 place de Launet,,,8170,HARGNIES,FRANCE,03 24 42 90 57,,,accueil@parc-naturel-ardennes.fr,,http://www.parc-naturel-ardennes.fr,,50.01628,4.788611,,,,Chouette nuit ! Hargnies-Ardenne-France,,"Le samedi 16 avril prochain, lors d'une sortie au milieu des bruits et des odeurs de la forêt, les guides naturalistes lèveront le voile sur les fascinants nocturnes que sont les Chevêche d'Athéna ou l'Effraie des clochers.","De 19h à 22hBalade +/- 3 km Tout public - GratuitPrévoir chaussures de marche, vêtements chauds et lampe torche.Places limitées, réservations auprès du parc: +33(0)3 24 42 90 57(Organisé par le PNR et animé par le PNR et le Regroupement des Naturalistes Ardennais) Informations complémentaires : www.parc-naturel-ardennes.fr",,,,,,,,,,,,,,,,,http://cnstlltn.com/master/43b9a204-1a62-42a0-9899-62c6babe0a3b/owl-1523805.jpg,,,,,,,,,,,,,16/04/16,16/04/16,,,,,,,,,Autres,,,,,accueil@parc-naturel-ardennes.fr,03 24 42 90 57,03 24 42 90 58,,,,,,,,,,,,,français,,,,,,,,,,,,,,,,,,,,,,,,,,,,,,,,,,,,,,,,,,,,,,,,,,,,,,,,,,,,,,,,,,,,,,,,,,,,,,,,,,,,,,,,,,,,,,,,,,,,,,,,,,,,,,,,,,,,,,,,,,,,,,,,,,
FMACHA0080010951,Ciné des P'tits Loups,Fêtes et Manifestations,Manifestation Culturelle,Jeune public,,,Cinéma,,,,Esplanade Jacques Sourdille,"Espace de spectacles ""Le Manège""",,8600,GIVET,FRANCE,03 24 40 14 40,,,manegegivet@orange.fr,,http://www.lemanege.fr,,50.1353,4.820809,,,,Ciné des P'tits Loups - Givet-Ardenne-France,,"Le Ciné des P'tits Loups : Des séances qui sont l'occasion de réunir enfants, parents et grands-parents pour un moment convivial, amusant et chaleureux.","Un rendez-vous mensuel, chaque 1er samedi du mois à 14h (sauf en octobre, février et avril )Les samedis 7 novembre - 5 décembre - 2 janvier - 5 mars - 7 mai et 4 juin 2016Deux rendez-vous, le mardi à 14h, aux petites vacances scolaires , sauf à NoëlLes mardis 20 octobre - 27 octobre - 9 février - 16 février - 12 avril et 19 avril 2016* A la fin de chaque séance, un goûter et une animation autour du film visionné sont proposés.",,,,,,,,,,,,,,,,,http://cnstlltn.com/master/44c27be7-0b8b-4042-bfa4-1038ad716bef/manege4.jpg,http://cnstlltn.com/master/22c88406-c640-4bd6-b2da-9ec8d0b691e1/manege2.jpg,,,,,,,Accès handicapés,,,,,20/10/15,20/10/15,27/10/15,27/10/15,07/11/15,07/11/15,05/12/15,05/12/15,02/01/16,02/01/16,Autres,,,,,manegegivet@orange.fr,03 24 40 14 40,,,,,,,,,,,,,,français,,,,,Chèques,Espèces,Carte bancaire,,,,,,,,,,,,,,,,,,,,,,,,,,,,,,,,,,,,,,,,,,,,,,,,,,,,,,,,,,,,,,,,Tarif adhérents,5.60,5.60,Tarif non adhérents,5.90,5.90,Moins de 14 ans,4.00,4.00,,,,,,,,,,,,,,,,,,,,,,,,,,,,,,,,,,,,,,,,,,,,,,,,,,,
FMACHA0080011856,Ciné Récré,Fêtes et Manifestations,,,,,,,,,,,,8130,ATTIGNY,FRANCE,03 24 35 34 33,,,oacp@orange.fr,,,,49.47819,4.577652,,,,Ciné Récré,à la salle des fêtes d'Attigny,de 14h à 17h,14h : début du film  Vice et Versa 15h45 : jeux de société16h30 : goûter offert par l'Office d'Animation des Crêtes PréardennaisesInscriptions à partir de 5 ansTarif : 2 par personneVeuillez vous inscrire à l'avance.,,,,,,,,,,,,,,,,,http://cnstlltn.com/master/c520b22e-7160-4ff7-852b-0ff13466c848/cine-lambersart_zoom_colorbox.jpg,,,,,,,,,,,,,14/04/16,14/04/16,,,,,,,,,,,,,,,,,,,,,,,,,,,,,français,,,,,,,,,,,,,,,,,,,,,,,,,,,,,,,,,,,,,,,,,,,,,,,,,,,,,,,,,,,,,,,,,,,,,,,,,,,,,,,,,,,,,,,,,,,,,,,,,,,,,,,,,,,,,,,,,,,,,,,,,,,,,,,,,,
FMACHA0080008083,Cinéma de Liart,Fêtes et Manifestations,Animation locale,,,,Cinéma,,,,Salle des fêtes,,,8290,LIART,FRANCE,03 24 54 48 33,,,,,,,49.76913,4.340077,,,,Tous les mois un film,,Salle polyvalente de Liart,Dimanche 17 avril :  Chocolat  avec Omar sy 17h,,,,,,,,,,,,,,,,,http://cnstlltn.com/master/c015482b-b16d-4103-b798-6a8a42c4deb8/12829430_1184838274867588_443253226840465578_o.jpg,http://cnstlltn.com/master/f48f8748-3f8c-4aca-8f61-32f2e0582197/images+(1).jpg,http://cnstlltn.com/master/bf9dc599-9801-4b3d-9de4-3b0f41f552cf/t%c3%a9l%c3%a9chargement+(3).jpg,,,,,,,,,,,24/01/16,24/01/16,21/02/16,21/02/16,20/03/16,20/03/16,17/04/16,17/04/16,,,,,,,,,,,,,,,,,,,,,,,français,,,,,Bons CAF,Chèques bancaires et postaux,Espèces,,,,,,,,Parking,Salle de projection,,,,,,,,,,,,,,,,,,,Bar,,,,,,,,,,,,,,,,,,,,,,,,,,,,,,Y,,,,,,plein tarif,6.00,6.00,abonnement,20.00,20.00,- de 18 ans,3.50,3.50,groupe,3.00,3.00,,,,,,,,,,,,,,,,,,,,,,,,,,,,,,,,,,,,,,,,,,,,,,,,
FMACHA0080010414,Cinéma de plein air,Fêtes et Manifestations,Animation locale,Spectacle,,Fête du Cinéma,,,,,Place,,,8290,LE FRETY,FRANCE,,,,,,,,49.74008,4.280298,,,,Cinéma de plein air,Repas et projection,Organisé par le village en association Ardennes Thiérache,17h : Inauguration des sentiers d'interprétation du village 18h projection du film suivit d'un repas payant.,,,,,,,,,,,,,,,,,http://cnstlltn.com/master/6f1c4c81-43ac-4dda-98c0-bf9dd762edd2/cinema-plein-air-1341177154-19276.jpg,,,,,,,,,,,,,08/07/16,08/07/16,,,,,,,,,,,,,,,,,,,,,,,,,,,,,français,,,,,Chèques bancaires et postaux,Espèces,,,,,,,,,Parking,,,,,,,,,,,,,,,,,,,,Banquet,,,,,,,,,,,,,,,,,,,,,,,,,,,,,,,,,,,,Repas + projection adulte,14.00,14.00,repas + projection enfant,7.00,7.00,,,,,,,,,,,,,,,,,,,,,,,,,,,,,,,,,,,,,,,,,,,,,,,,,,,,,,
FMACHA0080010016,Cinéma de Plein air,Fêtes et Manifestations,Animation locale,Divers,,,,,,,,,,8290,BLANCHEFOSSE ET BAY,FRANCE,324352146,,,,,,,49.77659,4.235745,,,,Cinéma de plein air,,05/08/16,"22h projection du film, repas avant, possibilité d'assister uniquement au film.",,,,,,,,,,,,,,,,,http://cnstlltn.com/master/529bacc3-0d70-47fd-b21a-fadbd804a1ea/cinema-plein-air-1341177154-19276.jpg,http://cnstlltn.com/master/9a313b43-8c1f-420b-8ec8-a13d6677cbc1/seine-et-marne-blandy-cin%c3%a9ma-plein-air.jpeg,,,,,,,,,,,,05/08/16,05/08/16,,,,,,,,,,,,,,,,,,,,,,,,,,,,,français,,,,,Espèces,,,,,,,,,,,,,,,,,,,,,,,,,,,,,,Bar,Visite gratuite,,,,,,,,,,,,,,,,,,,,,,,,,,,,,,,,,,,film avec repas enfant - 12 ans,7.00,7.00,film avec repas ,14.00,14.00,,,,,,,,,,,,,,,,,,,,,,,,,,,,,,,,,,,,,,,,,,,,,,,,,,,,,,
FMACHA0080009678,"Cinémioches  4,5,6 Mélie pain d'épice ",Fêtes et Manifestations,Manifestation Culturelle,Animation de Noel,,,,,,,2 Place Jacques Félix,Médiathèque Voyelles,,8000,CHARLEVILLE MEZIERES,FRANCE,03 24 26 94 43,,,mediator@mediatheque-voyelles.fr,,http://www.mediatheque-voyelles.fr,,49.77441,4.724516,,,,"Cinémioches  4,5,6 Mélie pain d'épice ",,A 16h30. Entrée libre tout public.Projection publique à destination des petits et des grands.,"De Pierre-Luc Granjon / Danny De Vent /Jadwiga Kowalska / Gili Dolev(4 courts métrages danimation pour enfants dès 3 ans)- La Leçon de natation (papier découpé numérique et 3D) : Jonas, cinq ans, s'apprête à suivre son premier cours de natation. Alors qu'il tente de fuir cet endroit qui l'effraie, il tombe dans le grand bain.- Prix du meilleur film pour enfants, Festival du film d'animation, Ottawa, 2008,- Grand Prix, Gand, 2008,- Prix du court métrage d'animation, Festival Cinéjeune, Saint Quentin, 2008.- Tôt ou tard (papier découpé, animation 2D par ordinateur) : Un écureuil rencontre une chauve-souris solitaire. Ensemble, ils essaient de remettre de l'ordre dans les rouages souterrains qui orchestrent la danse du jour, de la nuit, et de bien plus encore.- Le Joyeux Petit Canard (The Happy Duckling) (3D numérique + gouache papier) : Un petit garçon et un étrange canard découvrent qu'il faut parfois être cruel pour être gentil.- Prix du meilleur film d'animation pour enfant, Festival international du film d'animation, Stuttgart, 2009.- Le Printemps de Mélie (Animation en volume) : Au royaume de Balthazar, les célébrations de la fête du printemps ont à peine commencé que la cité est menacée par une terrible épidémie. La princesse Mélie, désignée reine du carnaval, mène l'enquête...- Grand Prix d'excellence de l'Alliance pour l'enfant et la télévision, Montréal, 2010. Pièce principale de cette petite compilation, réalisée par Pierre-Luc Granjon, Ğ Le Printemps de Mélie ğ réinvestit l'univers de Ğ L'hiver de Léon ğ : châteaux forts, fantaisie malicieuse, et graphisme enchanteur. (...) Son charme tient à l'alliance entre le folklore médiéval, des personnages gentiment fêlés, et un traitement plastique raffiné des éléments - l'eau, le feu, les fleurs... -, lointainement inspiré de l'esthétique des enluminures.  Isabelle REGNIER, lemonde.fr Quatre nouveaux courts métrages d'animation européens, poétiques et attendrissants.  Juliette BÉNABENT, Télérama Le Printemps de Mélie, sous l'influence graphique des miniatures médiévales, allie la magie de la fable à une galerie de personnages hauts en couleur. Un délice.  Cécile JAURÈS, la-croix.comDurée : 45 mn",,,,,,,,,,,,,,,,,http://cnstlltn.com/master/c31072a7-c04f-4dd6-a833-daaf76ecf799/cin%c3%a9mioches.png,,,,,,,,,,,,,21/05/16,21/05/16,,,,,,,,,,,,,,,,,,,,,,,,,,,,,français,,,,,,,,,,,,,,,,,,,,,,,,,,,,,,,,,,,,,,,,,,,,,,,,,,,,,,,,,,,,,,,,,,,,,,,,,,,,,,,,,,,,,,,,,,,,,,,,,,,,,,,,,,,,,,,,,,,,,,,,,,,,,,,,,,
FMACHA0080012091,Circuit Pédestre,Fêtes et Manifestations,Manifestation sportive,Randonnée,,,,,,,,,,8270,WASIGNY,FRANCE,03 24 38 71 66 ,03 24 72 31 33,,,,http://grangesporcien.jimdo.com,,49.6311,4.354079,,,,Circuit pédestre,,A 9h30.,"Le matin : seul ou en groupe, vous découvrirez le village de Wasigny. Le plan détaillé qui vous sera remis vous permettra d'arpenter rues et ruelles en ouvrant lil sur les particularités de ce village : bâti, histoire, économie...A midi : rendez-vous à la salle communale. Repas tiré du sac. Apéritif et café offert par l'association.Départ à 14h de la salle communale pour une balade encadrée d'une douzaine de kilomètres. Arrêt à la grange communale de Draize, chantier-école de l'association, projection sur l'évolution de la restauration de ce bâtiment. puis retour à Wasigny par des chemins entre cultures et pâturages. Au retour, verre de l'amitié et galette au sucre. Tarif : 6 par personne (gratuit pour les enfants). Pique-nique laissé à l'initiative des participants. L'éventuel bénéfice aide l'association à uvrer pour la connaissance et la préservation du patrimoine local (visites, organisation de stages...)",,,,,,,,,,,,,,,,,http://cnstlltn.com/master/663b553c-5cea-4e25-9e14-58200ab71e29/randonnee.jpg,,,,,,,,,,,,,01/05/16,01/05/16,,,,,,,,,,,,,,,,,,,,,,,,,,,,,français,,,,,,,,,,,,,,,,,,,,,,,,,,,,,,,,,,,,,,,,,,,,,,,,,,,,,,,,,,,,,,,,,,,,,,,,,,,,,,,,,,,,,,,,,,,,,,,,,,,,,,,,,,,,,,,,,,,,,,,,,,,,,,,,,,
FMACHA0080012113,Comédie / débat sur la bipolarité : NUIT DENFER,Fêtes et Manifestations,Manifestation Culturelle,Théâtre,,,,,,,13 rue Jean-Baptiste Clément,Espace Manureva,,8000,CHARLEVILLE MEZIERES,FRANCE,03 24 33 60 40,,http://www.manu-sonetlumiere.com,contact@manu-sonetlumiere.com,,,,49.77572,4.718756,,,,Comédie / débat sur la bipolarité : Nuit d'Enfer,,à 20h00 - réservation conseillée - entrée : 10 - recette reversée à l'institut Pasteur et l'UNAFAM pour la recherche sur le cerveau et la bipolarité,"Parce quelle est bipolaire et souffre de cette maladie mentale depuis 18 ans, Annie MENONVILLE a décidé de se moquer delle-même avec grand courage, lors de ce one woman show. Expliquer par le biais de lhumour les différentes phases de cette maladie mais aussi réfléchir tous ensemble par un mini débat, aux améliorations quil pourrait être faites, pour vivre mieux la maladie Grand message despoir aux malades parce quelle a des astuces pour éviter de retomber dans le néant... Rappelons le, tout le monde peut devenir bipolaire",,,,,,,,,,,,,,,,,http://cnstlltn.com/master/4b47bef0-a498-4240-be88-e04b9a323376/th%c3%a9%c3%a2tre.jpg,,,,,,,,Accès handicapés,,,,,16/04/16,16/04/16,,,,,,,,,,,,,,,,,,,,,,,,,,,,,français,,,,,,,,,,,,,,,,,,,,,,,,,,,,,,,,,,,,,,,,,,,,,,,,,,,,,,,,,,,,,,,,,,,,,,,,,,,,,,,,,,,,,,,,,,,,,,,,,,,,,,,,,,,,,,,,,,,,,,,,,,,,,,,,,,
FMACHA0080011683,Comice Agricole,Fêtes et Manifestations,Animation locale,Divers,,,Animaux,,,,Place ,,,8130,SAULCES CHAMPENOISES,FRANCE,,,,,,,,49.45074,4.504902,,,,Comice Agricole,,Entrée gratuite,Grande Comice Agricole sur la place du village de 9h à 19h.,,,,,,,,,,,,,,,,,http://cnstlltn.com/master/e96de3cc-c11b-4e74-b7c9-e72f83f54510/vache.jpg,,,,,,,,,,,,,15/05/16,15/05/16,,,,,,,,,,,,,,,,,,,,,,,,,,,,,français,,,,,,,,,,,,,,,,,,,,,,,,,,,,,,,,,,,,,,,,,,,,,,,,,,,,,,,,,,,,,,,,,,,,,,,,,,,,,,,,,,,,,,,,,,,,,,,,,,,,,,,,,,,,,,,,,,,,,,,,,,,,,,,,,,
FMACHA0080011760,Comice Agricole,Fêtes et Manifestations,Animation locale,Foire ou salon,,,,,,,,,,8260,AUVILLERS LES FORGES,FRANCE,03 24 54 30 30,,,,,,,49.86478,4.365342,,,,Comice Agricole,Auvillers les Forges,Sur le site de Teravia société sur le village de Mon Idée,,,,,,,,,,,,,,,,,,http://cnstlltn.com/master/09778c50-0909-4ca8-97fd-16a6d190ee62/images.png,,,,,,,,,,,,,26/06/16,26/06/16,,,,,,,,,,,,,,,,,,,,,,,,,,,,,français,,,,,,,,,,,,,,,,,,,,,,,,,,,,,,,,,,,Bar,,,,,,,,,,,,,,,,,,,,,,,,,,,,,,,,,,,,,,,,,,,,,,,,,,,,,,,,,,,,,,,,,,,,,,,,,,,,,,,,,,,,,,,,,,,,,,,
FMACHA0080011732,Comice Agricole et Brocante,Fêtes et Manifestations,Animation locale,Brocante,,,Animaux,,,,,,,8270,VIEL ST REMY,FRANCE,03 24 38 92 63,,,,,,,49.62922,4.502273,,,,Comice Agricole et Brocante,,De 6h à 22h,Dans le centre du village grande comice agricole et brocante.,,,,,,,,,,,,,,,,,http://cnstlltn.com/master/a861d547-bbe9-4753-915d-b9f231752857/comice+agricole.jpg,http://cnstlltn.com/master/a67c4b53-6741-4780-b3a0-145ea2db92d2/brocante.jpg,,,,,,,,,,,,22/05/16,22/05/16,,,,,,,,,,,,,,,,,,,,,,,,,,,,,français,,,,,,,,,,,,,,,,,,,,,,,,,,,,,,,,,,,,,,,,,,,,,,,,,,,,,,,,,,,,,,,,,,,,,,,Les 3 mètres,6.00,6.00,,,,,,,,,,,,,,,,,,,,,,,,,,,,,,,,,,,,,,,,,,,,,,,,,,,,,,,,,
FMACHA0080011107,Commémoration 11 Novembre de Sedan,Fêtes et Manifestations,Manifestation Culturelle,Commémoration,,Centenaire de la guerre 1914-1918,,,,,Place Nassau - Mairie,,,8200,SEDAN,FRANCE,03 24 27 73 00,,,,,,,49.69907,4.951343,,,,Commémorations du 11 Novembre de Sedan,,"Centenaire 14-18, la ville sur tous les fronts.","10h - Ce´re´monie comme´morative de lArmistice de la Premie`re Guerre mondialeMonument aux morts place NassauA loccasion du Centenaire, la comme´moration sera rehausse´e par la participation de lassociation le Miroir, des jeunes gymnastes de Sedan Gymnique et des cavaliers de lE´trier ardennais, pour loccasion habille´s en costume de´poque.15h - Visite guide´e Ğ Sedan, ville-ho^pital pendant la Grande Guerre ğDure´e : 2 heures environ - Visite gratuite - Rendez-vous place Turenne, devant lHo^tel de VilleRenseignements : service du Patrimoine - Te´l. : 03 24 26 85 70 / patrimoine@ville-sedan.fr",,,,,,,,,,,,,,,,,http://cnstlltn.com/master/7ab8f4d8-7072-4d87-819c-4aff154d1709/monument_nassau-sedan-%c2%a9s.ortega-dubois-001.jpg,,,,,,,,,,,,,11/11/16,11/11/16,,,,,,,,,,,,,,,,,,,,,,,,,,,,,français,,,,,,,,,,,,,,,,,,,,,,,,,,,,,,,,,,,,,,,,,,,,,,,,,,,,,,,,,,,,,,,,,,,,,,,,,,,,,,,,,,,,,,,,,,,,,,,,,,,,,,,,,,,,,,,,,,,,,,,,,,,,,,,,,,
FMACHA0080011551,Commémoration de Judenlager,Fêtes et Manifestations,,Commémoration,,,,,,,,,,8500,LES MAZURES,FRANCE,,,,,,,,49.89404,4.639008,,,,Commémoration de Judenlager ,les 3 et 4 septembre,Histoire  oubliée  du seul Camp pour Juifs en Champagne-Ardenne pendant la seconde guerre mondiale. Les Mazures : antichambre de la mort avant Auschwitz. Un rouage ardennais de la Shoah.,,,,,,,,,,,,,,,,,,http://cnstlltn.com/master/4c898a44-5f7d-4980-b5af-7dbbbbe419d7/images.jpg,,,,,,,,,,,,,03/09/16,04/09/16,,,,,,,,,,,,,,,,,,,,,,,,,,,,,français,,,,,,,,,,,,,,,,,,,,,,,,,,,,,,,,,,,,,,,,,,,,,,,,,,,,,,,,,,,,,,,,,,,,,,,,,,,,,,,,,,,,,,,,,,,,,,,,,,,,,,,,,,,,,,,,,,,,,,,,,,,,,,,,,,
FMACHA0080008543,Commémorations du centenaire de la Première guerre mondiale,Fêtes et Manifestations,Manifestation Culturelle,Commémoration,,,,,,,,,,8300,RETHEL,FRANCE,03 24 38 54 56,,,office.tourisme@paysrethelois.fr,,,,49.51503,4.383214,,,,Commémorations du centenaire de la première guerre mondiale,,ĞLa femme au quotidien et la vie du soldat pendant loccupation de 1914 à 1918 à Rethel et dans le Pays rethélois ğ,Du 24 septembre au 9 octobre Exposition dans les salons dhonneur sur loccupation allemande à Rethel et les environs ainsi que sur le travail des femmes dans les Ardennes. Samedi 24 septembre -,"Dans laprès-midi : Visite de la ville lazarets et lavoirs (2h maximum), préparée par M Estermann, M Lefebvre et loffice de tourisme : rue des dames, le bateau lavoir, . Un feuillet sera remis aux personnes avec une photo ancienne et des explications.-",17h 17h30 : inauguration dans les salons dhonneur de lexposition : intervention de M Guérin et lecture de M Vaillant dextraits de louvrage Ğ lhomme jeté aux bêtes ğ (10 -15 minutes) -,Fin daprès-midi : conférence de M Guérin sur loccupation allemande à Rethel puis les corvées des femmes entrecoupée de chants interprétés par la Cantilène à lAtmosphère-,Soirée : Vin dhonneurJeudi 6 octobre (à l'occasion de l'AG de l'IUTL) -,"De 15h à 16h30 : lecture de poèmes inspirés (au cours des siècles) aux poètes sur le thème de la guerre et de la paix, poèmes inspirés à des soldats pendant cette guerre par M Pierson Date et heure à définir -",Conférence de M Guillaume sur la vie quotidienne dans les villages du rethélois- Conférence de M Lecler sur laffaire du Radois (soldats français cachés en 1914-1915)Vendredi 7 octobre -,Après-midi : Interventions de Jacques Lambert dans une ou deux écoles-,En soirée : Conférence de Jacques Lambert sur la femme dans les Ardennes au théâtre Louis Jouvet-,"20h  20h30 : Ars Vocalis, chants dhonneur, chants de paix au théâtre Louis Jouvet",,,,,,,,http://cnstlltn.com/master/cb49b673-5249-4f39-a5cd-5a46b646a623/image3c.png,,,,,,,,,,,,,24/09/16,09/10/16,11/11/16,11/11/16,,,,,,,,,,,,,,,,,,,,,,,,,,,français,,,,,,,,,,,,,,,,,,,,,,,,,,,,,,,,,,,,,,,,,,,,,,,,,,,,,,,,,,,,,,,,,,,,,,,,,,,,,,,,,,,,,,,,,,,,,,,,,,,,,,,,,,,,,,,,,,,,,,,,,,,,,,,,,,
FMACHA0080009813,Concert,Fêtes et Manifestations,Musique,Concert,,,,,,,Place de Lattre de Tassigny,,,8300,RETHEL,FRANCE,03 24 39 51 46,,,,,,,49.51503,4.383214,,,,Concert ,,à l'Atmosphère,,,,,,,,,,,,,,,,,,,,,,,,,,,,,,,21/07/16,21/07/16,,,,,,,,,,,,,,,,,,,,,,,,,,,,,français,,,,,,,,,,,,,,,,,,,,,,,,,,,,,,,,,,,,,,,,,,,,,,,,,,,,,,,,,,,,,,,,,,,,,,,,,,,,,,,,,,,,,,,,,,,,,,,,,,,,,,,,,,,,,,,,,,,,,,,,,,,,,,,,,,
FMACHA0080011628,Concert à Tournes : Bastathoo,Fêtes et Manifestations,Musique,Concert,,,"Pop musique (rock, pop, rap, ...)",,,,,Salle des Fêtes,,8090,TOURNES,FRANCE,,,,,,,,49.79787,4.637346,,,,Concert à Tournes : Bastathoo,,ouverture des portes à 20h - Salle des Fêtes de Tournes,Un concert pop-rock avec show laser - buvette et petite restauration sur place,,,,,,,,,,,,,,,,,http://cnstlltn.com/master/890efbfd-c25d-4e0a-b45f-fa414d7621b1/fb_img_1454796189650.jpg,,,,,,,,,,,,,16/04/16,16/04/16,,,,,,,,,,,,,,,,,,,,,,,,,,,,,français,,,,,,,,,,,,,,,,,,,,,,,,,,,,,,,,,,,,,,,,,,,,,,,,,,,,,,,,,,,,,,,,,,,,,,,,,,,,,,,,,,,,,,,,,,,,,,,,,,,,,,,,,,,,,,,,,,,,,,,,,,,,,,,,,,
FMACHA0080012046,Concert autour de l'orgue,Fêtes et Manifestations,Musique,Concert,,,Musique sacrée,,,,Basilique Notre Dame d'Espérance,,,8000,CHARLEVILLE MEZIERES,FRANCE,06 61 58 52 30,,,orguebasilique08@orange.fr,,,,49.77932,4.718441,,,,Concert autour de l'orgue,,A 20h.,Concert  Autour de l'orgue  par les élèves de la classe d'orgue du CRD de Charleville-Mézières.,,,,,,,,,,,,,,,,,http://cnstlltn.com/master/8ff40f57-f5bc-4263-8e61-bccad4aaab70/visite+basilique+m%c3%a9zi%c3%a8res+(30)_web.jpg,,,,,,,,,,,,,10/06/16,10/06/16,,,,,,,,,,,,,,,,,,,,,,,,,,,,,français,,,,,,,,,,,,,,,,,,,,,,,,,,,,,,,,,,,,,,,,,,,,,,,,,,,,,,,,,,,,,,,,,,,,,,,,,,,,,,,,,,,,,,,,,,,,,,,,,,,,,,,,,,,,,,,,,,,,,,,,,,,,,,,,,,
FMACHA0080006617,Concert autour de l'orgue,Fêtes et Manifestations,Religieuse,Concert,,,Musique sacrée,,,,Eglise,,,8230,REGNIOWEZ,FRANCE,03 24 54 14 78,,,,,,,49.93608,4.42955,,,,concert autour de l'orgue ,3 dates dans l'année,Rendez vous à 16h à l'Eglise,"8 en prévente, 10 sur place.",,,,,,,,,,,,,,,,,http://cnstlltn.com/master/554ab304-1fff-46e2-aaa8-cc39c333c541/30+octobre+2014+-+regniowez+(14)_816x612.jpg,http://cnstlltn.com/master/85c53516-2b7b-4dc9-863f-03573ae2bdd8/abbe+jacobs.jpeg,http://cnstlltn.com/master/caf16118-71f3-4be0-9481-77922bdbd636/marie-anne+dachy+26sept+2010+014.jpg,,,,,,,,,,,24/04/16,24/04/16,12/06/16,12/06/16,25/09/16,25/09/16,,,,,,,,,,,,,,,,,,,,,,,,,français,,,,,Chèques bancaires et postaux,Espèces,,,,,,,,,Aire de pique-nique,Parking,Parking autocar,,,,,,,,,,,,,,,,,,,,,,,,,,,,,,,,,,,,,,,,,,,,,,,,Y,,,,,,ticket en prévente,8.00,8.00,ticket sur place,10.00,10.00,,,,,,,,,,,,,,,,,,,,,,,,,,,,,,,,,,,,,,,,,,,,,,,,,,,,,,
FMACHA0080007093,Concert avec  les égarés ,Fêtes et Manifestations,Musique,Concert,,,Musique de variété,,,,1 rue du Pont Paquis,,,8310,JUNIVILLE,FRANCE,03 24 39 68 00,,,musee.verlaine@wanadoo.fr,,http://www.musee-verlaine.fr,,49.3991,4.384097,,,,Concert  les égarés ,,,à 20h30 au musée Verlaine. Gratuit,,,,,,,,,,,,,,,,,http://cnstlltn.com/master/bbc3056d-8493-4736-a1d9-906b6df89ae4/20160310162824_00001.jpg,http://cnstlltn.com/master/41521179-3515-427b-a182-42b3d767c7f4/image4.png,,,,,,,,,,,,14/08/15,14/08/15,19/08/16,19/08/16,,,,,,,,,,,,,,,,,,,,,,,,,,,français,,,,,,,,,,,,,,,,,,,,,,,,,,,,,,,,,,,,,,,,,,,,,,,,,,,,,,,,,,,,,,,,,,,,,,,,,,,,,,,,,,,,,,,,,,,,,,,,,,,,,,,,,,,,,,,,,,,,,,,,,,,,,,,,,,
FMACHA0080011472,Concert Chorus,Fêtes et Manifestations,Musique,Concert,,,,,,,Salle des fêtes,,,8140,DOUZY,FRANCE,06 51 12 54 30 ,,,,,http://www.chorusblues.com,,49.66895,5.043642,,,,Concert Chorus,,,Concert à la salle des fêtes de Douzy.,,,,,,,,,,,,,,,,,http://cnstlltn.com/master/a292733a-5e10-4563-8c0a-0fd7f36f2873/jazz-199547_960_720.jpg,,,,,,,,,,,,,05/11/16,05/11/16,,,,,,,,,,,,,,,,,,,,,,,,,,,,,français,,,,,,,,,,,,,,,,,,,,,,,,,,,,,,,,,,,,,,,,,,,,,,,,,,,,,,,,,,,,,,,,,,,,,,,,,,,,,,,,,,,,,,,,,,,,,,,,,,,,,,,,,,,,,,,,,,,,,,,,,,,,,,,,,,
FMACHA0080005366,Concert d'art lyrique,Fêtes et Manifestations,Musique,Concert,,,Musique classique,,,,Place de Lattre de Tassigny,,,8300,RETHEL,FRANCE,03 24 39 51 46,,,,,,,49.51503,4.383214,,,,Concert d'art lyrique,,20h30 dans les salons d'honneur de l'Hôtel de ville,Récital piano et chant  du Moyen-Age à nos jours  des compositrices oubliées avec des oeuvres composées uniquement par des femmesEntrée : 12gratuit pour les moins de 12 ans,,,,,,,,,,,,,,,,,http://cnstlltn.com/master/9738453d-3f7a-443d-b3dc-a252ee2c9441/4149_001.jpg,,,,,,,,,,,,,22/04/16,22/04/16,,,,,,,,,,,,,,,,,,,,,,,,,,,,,français,,,,,,,,,,,,,,,,,,,,,,,,,,,,,,,,,,,,,,,,,,,,,,,,,,,,,,,,,,,,,,,,,,,,,,,,,,,,,,,,,,,,,,,,,,,,,,,,,,,,,,,,,,,,,,,,,,,,,,,,,,,,,,,,,,
FMACHA0080011001,Concert de Barklay James Arvest,Fêtes et Manifestations,Musique,Concert,,,,,,,Boulevard de la 4e armée,,,8300,RETHEL,FRANCE,03 24 39 51 46,,,,,,,49.51503,4.383214,,,,Concert de Barklay James Arvest,,,20h30 à l'AtmosphèreTarif : 40 ; tarif groupes : 36Un événement unique avec le groupe international qui sera en concert pour la première fois dans la région,,,,,,,,,,,,,,,,,http://cnstlltn.com/master/d8cc0e57-1217-4771-bceb-674dbaefe70f/affiche+prog+rethel+(1).jpg,http://cnstlltn.com/master/ebfbb6c8-dbf2-4cd2-8a5c-6bd5984be35b/index.jpg,,,,,,,,,,,,29/04/16,29/04/16,,,,,,,,,,,,,,,,,,,,,,,,,,,,,français,,,,,,,,,,,,,,,,,,,,,,,,,,,,,,,,,,,,,,,,,,,,,,,,,,,,,,,,,,,,,,,,,,,,,,,,,,,,,,,,,,,,,,,,,,,,,,,,,,,,,,,,,,,,,,,,,,,,,,,,,,,,,,,,,,
