ID,TITRE,TYPE,SSTYPE,CATEGORIE,STYLE,EVENEMENT,THEME1,THEME2,THEME3,RAISONSOCIALE,ADRESSE1,ADRESSE2,ADRESSE3,CODEPOSTAL,COMMUNE,PAYS,TEL1,TEL2,FAX,EMAIL1,EMAIL2,WEB1,WEB2,GPSX,GPSY,SIRET,APE,RCS,DESCRIPTIF_TITRE_FRANCAIS,DESCRIPTIF_SSTITRE_FRANCAIS,DESCRIPTIF_CHAPEAU_FRANCAIS,DESCRIPTIF_ARTICLE_FRANCAIS,DESCRIPTIF_TITRE_ANGLAIS,DESCRIPTIF_SSTITRE_ANGLAIS,DESCRIPTIF_CHAPEAU_ANGLAIS,DESCRIPTIF_ARTICLE_ANGLAIS,DESCRIPTIF_TITRE_ALLEMAND,DESCRIPTIF_SSTITRE_ALLEMAND,DESCRIPTIF_CHAPEAU_ALLEMAND,DESCRIPTIF_ARTICLE_ALLEMAND,DESCRIPTIF_TITRE_ESPAGNOL,DESCRIPTIF_SSTITRE_ESPAGNOL,DESCRIPTIF_CHAPEAU_ESPAGNOL,DESCRIPTIF_ARTICLE_ESPAGNOL,DESCRIPTIF_TITRE_ITALIEN,DESCRIPTIF_SSTITRE_ITALIEN,DESCRIPTIF_CHAPEAU_ITALIEN,DESCRIPTIF_ARTICLE_ITALIEN,PHOTO1,PHOTO2,PHOTO3,CLASSEMENT,LABEL1,LABEL2,LABEL3,ANIMAUX,HANDICAPE,TOURISME_HANDICAP1,TOURISME_HANDICAP2,TOURISME_HANDICAP3,TOURISME_HANDICAP4,DATEDU1,DATEAU1,DATEDU2,DATEAU2,DATEDU3,DATEAU3,DATEDU4,DATEAU4,DATEDU5,DATEAU5,CONTACT1TYPE,CONTACT1CIVI,CONTACT1NOM,CONTACT1PRENOM,CONTACT1FONCTION,CONTACT1EMAIL,CONTACT1TEL,CONTACT1FAX,CONTACT2TYPE,CONTACT2CIVI,CONTACT2NOM,CONTACT2PRENOM,CONTACT2FONCTION,CONTACT2EMAIL,CONTACT2TEL,CONTACT2FAX,CHAINE1,CHAINE2,CHAINE3,CHAINE4,LANGUE1,LANGUE2,LANGUE3,LANGUE4,LANGUE5,MODE_PAIEMENT1,MODE_PAIEMENT2,MODE_PAIEMENT3,MODE_PAIEMENT4,MODE_PAIEMENT5,MODE_PAIEMENT6,MODE_PAIEMENT7,MODE_PAIEMENT8,MODE_PAIEMENT9,MODE_PAIEMENT10,EQUIPEMENT1,EQUIPEMENT2,EQUIPEMENT3,EQUIPEMENT4,EQUIPEMENT5,EQUIPEMENT6,EQUIPEMENT7,EQUIPEMENT8,EQUIPEMENT9,EQUIPEMENT10,EQUIPEMENT11,EQUIPEMENT12,EQUIPEMENT13,EQUIPEMENT14,EQUIPEMENT15,EQUIPEMENT16,EQUIPEMENT17,EQUIPEMENT18,EQUIPEMENT19,EQUIPEMENT20,SERVICE1,SERVICE2,SERVICE3,SERVICE4,SERVICE5,SERVICE6,SERVICE7,SERVICE8,SERVICE9,SERVICE10,SERVICE11,SERVICE12,SERVICE13,SERVICE14,SERVICE15,SERVICE16,SERVICE17,SERVICE18,SERVICE19,SERVICE20,ACTIVITE1,ACTIVITE2,ACTIVITE3,ACTIVITE4,ACTIVITE5,CONFORT1,CONFORT2,CONFORT3,CONFORT4,CONFORT5,GROUPES_ACCEPTES,GROUPE_MAX,GROUPE_MIN,NBRE_SALLE_REUNION,NBRE_PERSONNES_SALLE,SUPERFICIE_SALLE,TARIF1_LIBELLE,TARIF1_MIN,TARIF1_MAX,TARIF2_LIBELLE,TARIF2_MIN,TARIF2_MAX,TARIF3_LIBELLE,TARIF3_MIN,TARIF3_MAX,TARIF4_LIBELLE,TARIF4_MIN,TARIF4_MAX,TARIF5_LIBELLE,TARIF5_MIN,TARIF5_MAX,TARIF6_LIBELLE,TARIF6_MIN,TARIF6_MAX,TARIF7_LIBELLE,TARIF7_MIN,TARIF7_MAX,TARIF8_LIBELLE,TARIF8_MIN,TARIF8_MAX,TARIF9_LIBELLE,TARIF9_MIN,TARIF9_MAX,TARIF10_LIBELLE,TARIF10_MIN,TARIF10_MAX,TARIF11_LIBELLE,TARIF11_MIN,TARIF11_MAX,TARIF12_LIBELLE,TARIF12_MIN,TARIF12_MAX,TARIF13_LIBELLE,TARIF13_MIN,TARIF13_MAX,TARIF14_LIBELLE,TARIF14_MIN,TARIF14_MAX,TARIF15_LIBELLE,TARIF15_MIN,TARIF15_MAX,TARIF16_LIBELLE,TARIF16_MIN,TARIF16_MAX,TARIF17_LIBELLE,TARIF17_MIN,TARIF17_MAX,TARIF18_LIBELLE,TARIF18_MIN,TARIF18_MAX,TARIF19_LIBELLE,TARIF19_MIN,TARIF19_MAX,TARIF20_LIBELLE,TARIF20_MIN,TARIF20_MAX
FMACHA0080003166, fête de la Pentecôte et Brocante,Fêtes et Manifestations,Animation locale,Brocante,,,,,,,,Centre village,,8230,REGNIOWEZ,FRANCE,324541406,,,,,,,49.93706,4.429829,,,,Brocante et vide grenier,Regniowez dans les rues du village de 6h à 19h,,Fête et brocante les 3 jours du week end de Pentecôte de 9h à 22h.,,,,,,,,,,,,,,,,,http://cnstlltn.com/master/78116e4c-c409-40b0-9b11-760e3dc13db2/78116e4c-c409-40b0-9b11-760e3dc13db2_134.jpg,,,,,,,,,,,,,15/05/16,15/05/16,,,,,,,,,,,,,,,,,,,,,,,,,,,,,français,,,,,,,,,,,,,,,Aire de pique-nique,Parking,Salle d'animation,,,,,,,,,,,,,,,,,,Circuits touristiques,Espace jeux,Visite gratuite,,,,,,,,,,,,,,,,,,,,,,,Point d'eau potable,,,,,,,,,,,,,,,,,,,,,,,,,,,,,,,,,,,,,,,,,,,,,,,,,,,,,,,,,,,,,,,,,,,,,,
FMACHA0080010425, Marche Populaire Internationale,Fêtes et Manifestations,,Randonnée,,,,,,,,,,8150,AUBIGNY LES POTHEES,FRANCE,03.24.35 85 44,,,contact@ffsp.fr,,http://www.ffsp.fr,,49.77666,4.434973,,,,Marche populaire internationale,,Parcours de 10 et 20km et parcours adapté,Les départs s 'effectuent à partir de la salle à partir de 8 heures et jusque 14h. restauration et buvette sur place.,,,,,,,,,,,,,,,,,http://cnstlltn.com/master/280481a5-7e80-4495-ae52-f6afa01b8009/dsc02888fourmie77.jpg,,,,,,,,,,,,,24/04/16,24/04/16,,,,,,,,,,,,,,,,,,,,,,,,,,,,,français,,,,,Espèces,,,,,,,,,,Parking,Salle d'animation,,,,,,,,,,,,,,,,,,,Bar,,,,,,,,,,,,,,,,,,,,,,,,,,,,,,,,,,,,participant,2.00,2.00,,,,,,,,,,,,,,,,,,,,,,,,,,,,,,,,,,,,,,,,,,,,,,,,,,,,,,,,,
FMACHA0080000832, Fromage de chèvre  à la ferme pédagogique de Liart,Fêtes et Manifestations,Nature et détente,Jeux,,,Animaux,,,,,Ferme Pédagogique de Liart,,8290,LIART,FRANCE,324544833,,324544501,maison.thierache.08@wanadoo.fr,,http://www.ardennesmaisonnature.com,http://www.fermepedagogiqueliart.fr,49.76944,4.339847,,,,Fromage de chèvre à la ferme pédagogique de Liart,les mercredis pendant les vacances scolaires ,,La traite manuelle vous effectuerez et les différentes étapes de fabrication vous découvrirez. L'aprés midi de 14h à 17h suivit d'une collation offerte avec tout le groupeRéservation obligatoire et possible jusqu'au jour même.Les enfants sont obligatoirement accompagnés d'un adulte.,,,,,,,,,,,,,,,,,http://cnstlltn.com/master/d81207f0-26ae-4071-8877-aca2ab51194f/d81207f0-26ae-4071-8877-aca2ab51194f_134.jpg,,,,,,,,,,,,,06/04/16,06/04/16,13/07/16,13/07/16,27/07/16,27/07/16,10/08/16,10/08/16,24/08/16,24/08/16,,,,,,,,,,,,,,,,,,,,,français,,,,,Chèques,Chèques bancaires et postaux,Espèces,,,,,,,,Aire de pique-nique,Parking,Sur une exploitation agricole,,,,,,,,,,,,,,,,,,Bar,Circuits touristiques,Commerces 1ère nécessité,Médecin,Vente de produits touristiques,Vestiaire,Visites pédagogiques,,,,,,,,,,,,,,,,,,,Point d'eau potable,,,,,Y,,,,,,enfant,0.00,4.00,adulte,0.00,7.50,,,,,,,,,,,,,,,,,,,,,,,,,,,,,,,,,,,,,,,,,,,,,,,,,,,,,,
FMACHA0080011926, La Regal'Balade ,Fêtes et Manifestations,,,,,,,,,,,,8460,LALOBBE,FRANCE,03 24 35 02 69,,,ot.cretes@orange.fr,,http://www.sud-ardennes-tourisme.com,,49.66794,4.375314,,,, La Regal'Balade ,,de 14h à 21h,"Balade commentée et gourmande avec visite et dégustation de produits du terroir sous forme d'une veillée nocturne.Balade : 2Balade + repas du terroir : 14Places limitées, réservation obligatoire auprès de l'Office de Tourisme.",,,,,,,,,,,,,,,,,http://cnstlltn.com/master/5c3ce2fc-a355-43d0-8633-c00b342d978e/balade.jpg,,,,,,,,,,,,,26/08/16,26/08/16,,,,,,,,,,,,,,,,,,,,,,,,,,,,,français,,,,,,,,,,,,,,,,,,,,,,,,,,,,,,,,,,,,,,,,,,,,,,,,,,,,,,,,,,,,,,,,,,,,,,,,,,,,,,,,,,,,,,,,,,,,,,,,,,,,,,,,,,,,,,,,,,,,,,,,,,,,,,,,,,
FMACHA0080000182,11e  La Junivilloise ,Fêtes et Manifestations,Manifestation sportive,Compétition sportive,,,Course à pied,,,,,,,8310,JUNIVILLE,FRANCE,03 24 72 70 28,,,ch-cogniard@orange.fr,,http://piedaretourne.clubeo.com,,49.39732,4.38072,,,,11e  La Junivilloise ,,Départ : 10h de la course adultes,Course adultes de 10 km et la course découverte pour les jeunes et débutants de 3 kmTarif d'inscription : 10,,,,,,,,,,,,,,,,,http://cnstlltn.com/master/e5c7948b-1a2a-4e90-ba65-dc6e94f15189/junivilloise_2014_otpr+(9).jpg,http://cnstlltn.com/master/46140f6e-72ac-4740-9422-96f3bb540697/junivilloise_2014_otpr+(192).jpg,http://cnstlltn.com/master/b6df1188-a175-427b-ad67-cffe862aaa18/junivilloise_2014_otpr+(228).jpg,,,,,,,,,,,16/05/16,16/05/16,,,,,,,,,,,,,,,,,,,,,,,,,,,,,français,,,,,,,,,,,,,,,,,,,,,,,,,,,,,,,,,,,,,,,,,,,,,,,,,,,,,,,,,,,,,,,,,,,,,,,,,,,,,,,,,,,,,,,,,,,,,,,,,,,,,,,,,,,,,,,,,,,,,,,,,,,,,,,,,,
FMACHA0080001490,12° Eco-festival rock Cabaret Vert,Fêtes et Manifestations,Musique,Festival,,,Bande dessinée,"Pop musique (rock, pop, rap, ...)",Théâtre de rue,,Avenue Louis Tirman,, ,8000,CHARLEVILLE MEZIERES,FRANCE,03 24 36 12 68,,,,,www.cabaretvert.com,,49.76136,4.71813,,,,12° Eco-festival rock Cabaret Vert,,Pass 4 jours pour les fans à 70 (hors camping) au lieu de 80 : offre valable jusqu'au 16 janvier -,"Personne naurait osé limaginer il y a 12 ans, mais lhistoire continue de sécrire de la plus belle des manières pour le Cabaret Vert : plus de 85 000 entrées en 2015 pour un festival hors-normes où communient tous les amoureux de la musique actuelle, de 7 à 107 ans ! Jusqu'à 4 générations d'une même famille quelquefois se retrouvent dans un festival hyper-supra-mega convivial et festif !Pour sa 12ème édition, l'Eco Festival Rock et Territoire va encore frapper fort avec une programmation ébouriffante ! Programme en cours d'élaboration !",,,,,,,,,,,,,,,,,http://cnstlltn.com/master/0a8281e8-e2d1-4e33-8bb8-701b11bc1fdb/cabaret+vert+2016.png,,,,,,,,Accès handicapés,,,,,25/08/16,28/08/16,,,,,,,,,Association,,SAUVAGE,Julien,,info@cabaretvert.com,03 24 41 87 83,,Autres,,SAUVAGE,Julien,,,,,,,,,,,,,,,,,,,,,,,,,,,,,,,,,,,,,,,,,,,,,,,,,,,,,,,,,,,,,,,,,,,,,,,,,,,,,,,,,,,,,,,,,,,,,,,,,,,,,,,,,,,,,,,,,,,,,,,,,,,,,,,,,,,,,,,,,,,
FMACHA0080010289,13e course d'endurance moto-rétro,Fêtes et Manifestations,Manifestation sportive,Compétition sportive,,,,,,,Promenade des Isles,,,8300,RETHEL,FRANCE,,,,,,,,49.51503,4.383214,,,,13e course d'endurance de moto rétro,,samedi de 16h à 22h et dimanche de 10h à 16h aux Promenades des Isles,2 x 6 heures,,,,,,,,,,,,,,,,,http://cnstlltn.com/master/656f9903-80bd-4d40-867d-eddd7139fcc9/pict0323.jpg,,,,,,,,,,,,,16/04/16,17/04/16,,,,,,,,,,,,,,,,,,,,,,,,,,,,,français,,,,,,,,,,,,,,,,,,,,,,,,,,,,,,,,,,,,,,,,,,,,,,,,,,,,,,,,,,,,,,,,,,,,,,,,,,,,,,,,,,,,,,,,,,,,,,,,,,,,,,,,,,,,,,,,,,,,,,,,,,,,,,,,,,
FMACHA0080005686,15e Concours complet d'équitation de la ville de Rethel,Fêtes et Manifestations,Manifestation sportive,Compétition sportive,,,,,,,Promenades des Isles,,,8300,RETHEL,FRANCE,03 24 38 52 87,,,contact@ahfc-rethel.fr,,http://www.ahfc-rethel.fr,,49.51503,4.383214,,,,15e Concours complet d'équitation de la ville de Rethel,,De 9h à 19h Promenade des Isles,"Ce parcours est reconnu parmi les plus beaux! Épreuves amateurs (trot et élevage), épreuves de club au complet et un concours de sauts dobstacles.",,,,,,,,,,,,,,,,,http://cnstlltn.com/master/9e37bc90-236a-400e-b06f-641f990ae713/concours_complet_2012_otpr+(186).jpg,,,,,,,,,,,,,06/06/15,07/06/15,15/05/16,15/05/16,,,,,,,,,,,,,,,,,,,,,,,,,,,français,,,,,,,,,,,,,,,,,,,,,,,,,,,,,,,,,,,,,,,,,,,,,,,,,,,,,,,,,,,,,,,,,,,,,,,,,,,,,,,,,,,,,,,,,,,,,,,,,,,,,,,,,,,,,,,,,,,,,,,,,,,,,,,,,,
FMACHA0080004060,15e Festival du conte,Fêtes et Manifestations,Manifestation Culturelle,Spectacle,,,,,,,,,,8300,RETHEL,FRANCE,03 24 39 51 46,03 24 30 50 59,,,,,,49.50887,4.365349,,,,15e Festival du conte,,,"Un café de philosophie, spectacles de contes sont organisés dans des lieux conviviaux de Rethel comme les cafés, les bars, les brasseries et le théâtre.",,,,,,,,,,,,,,,,,http://cnstlltn.com/master/f86be1f4-1fab-42dc-b1c6-8cbd7c77063d/3_festival_conte_+2015_au_marcassin_otpr+(2)r.jpg,,,,,,,,,,,,,17/11/16,20/11/16,,,,,,,,,,,,,,,,,,,,,,,,,,,,,français,,,,,,,,,,,,,,,,,,,,,,,,,,,,,,,,,,,,,,,,,,,,,,,,,,,,,,,,,,,,,,,,,,,,,,,,,,,,,,,,,,,,,,,,,,,,,,,,,,,,,,,,,,,,,,,,,,,,,,,,,,,,,,,,,,
FMACHA0080004770,16e Fête des enfants,Fêtes et Manifestations,Animation locale,Jeune public,,,,,,,,,,8300,NANTEUIL SUR AISNE,FRANCE,06 14 27 16 52,,,nanteuilanimation08@gmail.com,,http://fete-des-enfants-nanteuil.fr,,49.49939,4.29706,,,,16e Fête des enfants ,,De 10h à 18h dans les rues du village.,"Avec un passeport à 6 (tarif 2015), les enfants ont au choix plus de 80 ateliers à leur disposition : poneys, canoë-kayak, tir à l'arc, course de poissons rouges, jeux gonflables, badminton, ateliers de poterie, marionnettes, perles et bien d'autres . Restauration-buvette et brocante",,,,,,,,,,,,,,,,,http://cnstlltn.com/master/b0243f62-1f3f-4869-9f28-4cb5050317c2/fete_enfants_2015_otpr+(430)r.jpg,,,,,,,,,,,,,11/09/16,11/09/16,,,,,,,,,,,,,,,,,,,,,,,,,,,,,français,,,,,,,,,,,,,,,,,,,,,,,,,,,,,,,,,,,,,,,,,,,,,,,,,,,,,,,,,,,,,,,,,,,,,,,,,,,,,,,,,,,,,,,,,,,,,,,,,,,,,,,,,,,,,,,,,,,,,,,,,,,,,,,,,,
FMACHA0080012049,17ème Randonnée,Fêtes et Manifestations,Manifestation sportive,Randonnée,,,Randonnée,Sport cycliste,,,Salle des Fêtes,,,8090,FAGNON,FRANCE,03 24 52 42 28,,,ml.valtier@orange.fr,,,,49.73542,4.636675,,,,17ème Randonnée,,Accessible à tous les niveaux aux alentours de Fagnon,"3 parcours VTT de 15, 30, et 40 km environ2 parcours pédestres de 10 et 15 km environ. Départs libres de 8h à 10 h à Salle des Fêtes.Plusieurs ravitaillements sont prévus.",,,,,,,,,,,,,,,,,http://cnstlltn.com/master/b3ca5720-79ce-455d-acf1-9c634fc722cc/randonnee.jpg,http://cnstlltn.com/master/b0ee8129-dc27-4658-b3c4-84d796ff8c50/rando+velo.jpg,,,,,,,,,,,,17/04/16,17/04/16,,,,,,,,,,,,,,,,,,,,,,,,,,,,,français,,,,,,,,,,,,,,,,,,,,,,,,,,,,,,,,,,,,,,,,,,,,,,,,,,,,,,,,,,,,,,,,,,,,,,,,,,,,,,,,,,,,,,,,,,,,,,,,,,,,,,,,,,,,,,,,,,,,,,,,,,,,,,,,,,
FMACHA0080011790,18ème Rando des Pommes ,Fêtes et Manifestations,,,,,,,,,,,,8130,SUZANNE,FRANCE,,,,ot.cretes@orange.fr,,,,49.51707,4.634823,,,,18ème Rando des Pommes,,"de 8h à 12h, à la place Saint Barthelemy",Vous pouvez participer à la 18ème Rando des Pommes pour seulement 2 par personne!,,,,,,,,,,,,,,,,,http://cnstlltn.com/master/8e7d62c2-b450-4d39-a7fe-5ad307faa90a/pomme.jpg,,,,,,,,,,,,,25/09/16,25/09/16,,,,,,,,,,,,,,,,,,,,,,,,,,,,,français,,,,,,,,,,,,,,,,,,,,,,,,,,,,,,,,,,,,,,,,,,,,,,,,,,,,,,,,,,,,,,,,,,,,,,,,,,,,,,,,,,,,,,,,,,,,,,,,,,,,,,,,,,,,,,,,,,,,,,,,,,,,,,,,,,
FMACHA0080010770,1er Bike and Run,Fêtes et Manifestations,Manifestation sportive,Compétition sportive,,,,,,,Place ,,,8230,ROCROI,FRANCE,,,,,,,,49.92891,4.529608,,,,Bike and Run Rocroy,11/09/16,Organisée par Rocroi sports nature,"Le 2em Bike&Run des Remparts aura lieu le dimanche 11 septembre à Rocroy (une organisation de Rocroi Sports Nature) * Départ course Jeunes à 14h * Départ course Confirmé (2e manche du challenge ardennais) à 14h30  et * Départ Course Découverte 30s plus tard N'hésitez pas à venir participer. Le parcours est déjà tracé, il est magnifique... Au coeur des remparts (lieu atypique pour les compétiteurs et pour les spectateurs), le spectacle s'annonce splendide....",,,,,,,,,,,,,,,,,http://cnstlltn.com/master/3c7289ba-5025-4d9b-8970-26c004c2d6ef/t%c3%a9l%c3%a9chargement+(1).png,,,,,,,,,,,,,11/09/16,11/09/16,,,,,,,,,,,,,,,,,,,,,,,,,,,,,français,,,,,,,,,,,,,,,,,,,,,,,,,,,,,,,,,,,Bar,,,,,,,,,,,,,,,,,,,,,,,,,,,,,,,,,,,,,,,,,,,,,,,,,,,,,,,,,,,,,,,,,,,,,,,,,,,,,,,,,,,,,,,,,,,,,,,
FMACHA0080011563,20 ème Enduro + les 30 ans du club motocycliste,Fêtes et Manifestations,Manifestation sportive,Compétition sportive,,,,,,,,,,8230,ROCROI,FRANCE, 03.24.54.11.17,,,,,,,49.92316,4.520916,,,,20ème Enduro du Plateau de Rocroi,Dans les remparts de la ville et les villages autour,Marché aux Fleurs et produits du terroir et restauration toute la journée dans la ville.,"Près de 600 pilotes sont inscrits pour le 20e enduro du Plateau de Rocroi Une fois de plus, léquipe du Moto club du Plateau de Rocroi (MCPR) a tout mis en uvre pour que cette édition soit une réussite tant sportive quau niveau de la vie associative. Le spectacle dans les spéciales chronométrées sera au rendez-vous Cette épreuve de régularité tout terrain, organisée sous légide de la Fédération française de motocyclisme (FFM), se déroulera sur un tracé de plus de 150 km  Lentrée est totalement gratuite quel que soit lendroit. Pour tout renseignement, sadresser à Richard Huet au 03.24.54.11.17 ou 06.23.25.07.17. Déroulement de lépreuve  A partir de 8 h, les pilotes sélanceront 4 par 4 toutes les minutes à Mon Idée.  Première spéciale chronométrée en ligne à partir de 8 h 05 et jusque 18 h. Les pilotes devront franchir des obstacles artificiels. Du beau spectacle en perspective.",,,,,,,,,,,,,,,,,http://cnstlltn.com/master/eb2af8a4-ad40-47d5-a088-0ae4adf62553/enduro.jpg,http://cnstlltn.com/master/9c86f517-439e-43c9-b076-c15246aebbe6/1432814459_resized_219.jpg,,,,,,,,,,,,22/05/16,22/05/16,,,,,,,,,,,,,,,,,,,,,,,,,,,,,français,,,,,,,,,,,,,,,Salle d'animation,,,,,,,,,,,,,,,,,,,,Bar,Circuits touristiques,Commerce alimentaire,Espace jeux,Plats à emporter/Plats cuisinés,,,,,,,,,,,,,,,,,,,,,,,,,,,,,,,,,,,,,,,,,,,,,,,,,,,,,,,,,,,,,,,,,,,,,,,,,,,,,,,,,,,,,,,,,,,
FMACHA0080006791,20ème nuit de la chauve souris ,Fêtes et Manifestations,,Conférence,,,,,,,,,,8290,RUMIGNY,FRANCE,03 24 42 90 57,,,,,,,49.81694,4.53495,,,,20ème nuit de la Chauve Souris , de 20h à 22h30,Place limité inscription obligatoire,Organisé par les associations ReNard et PNR prévoir une lampe de poche.,,,,,,,,,,,,,,,,,http://cnstlltn.com/master/01bee0c3-ee98-46c0-bf92-5e96f2862607/ch+souris.png,http://cnstlltn.com/master/aefc8285-2b27-401b-b27b-21cf1cbcbdc9/nuit+chauve+souris.jpg,,,,,,,,,,,,20/08/16,20/08/16,,,,,,,,,,,,,,,,,,,,,,,,,,,,,français,,,,,,,,,,,,,,,,,,,,,,,,,,,,,,,,,,,Visite gratuite,,,,,,,,,,,,,,,,,,,,,,,,,,,,,,,,,,,,,,,,,,,,,,,,,,,,,,,,,,,,,,,,,,,,,,,,,,,,,,,,,,,,,,,,,,,,,,,
FMACHA0080000720,22ème Brocante de Mohon,Fêtes et Manifestations,Manifestation commerciale,Brocante,,,,,,,Place de Mohon,,,8000,CHARLEVILLE MEZIERES,FRANCE,,,,,,,,49.75249,4.731442,,,,22ème Brocante de Mohon,La plus grande et la plus animée des brocantes ardennaises,Rendez-vous incontournable de la rentrée! A partir de 9h jusqu'à 19h00,"Organisée par l'Association Mohon Commerce Artisanat. Près de 350 exposants! Cette brocante est le rendez-vous incontournable des ardennais et de nos visiteurs étrangers grands amateurs de brocantes au coeur de l'ancien centre ville de Mohon dite  la cheminote , aujourd'hui quartier de Charleville-Mézières. Au pied de la magnifique église classée du 16° siècle Saint-Lié et dans les anciennes rues de cette ville où les 3/4 des habitants fin XIX° étaient cheminots, on peut y chiner de nombreux objets anciens introuvables ailleurs : pipes gambier de Givet, bocks des anciennes brasseries ardennaises.... La pièce rare ne se livre qu'aux lève-tôts ! Une super ambiance avec de nombreuses animations : musique, orgues de barbarie, démonstrations sportives et autres gourmandises à déguster toute la journée.",,,,,,,,,,,,,,,,,http://cnstlltn.com/master/064a9d43-88dc-498d-9396-0e002ac9fcf7/brocante+de+mohon.jpg,http://cnstlltn.com/master/1dbc7ea7-a2d1-4be2-938d-76a63e354159/brocante_de_mohon2010.jpg,,,,,,,,,,,,04/09/16,04/09/16,,,,,,,,,,,,,,,,,,,,,,,,,,,,,français,,,,,,,,,,,,,,,,,,,,,,,,,,,,,,,,,,,,,,,,,,,,,,,,,,,,,,,,,,,,,,,,,,,,,,,,,,,,,,,,,,,,,,,,,,,,,,,,,,,,,,,,,,,,,,,,,,,,,,,,,,,,,,,,,,
FMACHA0080008113,24h d'Endurance Tondeuses,Fêtes et Manifestations,Animation locale,Concours,,,,,,,Domaine de Gravanne,,,8390,LES PETITES ARMOISES,FRANCE,06 18 69 38 54 ,06 08 93 07 62,,ludivine.prevot@orange.fr,jraguet@wanadoo.fr,,,49.49947,4.828212,,,,24h d'Endurance Tondeuse,,du samedi à 16h au dimanche à 16h,24h de compétition de tracteurs-tondeusesBénédiction 15 h15 - Brocante pendant 24h - Présence des producteurs locaux - Expositions diverses - Animations - Jeux pour enfants - Feu d'artifice le soir à 23h.Buvette et petite restauration sur place. Organisée par Armoises 4x4,,,,,,,,,,,,,,,,,http://cnstlltn.com/master/933155a5-d9b0-4550-9584-c0da79ab708c/24h_endurance_des_tracteurs_tondeuses_.jpg,,,,,,,,,,,,,14/05/16,15/05/16,,,,,,,,,,,,,,,,,,,,,,,,,,,,,français,,,,,,,,,,,,,,,,,,,,,,,,,,,,,,,,,,,Gratuit,,,,,,,,,,,,,,,,,,,,,,,,,,,,,,,,,,,,,,,,,,,,,,,,,,,,,,,,,,,,,,,,,,,,,,,,,,,,,,,,,,,,,,,,,,,,,,,
FMACHA0080010614,24h des Tracteurs Tondeuses,Fêtes et Manifestations,Manifestation sportive,Compétition sportive,,,,,,,,,,8140,DAIGNY,FRANCE,,,,,,,,49.70638,5.092698,,,,24h des Tracteurs Tondeuses,,,"Un évènement qui attire des passionnés de la discipline venu de toute l'Europe.2015 : Victoire Germano-Suisse2014 : Victoire anglaiseEn plus de la course des 24h de tracteurs tondeuses, retrouvez de nombreuses animations :Démonstrations de quads, de 4x4 et de RC crawling (véhicules 4x4 radiocommandés) exposition de voitures anciennes, marche et parcours VTT, paintball, airsoft...",,,,,,,,,,,,,,,,,http://cnstlltn.com/master/a7d12916-7b31-4ee2-9b73-484ad0b864b7/daigny.jpg,,,,,,,,,,,,,14/05/16,15/05/16,,,,,,,,,,,,,,,,,,,,,,,,,,,,,français,,,,,,,,,,,,,,,,,,,,,,,,,,,,,,,,,,,,,,,,,,,,,,,,,,,,,,,,,,,,,,,,,,,,,,,,,,,,,,,,,,,,,,,,,,,,,,,,,,,,,,,,,,,,,,,,,,,,,,,,,,,,,,,,,,
FMACHA0080011754,25ème concours d'Attelage de Boulzicourt,Fêtes et Manifestations,,,,,,,,,Rue du Moulin,,,8410,BOULZICOURT,FRANCE,03 24 53 75 70,,,,,,,49.69175,4.6979,,,,25ème Concours d'Attelage de Boulzicourt,,Samedi 17 juillet (10h-20h) et dimanche 18 juillet (9h-17h),"Entrée Gratuite : dressage et maniabilité attelée, spectacle équestre, maniabilité.Restauration sur place.",,,,,,,,,,,,,,,,,http://cnstlltn.com/master/1b75566a-550e-4b7a-a754-ff087edaa52d/cheval.jpg,,,,,,,,,,,,,16/07/16,17/07/16,,,,,,,,,,,,,,,,,,,,,,,,,,,,,français,,,,,,,,,,,,,,,,,,,,,,,,,,,,,,,,,,,,,,,,,,,,,,,,,,,,,,,,,,,,,,,,,,,,,,,,,,,,,,,,,,,,,,,,,,,,,,,,,,,,,,,,,,,,,,,,,,,,,,,,,,,,,,,,,,
FMACHA0080000896,28e Foulées rethéloises,Fêtes et Manifestations,Manifestation sportive,Compétition sportive,,,Course à pied,,,,,,,8300,RETHEL,FRANCE,03 24 38 10 54,03 24 72 43 25,,roland.larnaudie@wanadoo.fr,jean-luc.lesage7@wanadoo.fr,http://www.foulees-retheloises.com,,49.51503,4.383214,,,,28e Foulées rethéloises,,,11h00 départ de la course jeunes15h00 départ course adultes,,,,,,,,,,,,,,,,,http://cnstlltn.com/master/a67bf900-beb6-45eb-ae84-550421e834b1/foulees_2012_otpr+(195).jpg,,,,,,,,,,,,,06/11/16,06/11/16,,,,,,,,,,,,,,,,,,,,,,,,,,,,,français,,,,,,,,,,,,,,,,,,,,,,,,,,,,,,,,,,,,,,,,,,,,,,,,,,,,,,,,,,,,,,,,,,,,,,,,,,,,,,,,,,,,,,,,,,,,,,,,,,,,,,,,,,,,,,,,,,,,,,,,,,,,,,,,,,
FMACHA0080011598,2ème Expo Puces motos et autos,Fêtes et Manifestations,Fête et Tradition,Brocante,,,Sports mécaniques,,,,Promenade des remparts,,,8000,WARCQ,FRANCE,,,,m-cwarcqlessangliers@live.fr,,,,49.76941,4.679233,,,,2ème Expo Puces motos et autos,,samedi de 14h à 20h - Dimanche de 8h à 18h - organisé par le Moto-Club de Warcq  les Sangliers  - entrée gratuite,+ de 200 véhicules auto-moto exposés - dépoôt-ventetombola - animations - concert gratuit - buvette et restauration,,,,,,,,,,,,,,,,,http://cnstlltn.com/master/69803086-2bc9-4423-87a5-58dde2b34a3b/bourse+moto.jpg,,,,,,,,,,,,,07/05/16,08/05/16,,,,,,,,,,,,,,,,,,,,,,,,,,,,,français,,,,,,,,,,,,,,,,,,,,,,,,,,,,,,,,,,,,,,,,,,,,,,,,,,,,,,,,,,,,,,,,,,,,,,,,,,,,,,,,,,,,,,,,,,,,,,,,,,,,,,,,,,,,,,,,,,,,,,,,,,,,,,,,,,
FMACHA0080003157,3 Stages de théâtre Ludus,Fêtes et Manifestations,Manifestation Culturelle,Théâtre,,,,,,,22 Avenue Jean Jaurès,Salle du Forum,,8000,CHARLEVILLE MEZIERES,FRANCE,03 10 07 55 32,,,,,,,49.77016,4.721742,,,,3 Stages de théâtre Ludus,,salle du Forum - sur inscription - direction : Bruno Nion,"Stage pour enfants et pré-adolescents animé par Fabrice Ricard : du mardi au vendredi 15 avril de 9h à 12hStage pour adolescents animé par Geneviève Eloire : du mardi 12 au vendredi 15 avril de 14h à 17hStage pour adultes animé par Dominique Mercier, comédienne et metteur en scène : du samedi 16 au dimanche 17 avril de 9h à 12h et de 14h à 17h",,,,,,,,,,,,,,,,,http://cnstlltn.com/master/e2e02b55-d801-41c8-930e-97110ef3fbea/stage+ludus.jpg,,,,,,,,Accès handicapés,,,,,12/04/16,17/04/16,,,,,,,,,,,,,,,,,,,,,,,,,,,,,français,,,,,,,,,,,,,,,,,,,,,,,,,,,,,,,,,,,,,,,,,,,,,,,,,,,,,,,,,,,,,,,,,,,,,,,,,,,,,,,,,,,,,,,,,,,,,,,,,,,,,,,,,,,,,,,,,,,,,,,,,,,,,,,,,,
FMACHA0080009736,30ème Randonnée du Plateau de Rocroy,Fêtes et Manifestations,Manifestation sportive,Compétition sportive,,,,,,,Salle polyvalente,,,8260,AUVILLERS LES FORGES,FRANCE,324543272,,,castaignede.monique@orange.fr,,,,49.86308,4.358217,,,,31ème randonnée du plateau de Rocroy,Avec le Chateau vert cyclotourisme,"30, 60, 90 et 120km sur route",Départs : 7h30 à 10h,,,,,,,,,,,,,,,,,http://cnstlltn.com/master/a507a924-a057-434e-bd90-aacd275e6ed7/110503_142424.jpg,,,,,,,,,,,,,04/09/16,04/09/16,,,,,,,,,,,,,,,,,,,,,,,,,,,,,français,,,,,,,,,,,,,,,Parking,Salle d'animation,,,,,,,,,,,,,,,,,,,Bar,,,,,,,,,,,,,,,,,,,,,,,,,,,,,,,,,,,,,,,,,,,,,,,,,,,,,,,,,,,,,,,,,,,,,,,,,,,,,,,,,,,,,,,,,,,,,,,
FMACHA0080004745,31e Course de voitures à pédales,Fêtes et Manifestations,Animation locale,Fête de village,,,Automobile,Sport cycliste,,,,,,8300,AMAGNE,FRANCE,06 28 36 55 47,,,vap@amagne.fr,,http://www.amagne.fr,,49.51711,4.504982,,,,31e Course de voitures à pédales,,"Départ de la course 15h30 , arrivée 18h30.",Thème : les animaux de la fermeUne quarantaine de voitures plus farfelues les unes que les autres font la course dans les rues dAmagneRestauration à partir de 11h30,,,,,,,,,,,,,,,,,http://cnstlltn.com/master/ddf86229-48ff-4ec6-9a68-6b82eb7b1113/voitures_pedales_2013_otpr+(86).jpg,,,,,,,,,,,,,15/05/16,15/05/16,,,,,,,,,,,,,,,,,,,,,,,,,,,,,français,,,,,,,,,,,,,,,,,,,,,,,,,,,,,,,,,,,,,,,,,,,,,,,,,,,,,,,,,,,,,,,,,,,,,,,,,,,,,,,,,,,,,,,,,,,,,,,,,,,,,,,,,,,,,,,,,,,,,,,,,,,,,,,,,,
