FMACHA0080011891,Musée du Linge : Saison 2016,Fêtes et Manifestations,Traditions et folklore,Exposition,,,,,,,2 rue des Bateliers et 21 rue Roger Salengro,Musée du Linge,,8090,MONTCY NOTRE DAME,FRANCE,03 24 36 09 90,,,,,,,49.7887,4.743855,,,,Musée du Linge : Saison 2016,,ouvert tous les dimanches du 29 mai au 25 septembre - ouvert sur rendez-vous toute l'année - durée : 1h30,"Créé en 1990 par la municipalité, soucieuse de préserver un patrimoine historique, le musée du linge retrace la vie collective des Montcéens durant un siècle et demi. Dans une ambiance d'autrefois, il expose l'évolution matérielle du lavage, du repassage et de la confection du linge en hommage aux  poules d'eau , les lavandières qui lavaient le linge des bourgeois de Charleville au XIX° siècle.Ouvertures exceptionnelles : - le dimanche 10 avril, de 14h45 à 17h30- jeudi 5 mai, de 9h à 17h (Salle du linge)- vendredi 16 septembre,de 14h45 à 17h30 (Musée machines)- vendredi 16 septembre, de 9h à 10h (Salle du linge)- samedi 17 septembre, de 14h45 à 17h30",,,,,,,,,,,,,,,,,http://cnstlltn.com/master/72d5f217-033b-4c5e-a0c7-ea5ff23baada/saison+2016+mus%c3%a9e+du+linge.jpg,,,,,,,,,,,,,29/05/16,29/05/16,05/06/16,05/06/16,12/06/16,12/06/16,19/06/16,19/06/16,26/06/16,26/06/16,,,,,,,,,,,,,,,,,,,,,français,,,,,,,,,,,,,,,,,,,,,,,,,,,,,,,,,,,Visites individuelles libres,Visites guidées,Visites groupes guidées,,,,,,,,,,,,,,,,,,,,,,,,,,,,Y,20,10,,,,groupe,1.50,1.50,tarif adulte,2.00,2.00,tarif - de 3 ans,0.00,0.00,tarif de 3 à 8 ans,0.50,0.50,tarif de 8 à 16 ans,1.00,1.00,,,,,,,,,,,,,,,,,,,,,,,,,,,,,,,,,,,,,,,,,,,,,
FMACHA0080002288,Nuit Blanche 2016,Fêtes et Manifestations,Manifestation Culturelle,Portes ouvertes,,,Art lyrique,Cinéma,Fanfares bandas,,,,,8000,CHARLEVILLE MEZIERES,FRANCE,0324324440 (Service Action Culturelle),,,culture@mairie-charlevillemezieres.fr,,http://www.charleville-mezieres.fr,,49.77361,4.72021,,,,Nuit Blanche 2016,,La plus folle des nuits carolomacériennes - de 19h00 à 2h du matin -,"Les lieux les plus insolites de la ville sont investis par les artistes : cours, parkings, piscine, gare ou toilettes publiques sont transformés le temps d'une soirée de doux-dingues en lieux artistiques de grande qualité. La culture est à tous les étages , de préférence en décalage avec les lieux traditionnels. Attention : courir d'un lieu à l'autre ce soir-là relève de la performance sportive ! Ne manquez pas cet évènement unique, gratuit et ouvert à tous ! Nombreux projets artistiques contemporains sont au programme.",,,,,,,,,,,,,,,,,http://cnstlltn.com/master/285b55ec-58a8-411d-91ac-5231c784c735/285b55ec-58a8-411d-91ac-5231c784c735_134.jpg,http://cnstlltn.com/master/8d153fc3-2224-4bc5-b6b9-6f32303aae2d/des-oeuvres-sous-les-toiles-2_lightbox.jpg,http://cnstlltn.com/master/de03c62d-6a10-45e8-8c60-d3ddd187c116/fontaine+nuit+blanche+2013.jpg,,,,,,,,,,,01/10/16,01/10/16,,,,,,,,,,,,,,,,,,,,,,,,,,,,,français,,,,,,,,,,,,,,,,,,,,,,,,,,,,,,,,,,,,,,,,,,,,,,,,,,,,,,,,,,,,,,,,,,,,,,,,,,,,,,,,,,,,,,,,,,,,,,,,,,,,,,,,,,,,,,,,,,,,,,,,,,,,,,,,,,
FMACHA0080011925,Nuit Blanche 2016 : La nuit de la fusion ,Fêtes et Manifestations,Manifestation Culturelle,Commémoration,,,Historique,,,,,,,8000,CHARLEVILLE MEZIERES,FRANCE,03 24 32 44 60,,,,,http://www.charleville-mezieres.fr,,49.77932,4.718441,,,,Nuit Blanche 2016 : La nuit de la fusion ,,À la tombée de la nuit - Charleville et Mézières,"Une 8e édition exceptionnelle de la Nuit Blanche qui fait le lien entre Charleville et Mézières. Cinquantenaire oblige, la Nuit Blanche prend cette année une dimension jamais égalée avec des installations pleines de surprises, des spectacles festifs et décalés à Charleville mais aussi à Mézières. Une nuit sur le thème de la fusion et de l'union.",,,,,,,,,,,,,,,,,http://cnstlltn.com/master/2d2e09ce-aa37-45dc-8da3-67a807b07b8f/visuel-fusion-1_small-medium.jpg,,,,,,,,,,,,,01/10/16,01/10/16,,,,,,,,,,,,,,,,,,,,,,,,,,,,,français,,,,,,,,,,,,,,,,,,,,,,,,,,,,,,,,,,,,,,,,,,,,,,,,,,,,,,,,,,,,,,,,,,,,,,,,,,,,,,,,,,,,,,,,,,,,,,,,,,,,,,,,,,,,,,,,,,,,,,,,,,,,,,,,,,
FMACHA0080009795,Nuit Celtique en Ardennes,Fêtes et Manifestations,Danse,Divers,,,,,,,Centre des Congrés,,,8500,LES MAZURES,FRANCE,,,,,,,,49.88797,4.626513,,,,Nuit Celtique en Ardennes,Centre des Congrés des Mazures,"Le samedi 14 mai à 21h danse, musique et chants celtes","Organisé par COV Bar Cheveuges.Le bagad sera à laffiche de la nouvelle édition de la nuit celtique ! Cest au centre des congrès du lac des Vieilles-Forges, en plein cur du Parc naturel régional des Ardennes, que se déroulera, le samedi 14 mai 2015 à 21 h, la troisième nuit celtique. Cette manifestation exceptionnelle, en partenariat avec le Conseil départemental des Ardennes, vous permettra de retrouver sur scène: le Bagad  et ses invités. Avis aux aficionados de musique bretonne et folk. Des navettes autocar, vous permettront de venir assister à ce spectacle de qualité. Nattendez plus, venez chercher vos places à la Vitrine des Ardennes : - Gradins ou table : 25 (placement libre) - Gradins + bus ou table  : 37 Billetterie en vente : Vitrine des Ardennes, 24 place Ducale à Charleville-Mézières. Ouvert du lundi au samedi de 10h à 12h30 et de 13h30 à 18h. Les dimanches et jours fériés de 14h à 18h. Renseignements au 03 24 56 06 08 - info@ardennes.com",,,,,,,,,,,,,,,,,http://cnstlltn.com/master/2ad824a1-fa9d-4464-ae97-6c57f667193a/nuit+celtique.jpg,,,,,,,,,,,,,16/05/15,16/05/15,14/05/16,14/05/16,,,,,,,,,,,,,,,,,,,,,,,,,,,français,,,,,Chèques bancaires et postaux,Espèces,,,,,,,,,Aire de pique-nique,Jeux pour enfants,Parking,Parking autocar,Salle d'animation,,,,,,,,,,,,,,,,Bar,Vestiaire,,,,,,,,,,,,,,,,,,,,,,,,,,,,,Y,,,,,,Entrée adulte,25.00,37.00,,,,,,,,,,,,,,,,,,,,,,,,,,,,,,,,,,,,,,,,,,,,,,,,,,,,,,,,,
FMACHA0080008440,Oiseaux du bocage,Fêtes et Manifestations,,Divers,,,,,,,,,,8260,MAUBERT FONTAINE,FRANCE,03 24 42 90 57,,,,,,,49.86793,4.428444,,,,oiseaux du bocage, De 9h à 12h ; tout public ; gratuit,"Places limitées, réservation obligatoire auprès du Parc 03 24 42 90 57","Partez à la rencontre des espèces typiques des milieux forestiers  et bocagers. Accompagnés dun guide naturaliste, vous approcherez les habitats naturels  et tenterez découter ou dobserver discrètement les oiseaux qui peuplent ces milieux. Animée par le Regroupement des naturalistes ardennais",,,,,,,,,,,,,,,,,http://cnstlltn.com/master/de09d638-2570-4a2a-8a4a-c1f3d22060b5/oiseaux.png,,,,,,,,,,,,,30/04/16,30/04/16,,,,,,,,,,,,,,,,,,,,,,,,,,,,,français,,,,,,,,,,,,,,,,,,,,,,,,,,,,,,,,,,,Visites groupes libres,Visites pédagogiques,,,,,,,,,,,,,,,,,,,,,,,,,,,,,,,,,,,,,,,,,,,,,,,,,,,,,,,,,,,,,,,,,,,,,,,,,,,,,,,,,,,,,,,,,,,,,,
FMACHA0080011979,Oiseaux du bocage en Val de Meuse,Fêtes et Manifestations,Nature et détente,Randonnée,,,,,,,,,,8600,RANCENNES,FRANCE,03 24 42 90 57,,,accueil@parc-naturel-ardennes.fr,,http://www.parc-naturel-ardennes.fr,,50.11698,4.816853,,,,Oiseaux du bocage en Val de Meuse,Rancennes-Ardenne-France,"Le dimanche 22 mai, accompagnés d'un guide naturaliste, vous approcherez les habitats naturels et tenterez d'écouter ou d'observer discrètement les oiseaux qui peuplent les milieux bocagers.","De 9h à 16h (Rendez-vous au parking du terrain de football)Tout public - GratuitPrévoir pique-nique, chaussures de marche, gourde d'eau et vêtements de pluie.Renseignements sur www.renard.asso.org (Organisé et animé par le Viroinval, Natagora et le Regroupement des Naturalistes Ardennais)",,,,,,,,,,,,,,,,,http://cnstlltn.com/master/5adaacad-4f1e-4b7e-957e-58207b31dd45/bird-1393592.jpg,,,,,,,,,,,,,22/05/16,22/05/16,,,,,,,,,Autres,,,,,accueil@parc-naturel-ardennes.fr,03 24 42 90 57,03 24 42 90 58,,,,,,,,,,,,,français,,,,,,,,,,,,,,,,,,,,,,,,,,,,,,,,,,,,,,,,,,,,,,,,,,,,,,,,,,,,,,,,,,,,,,,,,,,,,,,,,,,,,,,,,,,,,,,,,,,,,,,,,,,,,,,,,,,,,,,,,,,,,,,,,,
FMACHA0080012129,Open NC/OR,Fêtes et Manifestations,Animation locale,Concours,,,,,,,Salle Bayard - Rue Louis Tirman,,,8000,CHARLEVILLE MEZIERES,FRANCE,,,,,,,,49.76225,4.713527,,,,Open NC/OR,,,,,,,,,,,,,,,,,,,,http://cnstlltn.com/master/b68b10e9-ce63-4ff3-908a-615c875a9b07/open+ncor.jpg,,,,,,,,,,,,,15/04/16,17/04/16,,,,,,,,,,,,,,,,,,,,,,,,,,,,,français,,,,,,,,,,,,,,,,,,,,,,,,,,,,,,,,,,,,,,,,,,,,,,,,,,,,,,,,,,,,,,,,,,,,,,,,,,,,,,,,,,,,,,,,,,,,,,,,,,,,,,,,,,,,,,,,,,,,,,,,,,,,,,,,,,
FMACHA0080011821,Ouverture de l'Abbaye de Laval-Dieu,Fêtes et Manifestations,,,,,,,,,,,Abbaye de Laval-Dieu,8800,MONTHERME,FRANCE,324544673,,,,,,,49.89996,4.750521,,,,Ouverture de l'Abbaye de Laval-Dieu,,,"Ouverture de l'Abbaye de Laval-Dieu du 9 au 30 juillet 2016 à Monthermé.Les mardis, jeudis et samedis de 15h à 18h. Ouverture des églises et du parc de l'Abbaye.Exposition de peintures de l'Association de Deville  Tout en couleur ",,,,,,,,,,,,,,,,,http://cnstlltn.com/master/5cd802d6-1ce5-4c59-8057-803f70dbe95b/abbaye+de+laval-dieu+3.jpg,,,,,,,,,,,,,09/07/16,30/07/16,,,,,,,,,,,,,,,,,,,,,,,,,,,,,français,,,,,,,,,,,,,,,,,,,,,,,,,,,,,,,,,,,,,,,,,,,,,,,,,,,,,,,,,,,,,,,,,,,,,,,,,,,,,,,,,,,,,,,,,,,,,,,,,,,,,,,,,,,,,,,,,,,,,,,,,,,,,,,,,,
FMACHA0080012025,Ouverture du Elfy Parc et chasse aux oeufs,Fêtes et Manifestations,,Divers,,,,,,,Lac des Vieilles Forges,,,8500,LES MAZURES,FRANCE,,,,,,,,49.86977,4.605062,,,,Tous les événements du Elfy Parc,Ouverture du Elfy Parc les Mazures,"Pâques, fête des mères, des pères, Myrtillus fest, flânerie légendaire, week end Halloween",le 27 et 28 mars : 1 entrée enfant 2-14 ans offerte pour 1 entrée adulte achetée les 2 jours pour l'événement. Les 2 jours à 13h participez à la chasse aux oeufs.Pour les fêtes des mères et pères : 1 entrée adulte offerte pour une entrée enfant acheté Halloween demi tarif pour toutes les personnes déguisées.,,,,,,,,,,,,,,,,,http://cnstlltn.com/master/79bea7d7-6b9a-4160-be81-37d89095cd60/elfy+park.jpg,http://cnstlltn.com/master/61a1ddee-046d-4345-9c1e-f3c2a39866c0/1933217_972592916142690_7525400060375521235_o.jpg,,,,,,,,,,,,27/03/16,28/03/16,29/05/16,29/05/16,19/06/16,19/06/16,14/07/16,14/07/16,07/08/16,07/08/16,,,,,,,,,,,,,,,,,,,,,français,,,,,Chèques bancaires et postaux,Espèces,,,,,,,,,Aire de pique-nique,Jeux pour enfants,Parking,,,,,,,,,,,,,,,,,,Espace enfant,Espace jeux,,,,,,,,,,,,,,,,,,,,,,,,,,,,,,,,,,,,,,,,,,,,,,,,,,,,,,,,,,,,,,,,,,,,,,,,,,,,,,,,,,,,,,,,,,,,,,
FMACHA0080011910,Peinture décorative,Fêtes et Manifestations,,,,,,,,,,,,8390,LOUVERGNY,FRANCE,03 24 30 03 14,06 73 07 47 70,,valerie-penel@orange.fr,,http://www.valeriePenel.canalblog.com,,49.55186,4.739434,,,,Peinture décorative,,,Ouvert toute l'année sur rendez-vous.Portes ouvertes un dimanche par mois de 10h à 18h.,,,,,,,,,,,,,,,,,http://cnstlltn.com/master/e98da744-bd1b-49f4-8198-7cad0c07885b/1235028.jpg,,,,,,,,,,,,,10/03/16,31/12/16,,,,,,,,,,,,,,,,,,,,,,,,,,,,,français,,,,,,,,,,,,,,,,,,,,,,,,,,,,,,,,,,,,,,,,,,,,,,,,,,,,,,,,,,,,,,,,,,,,,,,,,,,,,,,,,,,,,,,,,,,,,,,,,,,,,,,,,,,,,,,,,,,,,,,,,,,,,,,,,,
FMACHA0080010946,Pépito Matéo  7 Lost... in la Mancha ,Fêtes et Manifestations,Manifestation Culturelle,Spectacle,,,,,,,Place Jean Jaurès,Espace Jean Vilar,,8500,REVIN,FRANCE,03 24 41 55 71,,,sallejeanvilar@wanadoo.fr,contact@ville-revin.fr,http://www.ville-revin.fr,,49.93893,4.632185,,,,7 Lost... in la Mancha - Revin-Ardenne-France,Conte,La langue acérée de Pepito Matéo oscille entre humour et poésie pour mieux toucher au cur.Venez le découvrir... le vendredi 29 avril à 20h30 à l'espace Jean Vilar de Revin.,"Pepito Matéo fait partie de ces artistes  indispensables  capables de dire la folie du monde tout en gardant cette légèreté salvatrice,cette jubilation de la parole vagabonde qui nourrit et qui fait sens.Pepito Matéo est avant tout un détourneur de mots, un joyeux fou, bavard et allumé, qui trace son propre chemin dans la forêt de l'imaginaire contemporain.Créé début 2013, 7 monologues transformaient avec brio le pari audacieux d'une pièce multiforme, mise en jeu par 7 metteurs en 7...ou l'histoire délirante d'un auteur rattrapé par ses personnages.7... Lost in la Mancha en est la version épurée, un retour aux sources de cette écriture extravagante et originale où se mêlent légèreté, gravité, humanité avec toujours cette pointe d'humour unique.Il en ressort une palette de personnages colorés à l'extrême, 7 situations loufoques comme pour mieux décrire les aberrations de l'existence...un Pepito Matéo à 7 facettes au sommet de son art.Tarifs :Plein tarif 17 Tarif abonné 8 Tarif réduit* 5 * Personnes bénéficiant du tarif réduit : moins de 18 ans, carte étudiant et chômeur",,,,,,,,,,,,,,,,,http://cnstlltn.com/master/877baeb2-e45f-42cf-92c9-f3c870aab20f/u-29avril.jpg,http://cnstlltn.com/master/c470f8b0-7cc0-4d32-b550-f3c648cd9e73/espace+jean+vilar.jpg,http://cnstlltn.com/master/7e2da8ae-b228-4d17-a63f-2c140efa5bbd/img_0188.jpg,,,,,,,,,,,29/04/16,29/04/16,,,,,,,,,Autres,,,,,contact@ville-revin.frService culturel,03 24 42 74 30,,,,,,,,,,,,,,français,,,,,Chèques,Espèces,Carte bancaire,,,,,,,,,,,,,,,,,,,,,,,,,,,,,,,,,,,,,,,,,,,,,,,,,,,,,,,,,,,,,,,,Tarif réduit,5.00,5.00,Tarif non-adhérent,17.00,17.00,Tarif adhérent,8.00,8.00,,,,,,,,,,,,,,,,,,,,,,,,,,,,,,,,,,,,,,,,,,,,,,,,,,,
FMACHA0080012081,Petit Déjeuner de l'Energie,Fêtes et Manifestations,Autres Evènements ,Divers,,,,,,,CFA BTP,,,8430,POIX TERRON,FRANCE,03 24 35 22 22,,,,,,,49.64887,4.641824,,,,Petit Déjeuner de l'Energie,,Gratuit,Petit déjeuner avec les artisans locaux pour évoquer les aides à l'investissement et les économies d'énergie.De 7h30 à 9h.Renseignements auprès de la Communauté de Communes des Crêtes Préardennaises.,,,,,,,,,,,,,,,,,http://cnstlltn.com/master/4d061069-fe31-4e91-b471-8b7ca81029e1/20+ans+cr%c3%aates.jpg,,,,,,,,,,,,,22/04/16,22/04/16,,,,,,,,,,,,,,,,,,,,,,,,,,,,,français,,,,,,,,,,,,,,,,,,,,,,,,,,,,,,,,,,,,,,,,,,,,,,,,,,,,,,,,,,,,,,,,,,,,,,,,,,,,,,,,,,,,,,,,,,,,,,,,,,,,,,,,,,,,,,,,,,,,,,,,,,,,,,,,,,
FMACHA0080004292,Petit Salon du Champignon,Fêtes et Manifestations,Animation locale,Exposition,,,,,,,Place Alsace Lorraine,Collège Turenne,,8200,SEDAN,FRANCE,03 24 22 08 53 ,,,guy.christelle@wanadoo.fr,,http://sms-myco.e-monsite.com/,,49.69849,4.945619,,,,Petit Salon du Champignon,,Exposition mycologique le samedi de 15h à 19h et le dimanche de 10h à 18h. Entrée libre,"La Société Mycologique du Sedanais organise son Petit Salon du Champignon annuel à Sedan, au collège Turenne, le samedi de 15h à 19h et le dimanche de 10h à 18h. Exposition mycologique, avec entrée libre et concours ouvert aux scolaires. De nombreuses espèces seront présentées, du comestible au mortel. Une bonne occasion de faire identifier les champignons ramassés et de sinformer sur les éventuelles confusions rencontrées.",,,,,,,,,,,,,,,,,http://cnstlltn.com/master/bd57cfdc-f3b7-41f0-be3d-880cc92ea51f/forest-998529_960_720.jpg,,,,,,,,,,,,,01/10/16,02/10/16,,,,,,,,,,,,,,,,,,,,,,,,,,,,,français,,,,,,,,,,,,,,,,,,,,,,,,,,,,,,,,,,,,,,,,,,,,,,,,,,,,,,,,,,,,,,,,,,,,,,,,,,,,,,,,,,,,,,,,,,,,,,,,,,,,,,,,,,,,,,,,,,,,,,,,,,,,,,,,,,
FMACHA0080012068,Petite Histoire Illustrée du Jazz - Conférence par Guillaume Kosmicki,Fêtes et Manifestations,Manifestation Culturelle,Conférence,,,,,,,"Médiathèque Georges-Delaw, Corne de Soissons ",,,8200,SEDAN,FRANCE,03.24.29.26.48,,,,,,,49.69848,4.936284,,,,Petite Histoire Illustrée du Jazz - Conférence par Guillaume Kosmicki,,A 20h.,Conférence par Guillaume Kosmicki sur Ğ Des origines au Be-bop (1890-1945) ğ suivie par un concert-jazz convivial Ğ Sunday Jazzband 3.0 ğ,,,,,,,,,,,,,,,,,http://cnstlltn.com/master/3605a90e-1fda-4baf-97fb-c6c41b2f4001/m%c3%a9diath%c3%a8que+charleville+sedan.png,,,,,,,,,,,,,29/04/16,29/04/16,,,,,,,,,,,,,,,,,,,,,,,,,,,,,français,,,,,,,,,,,,,,,,,,,,,,,,,,,,,,,,,,,,,,,,,,,,,,,,,,,,,,,,,,,,,,,,,,,,,,,,,,,,,,,,,,,,,,,,,,,,,,,,,,,,,,,,,,,,,,,,,,,,,,,,,,,,,,,,,,
FMACHA0080011982,Petites bêtes et flore des pelouses sèches,Fêtes et Manifestations,Nature et détente,Randonnée,,,,,,,,,,8600,HAM SUR MEUSE,FRANCE,03 24 42 90 57,,,accueil@parc-naturel-ardennes.fr,,http://www.parc-naturel-ardennes.fr,,50.11013,4.78018,,,,Petites bêtes et flore des pelouses sèches,Ham-sur-Meuse-Ardenne-France,"Une animation à l'ambiance méridionale vous attend le samedi 11 juin 2016.Venez découvrir la richesse écologique des pelouses sèches, milieux naturels hérités d'un passé pastoral, marquant les anciens lieux de parcours des troupeaux.","De 14h à 17hBalade +/- 3 km Tout public. GratuitPrévoir des chaussures de marche, gourde d'eau et vêtements de pluie.Places limitées, réservation auprès du Parc : +33 (0)3 24 42 90 57(Organisé et animé par le PNR et la Société d'Histoire Naturelle des Ardennes) Renseignements complémentaires: www.parc-naturel-ardennes.fr",,,,,,,,,,,,,,,,,http://cnstlltn.com/master/6209639c-f8a5-42ab-8766-3cb5bf92ecad/beetle-1545366.jpg,,,,,,,,,,,,,11/06/16,11/06/16,,,,,,,,,Autres,,,,,accueil@parc-naturel-ardennes.fr,03 24 42 90 57,03 24 42 90 58,,,,,,,,,,,,,français,,,,,,,,,,,,,,,,,,,,,,,,,,,,,,,,,,,,,,,,,,,,,,,,,,,,,,,,,,,,,,,,,,,,,,,,,,,,,,,,,,,,,,,,,,,,,,,,,,,,,,,,,,,,,,,,,,,,,,,,,,,,,,,,,,
FMACHA0080009943,Photographie en costume d'époque,Fêtes et Manifestations,Insolite,Exposition,,,Médiéval,,,,Chateau Fort,Salle des trésors,,8200,SEDAN,FRANCE,03 24 29 98 80,,,contact@chateau-sedan.fr,,http://www.chateau-fort-sedan.fr,,49.70238,4.949445,,,,Photographie en costume d'époque,,Une occasion rare de se faire photographier en costume d'époque !,"Sissi Princess Studio met à votre disposition 68 costumes pour toute la famille, adaptables à toutes les tailles. Photo délivrée immédiatement dans son médaillon de luxe. Studio installé dans la salle des trésors.",Photography in period costume,,A rare opportunity to be photographed in costume!,"Sissi Princess Studio offers 68 costumes for the whole family, suitable to all sizes.Photo issued immediately in his luxury locket.Studio installed in the treasure room.",,,,,,,,,,,,,http://cnstlltn.com/master/6d17b4ae-5c1a-4199-ae0e-61d4861e2d30/59_full_3cda4c356912462dbe4f25a3fee18caf.jpg,,,,,,,,,,,,,05/07/16,19/08/16,,,,,,,,,,,,,,,,,,,,,,,,,,,,,français,,,,,,,,,,,,,,,,,,,,,,,,,,,,,,,,,,,,,,,,,,,,,,,,,,,,,,,,,,,,,,,,,,,,,,,,,,,,,,,,,,,,,,,,,,,,,,,,,,,,,,,,,,,,,,,,,,,,,,,,,,,,,,,,,,
FMACHA0080011350,Pièce de Théâtre,Fêtes et Manifestations,Animation locale,Théâtre,,,,,,,Salle polyvalente,,,8260,MAUBERT FONTAINE,FRANCE,,,,,,,,49.86793,4.428444,,,,Soirée Théâtre à Maubert Fontaine,,20h30,,,,,,,,,,,,,,,,,,http://cnstlltn.com/master/5b6b0780-f337-4175-9ef8-4da6853efcae/th%c3%a9atre.jpg,,,,,,,,Accès handicapés,,,,,26/11/16,26/11/16,,,,,,,,,,,,,,,,,,,,,,,,,,,,,français,,,,,Chèques bancaires et postaux,Espèces,,,,,,,,,Parking,Salle d'animation,,,,,,,,,,,,,,,,,,,Bar,Vestiaire,,,,,,,,,,,,,,,,,,,,,,,,,,,,,Y,,,,,,Entrée adulte,5.00,5.00,,,,,,,,,,,,,,,,,,,,,,,,,,,,,,,,,,,,,,,,,,,,,,,,,,,,,,,,,
FMACHA0080009079,Plage Ducale 2016,Fêtes et Manifestations,Autres Evènements ,Divers,,,,,,,,Place Ducale,,8000,CHARLEVILLE MEZIERES,FRANCE,03 24 55 69 90,,,,,,,49.76208,4.726096,,,,Plage Ducale 2016,,"Sur les pavés, la plage - ouvert au public de 13h30 à 20h00","Infos sur les animations proposées à venirPour le plaisir des petits et des grands, la plage envahit la place Ducale.- une plage avec des transats et fauteuils détente- un coin sable dédié aux enfants sous la responsabilité des parents- pensez à prendre seaux, pelles, râteaux, moules...- terrain de badminton- un terrain de beach volley- deux terrains de pétanque- trois tables de tennis de tablePrêt de raquettes, boules de pétanque (n'hésitez pas à venir avec votre matériel)...Une scène ouverte pour les amateurs de musique et de danse -Deux attractions dont les petits raffolent :- piscine avec bateaux-bouées électriques : à partir de 2 - piscine avec bulles géantes : à partir de 3 Venez vous détendre sur la plage au coeur de la ville.",,,,,,,,,,,,,,,,,http://cnstlltn.com/master/c5516015-8a95-4bcd-bca3-36ba3351e281/11224326_1103019529713298_6584487196112185475_n.jpg,http://cnstlltn.com/master/12c1f13f-7b99-4d3b-8985-db323bcd98df/plage+ducale2.jpg,http://cnstlltn.com/master/82ab2967-8266-4c4b-9c04-c761a150b25e/11811462_1124692654212652_7822685529518540009_n.jpg,,,,,,Accès handicapés,,,,,18/07/16,18/08/16,,,,,,,,,,,,,,,,,,,,,,,,,,,,,français,,,,,,,,,,,,,,,,,,,,,,,,,,,,,,,,,,,Club de plage,Commerce alimentaire,Commerces,Espace enfant,Espace jeux,Plats cuisinés,Point argent,Vente de produits touristiques,Visites individuelles guidées,Visites individuelles libres,Visites guidées,Visites groupes guidées,Visites groupes libres,Visites pédagogiques,,,,,,,,,,,,,,,,,,,,,,,,,,,,,,,,,,,,,,,,,,,,,,,,,,,,,,,,,,,,,,,,,,,,,,,,,,,,,,,,,,
FMACHA0080011903,Plantes de nos prairies,Fêtes et Manifestations,,Divers,,,,,,,,,Le carbonnet,8290,BOSSUS LES RUMIGNY,FRANCE,,,,,,,,49.83739,4.257778,,,,Plante de nos prairies et jardins,,Rendez vous à la propriété des gîtes du Carbonnet avec le PNR pour un circuit de 3 km de 14h à 17h,,,,,,,,,,,,,,,,,,http://cnstlltn.com/master/49e210c9-9e89-4ba7-ab47-32da533b8fe5/t%c3%a9l%c3%a9chargement+(2).jpg,,,,,,,,,,,,,25/06/16,25/06/16,,,,,,,,,,,,,,,,,,,,,,,,,,,,,français,,,,,,,,,,,,,,,,,,,,,,,,,,,,,,,,,,,Visite gratuite,,,,,,,,,,,,,,,,,,,,,,,,,,,,,,,,,,,,,,,,,,,,,,,,,,,,,,,,,,,,,,,,,,,,,,,,,,,,,,,,,,,,,,,,,,,,,,,
FMACHA0080004476,Pomme et compote,Fêtes et Manifestations,Animation locale,Jeux,,,,,,,Ferme Pédagogique,,,8290,LIART,FRANCE,03 24 54 48 33,,,maison.thierache.08@wanadoo.fr,,http://www.fermepedagogiqueliart.fr,,49.76796,4.341831,,,,Pomme et compote,A l'Automne,A la ferme pédagogique de Liart,"Après la découverte du verger conservatoire et de l'histoire de la pomme, compote et tarte aux pommes seront fabriquées et dégustées.Rendez vous à 14h pour une après midi complète en famille.réservation obligatoire et possible jusqu'au jour même, les enfants sont obligatoirement accompagnés d'un adulte. Une collation comprise dans le prix sera offert en fin d'animation avec tout le groupe.",,,,,,,,,,,,,,,,,http://cnstlltn.com/master/ad293d0f-971c-4a9f-afdc-8847d556420d/ad293d0f-971c-4a9f-afdc-8847d556420d_134.jpg,http://cnstlltn.com/master/23683248-b008-4661-9dae-0f068c326e5c/23683248-b008-4661-9dae-0f068c326e5c_134.jpg,http://cnstlltn.com/master/6c2d2fec-563e-4bce-b2c5-47bf5d13e90a/6c2d2fec-563e-4bce-b2c5-47bf5d13e90a_134.jpg,,,,,,,,,,,26/10/16,26/10/16,,,,,,,,,,,,,,,,,,,,,,,,,,,,,français,,,,,Chèques,Chèques bancaires et postaux,Espèces,,,,,,,,Aire de pique-nique,Parking,Parking autocar,Salle d'animation,Sur une exploitation agricole,Tables de pique-nique,,,,,,,,,,,,,,,Circuits touristiques,Commerces,Espace enfant,Médecin,Visites groupes guidées,Visites pédagogiques,,,,,,,,,,,,,,,,,,,,Point d'eau potable,,,,,,,,,,,enfant,0.00,4.00,adulte,0.00,7.50,,,,,,,,,,,,,,,,,,,,,,,,,,,,,,,,,,,,,,,,,,,,,,,,,,,,,,
FMACHA0080012090,Portes Ouvertes,Fêtes et Manifestations,Manifestation Culturelle,Exposition,,,,,,,Rue Georges Clémenceau,,,8350,DONCHERY,FRANCE,,,,,,,,49.69828,4.86476,,,,Portes Ouvertes,,De 10h à 18h,"Venez découvrir les ateliers de Flo. Exposition de peinture, atelier découverte.",,,,,,,,,,,,,,,,,http://cnstlltn.com/master/9dc4670b-162a-4ac4-8d16-72cca7db893a/portes+ouvertes.jpg,,,,,,,,,,,,,23/04/16,23/04/16,,,,,,,,,,,,,,,,,,,,,,,,,,,,,français,,,,,,,,,,,,,,,,,,,,,,,,,,,,,,,,,,,,,,,,,,,,,,,,,,,,,,,,,,,,,,,,,,,,,,,,,,,,,,,,,,,,,,,,,,,,,,,,,,,,,,,,,,,,,,,,,,,,,,,,,,,,,,,,,,
FMACHA0080004315,Portes ouvertes  LA MAISON DU LABOUREUR ,Fêtes et Manifestations,Animation locale,Portes ouvertes,,,,,,,Ecomusée La Maison du Laboureur,,,8430,CHAMPIGNEUL SUR VENCE,FRANCE,,,,lamaisondulaboureur@laposte.net,,http://www.lamaisondulaboureur.com,,49.70007,4.65511,,,,Portes ouvertes  La Maison du Laboureur ,"Ecomusée, témoin de l'habitat rural ardennais du XVIIème siècle","Ouverts les Dimanches 05/06 (07h à 17h), 26/06 (11h30 à 17h), 04/09 (11h30 à 17h) et 25/09 (11h30 à 17h)Visites GRATUITES",L'écomusée ouvre ses portes les Dimanches : - 26 JUIN : de 11h30 à 17h00 : LABOUREUR AVEC CUISSON DE PAINS & GALETTES - 04 SEPTEMBRE : de 11h30 à 17h00 : LABOUREUR AVEC CUISSON DE PAINS & GALETTES - 25 SEPTEMBRE : de 11h30 à 17h00 : LABOUREUR AVEC CUISSON DE PAINS & GALETTES Vente sur place de galettes au sucre et pains cuits au feu de bois. ENTRÉE GRATUITE Consulter le site,,,,,,,,,,,,,,,,,http://cnstlltn.com/master/b665268a-1c04-4cb0-b866-f12e0f874b0b/maison%2bdu%2blaboureur%2b1.jpg,http://cnstlltn.com/master/4951acd8-2968-48c6-a0b3-dc6182e76494/maison%2bdu%2blaboureur%2b2.jpg,http://cnstlltn.com/master/d028fea0-2b45-4818-a3a6-385666114bb0/21.jpg,,,,,Animaux acceptés,,,,,,05/06/16,05/06/16,26/06/16,26/06/16,04/09/16,04/09/16,25/09/16,25/09/16,,,,,,,,,,,,,,,,,,,,,,,français,,,,,,,,,,,,,,,Parking,,,,,,,,,,,,,,,,,,,,Visite gratuite,Visites guidées,,,,,,,,,,,,,,,,,,,,,,,,,,,,,,,,,,,Entrée gratuite,0.00,0.00,,,,,,,,,,,,,,,,,,,,,,,,,,,,,,,,,,,,,,,,,,,,,,,,,,,,,,,,,
