FMACHA0080011591,Foire Expo 2016 ,Fêtes et Manifestations,Manifestation commerciale,Foire ou salon,,,,,,,,Parc des expositions,,8000,CHARLEVILLE MEZIERES,FRANCE,,,,contact@prestige-prod.com,,http://www.foire-de-charleville.fr,,49.76313,4.706596,,,,Foire expo 2016,,entrée gratuite -,Michael JONES sera à la foire expo le vendredi 3 Juin 2016 à 20h45 et Feu d'artifice juste après !!!,,,,,,,,,,,,,,,,,http://cnstlltn.com/master/9e6da270-0b73-4fdb-ad63-a9a4fbc247ab/11430227_917658498306944_8647606348700015792_n.png,,,,,,,,,,,,,02/06/16,05/06/16,,,,,,,,,,,,,,,,,,,,,,,,,,,,,français,,,,,,,,,,,,,,,,,,,,,,,,,,,,,,,,,,,,,,,,,,,,,,,,,,,,,,,,,,,,,,,,,,,,,,,,,,,,,,,,,,,,,,,,,,,,,,,,,,,,,,,,,,,,,,,,,,,,,,,,,,,,,,,,,,
FMACHA0080012111,Fort des Ayvelles : A l'heure du cirque 1900,Fêtes et Manifestations,Manifestation Culturelle,Fête traditionnelle,,,,,,,11 Rue Ferdinand Buisson,Fort des Ayvelles,,8000,LES AYVELLES,FRANCE,06 23 02 20 61 ,03 24 33 48 97 ,,tourisme@api08.fr,,,,49.74239,4.746611,,,,Fort des Ayvelles : A l'heure du cirque 1900,,,"Ouverture de 10h à 20h le SamediDe 10h à 18h le DimancheLa compagnie de cirque propose le matin pour les groupes denfants (collectivités, centres aérés, écoles, ) ou particulier :",Accueil et prise en charge des enfants par les artistes : maquillage des enfants qui le souhaitent ,Initiation au fil de fer le temps de linstallation dans les gradins,"Spectacle ludique et drôle sur le Cirque depuis lEmpire Romain à 1900, rires assurés ! Environ 30 minutes","A lissue de ce spectacle des ateliers dinitiation à la pyramide, aux acrobaties, trapèze et jonglerie seront proposés avec lencadrement et le professionnalisme de nos artistes !",TARIF : 3 euros par personne,"Le chapiteau est limité à 300 places assises, les séances seront proposées le samedi et le dimanche à 10h.",Fin de lanimation pour midi,,,,,,,,,,http://cnstlltn.com/master/a73f1f5b-1dcf-4a95-bd35-0244b1bacd6e/belle+%c3%a9poque.jpg,,,,,,,,,,,,,18/06/16,19/06/16,,,,,,,,,,,,,,,,,,,,,,,,,,,,,français,,,,,,,,,,,,,,,,,,,,,,,,,,,,,,,,,,,,,,,,,,,,,,,,,,,,,,,,,,,,,,,,,,,,,,,,,,,,,,,,,,,,,,,,,,,,,,,,,,,,,,,,,,,,,,,,,,,,,,,,,,,,,,,,,,
FMACHA0080012019,Forum  Consommer autrement ,Fêtes et Manifestations,Manifestation Culturelle,Divers,,,,,,,Salle des Fêtes,,,8000,VILLERS SEMEUSE,FRANCE,,,,,,,,49.73791,4.75058,,,,Forum  Consommer autrement ,,De 10h à 17h.,Au programme : - 10h à 17h30 : Bourses Locale déchange- 14h00 : inauguration du Forum- 15h30 : table ronde sur léconomie Sociale et solidaire- 17h30 : concert du groupe  Les Woodies - 19h00 : apéritif musical partagé,,,,,,,,,,,,,,,,,http://cnstlltn.com/master/a38d577a-474b-4dc5-b9ff-adba12d3cfcc/villers+semeuse.png,,,,,,,,,,,,,16/04/16,16/04/16,,,,,,,,,,,,,,,,,,,,,,,,,,,,,français,,,,,,,,,,,,,,,,,,,,,,,,,,,,,,,,,,,,,,,,,,,,,,,,,,,,,,,,,,,,,,,,,,,,,,,,,,,,,,,,,,,,,,,,,,,,,,,,,,,,,,,,,,,,,,,,,,,,,,,,,,,,,,,,,,
FMACHA0080007345,Foulées du Castel,Fêtes et Manifestations,Manifestation sportive,Compétition sportive,,,Course à pied,,,,Rue Sommevue,,,8360,CHATEAU PORCIEN,FRANCE,03 24 72 43 25,,,jean-luc.lesage7@wanadoo.fr,http://foulees-retheloises.com/castel.htm  ,,,49.53229,4.262432,,,,Foulées du Castel,,,"Départ à 19h rue Sommevue pour parcourir à deux reprises une boucle de 8,5 km dans les rues du village",,,,,,,,,,,,,,,,,http://cnstlltn.com/master/2a2726ab-bb9b-485f-be93-3fbedfa8db28/foulees_castel_2014_otpr+(3).jpg,http://cnstlltn.com/master/a0cb5a02-5e51-4e95-851f-624ba92ace52/foulees_castel_2014_otpr+(132).jpg,http://cnstlltn.com/master/258e66f0-394a-4db5-b687-d40da52c3cd0/foulees_castel_2014_otpr+(11).jpg,,,,,,,,,,,06/08/16,06/08/16,,,,,,,,,,,,,,,,,,,,,,,,,,,,,français,,,,,,,,,,,,,,,,,,,,,,,,,,,,,,,,,,,,,,,,,,,,,,,,,,,,,,,,,,,,,,,,,,,,,,,,,,,,,,,,,,,,,,,,,,,,,,,,,,,,,,,,,,,,,,,,,,,,,,,,,,,,,,,,,,
FMACHA0080011564,Gala de Danse,Fêtes et Manifestations,Danse,Spectacle,,,,,,,Centre des Congrés,,,8500,LES MAZURES,FRANCE,06 79 32 53 19,,,,,,,49.88797,4.626513,,,,Gala de Danse,Sur 2 jours ,l'association sportive espace danse de Renwez présente son spectacle de fin d'année les 18 et 19 juin au centre des congrés des Vieilles Forges,"le samedi de 19h30 à 23h30, le dimanche de 14h à 18h30",,,,,,,,,,,,,,,,,http://cnstlltn.com/master/cd7404d9-f56f-4aad-a10b-081194e05f07/t%c3%a9l%c3%a9chargement.jpg,,,,,,,,,,,,,18/06/16,19/06/16,,,,,,,,,,,,,,,,,,,,,,,,,,,,,français,,,,,,,,,,,,,,,Aire de pique-nique,Parking,Salle d'animation,,,,,,,,,,,,,,,,,,Bar,Plats cuisinés,,,,,,,,,,,,,,,,,,,,,,,,,,,,,,,,,,,,,,,,,,,,,,,,,,,,,,,,,,,,,,,,,,,,,,,,,,,,,,,,,,,,,,,,,,,,,,
FMACHA0080010800,Gérald Dahan tombe les masques,Fêtes et Manifestations,,Spectacle,,,Comique,,,,,Salle Annie Girardot ,,8400,VOUZIERS,FRANCE,03 24 71 64 77,,,vouziers.lestourelles@wanadoo.fr,,http://www.lestourellesvouziers.fr,,49.40206,4.711936,,,,Gérald Dahan tombe les masques ,à 20h30,One man showSpectacle tout public,"Coté sketchs, on connait ses imitations saisissantes de Sarkozy, Timsit, Clavier, Luchini et Palmade. Vous allez découvrir ses incarnations hilarantes de Hollande, Valls, Montebourg, Dupontel, Mister Bean et bien dautresDans ce nouveau spectacle, Gérald Dahan fait notamment revivre dans les conditions du direct son canular à Olivier Falorni en imitant Manuel Valls. Un document Ğ House of cards ğ qui en dit long sur les coulisses du pouvoir En fin de spectacle, ses imitations chantées, accompagnées au piano, sont Ğ à la carte ğ. Loccasion de réentendre vos standards préférés de la chanson française et pour lartiste de rendre hommage à ses références artistiques : Aznavour, Gainsbourg, Nougaro, Brel Un show interactif où cest le public qui choisit les artistes de la soirée.Durée : 1h30",,,,,,,,,,,,,,,,,http://cnstlltn.com/master/6abe9657-1682-4b16-9633-f794acc9c734/gerald+dahan.jpg,,,,,,,,,,,,,05/05/16,05/05/16,,,,,,,,,,,,,,,,,,,,,,,,,,,,,français,,,,,,,,,,,,,,,,,,,,,,,,,,,,,,,,,,,,,,,,,,,,,,,,,,,,,,,,,,,,,,,,,,,,,,,tarif,0.00,10.00,tarif abonné,0.00,18.00,tarif ,0.00,20.00,tarif,0.00,25.00,,,,,,,,,,,,,,,,,,,,,,,,,,,,,,,,,,,,,,,,,,,,,,,,
FMACHA0080011567,Ginette,Fêtes et Manifestations,Animation locale,Théâtre,,,,,,,,,,8150,ROUVROY SUR AUDRY,FRANCE,,,,,,,,49.78427,4.502246,,,,Ginette,une ambiance explosive,Hilarante pour une soirée sur Rouvroy sur Audry,,,,,,,,,,,,,,,,,,http://cnstlltn.com/master/eb524d56-272a-4709-8583-68db5245d217/12647307_1153135844704498_2437349815494953953_n.jpg,,,,,,,,,,,,,10/09/16,10/09/16,,,,,,,,,,,,,,,,,,,,,,,,,,,,,français,,,,,,,,,,,,,,,Salle d'animation,,,,,,,,,,,,,,,,,,,,,,,,,,,,,,,,,,,,,,,,,,,,,,,,,,,,,,,,,,,,,,,,,,,,,,,,,,,,,,,,,,,,,,,,,,,,,,,,,,,,,,,,,,,,,,,,,,,
FMACHA0080011727,Grand Prix Cycliste,Fêtes et Manifestations,Manifestation sportive,Compétition sportive,,,Sport cycliste,,,,,,,8130,TOURTERON,FRANCE,,,,octourteron@yahoo.fr,,,,49.54026,4.63686,,,,Grand Prix Cycliste,,,De 13h à 19h,,,,,,,,,,,,,,,,,http://cnstlltn.com/master/95ea086c-77f0-4060-bc73-e2cf50f7f565/cycliste.jpg,,,,,,,,,,,,,07/08/16,07/08/16,,,,,,,,,,,,,,,,,,,,,,,,,,,,,français,,,,,,,,,,,,,,,,,,,,,,,,,,,,,,,,,,,,,,,,,,,,,,,,,,,,,,,,,,,,,,,,,,,,,,,,,,,,,,,,,,,,,,,,,,,,,,,,,,,,,,,,,,,,,,,,,,,,,,,,,,,,,,,,,,
FMACHA0080007806,Grand Prix Retro d'Yvois,Fêtes et Manifestations,Insolite,Meeting,,,,,,,Centre ville,,,8110,CARIGNAN,FRANCE,,,,,,http://www.grand-prix-retro-yvois.fr,http://www.tty08.fr,49.63249,5.168674,,,,8ème Grand Prix Rétro d'Yvois,,"Amateurs de véhicules d'avant guerre, ce 8ème Grand Prix Rétro d'Yvois est organisé pour vous...","Deux jours de bonheur et de convivialité dont voici le programme :Le Samedi : Rallye Touristique et Gastronomique d'environ 120 à 150 km pour les participants. Une occasion pour les spectateurs d'admirer les magnifiques voitures et motos en fonctionnement.Le Dimanche : Grand Prix Rétro d'Yvois Un parcours fermé dans Carignan ou se succéderont les différentes courses... Seront représentées les catégories suivantes : cyclecars et tricyclecars, vintages, motos et populaires.",Grand Prix Retro dYvois,,,"The Yvois Retro Grand Prix is a race through the charming village of Carignan, where pre- war cars and motor-bikes fight for the first place.",,,,,,,,,,,,,http://cnstlltn.com/master/3e41fc3b-102b-46c5-8e93-bb40d76f28f1/fete_et_manifestation-grand_prix_retro_dyvois-carignan-%c2%a9s.ortega-dubois-002.jpg,http://cnstlltn.com/master/537e029b-ef9c-4a27-ac0c-f539d2bbad12/fete_et_manifestation-grand_prix_retro_dyvois-carignan-%c2%a9s.ortega-dubois-001.jpg,http://cnstlltn.com/master/630f2f11-2709-4077-b3b7-96b0b254e9b5/fete_et_manifestation-grand_prix_retro_dyvois-carignan-%c2%a9s.ortega-dubois-003.jpg,,,,,,,,,,,04/06/16,05/06/16,,,,,,,,,,,,,,,,,,,,,,,,,,,,,français,,,,,,,,,,,,,,,,,,,,,,,,,,,,,,,,,,,,,,,,,,,,,,,,,,,,,,,,,,,,,,,,,,,,,,,entrée,0.00,0.00,,,,,,,,,,,,,,,,,,,,,,,,,,,,,,,,,,,,,,,,,,,,,,,,,,,,,,,,,
FMACHA0080009457,Halloween Party III à Rocroi,Fêtes et Manifestations,Animation locale,Bal,,,,,,,,,,8230,ROCROI,FRANCE,,,,,,,,49.92515,4.519757,,,,Haloween Party III,de 14h à 22h sous châpiteau,Animation par la Jeunesse de Rocroi,"Cette année pour Halloween Party III la jeunesse de Rocroi vous a préparé une journée comme il se doit : Samedi 31 Octobre Alors , participez, partagez, invitez vos amis et faites tourner !",,,,,,,,,,,,,,,,,http://cnstlltn.com/master/2ce4b55f-69b4-434f-9ce4-c02024d4295a/hallow_012.gif,,,,,,,,,,,,,31/10/16,31/10/16,,,,,,,,,,,,,,,,,,,,,,,,,,,,,français,,,,,,,,,,,,,,,Jeux pour enfants,Parking,Salle d'animation,,,,,,,,,,,,,,,,,,Bar,Commerce alimentaire,Médecin,Point argent,,,,,,,,,,,,,,,,,,,,,,,,,,,Y,,,,,,Entrée pour le bal à 21h ,5.00,5.00,,,,,,,,,,,,,,,,,,,,,,,,,,,,,,,,,,,,,,,,,,,,,,,,,,,,,,,,,
FMACHA0080012061,Heavy Trash en concert - Journée  Happy Sunday   ,Fêtes et Manifestations,Musique,Concert,,,"Pop musique (rock, pop, rap, ...)",,,,MJC Calonne - Place Calonne,,,8200,SEDAN,FRANCE,03 24 27 09 75,,,m.j.c.calonne@wanadoo.fr,,http://www.mjc-calonne.com,,49.6999,4.944535,,,,Heavy Trash en concert - Journée  Happy Sunday  ,,,"L'Asso Sapristi et la MJC Calonne présentent la journée  Happy Sunday . Quelle plus belle date que le 8 mai pouvions-nous rêver pour accueillir la crème des rockn rollers américains en la personne de Jon Spencer ? Plus quun concert ou un hommage aux G.I., nous vous proposons un dimanche festif et convivial des plus vintage que nous appelons dores et déjà Happy Sunday.Au menu 2 scènes avec les plus old school des groupes Ardennais, des vieux carrosses à 2 et 4 roues, un déco du bâtiment entre 50s et 60s, expos de de photos, vynils, affiches dedans, des stands divers et variés et même une petite restauration. Les kids ne seront pas oubliés: flippers, tattoos éphémères Et dautres surprises encoreMesdames et Mademoiselles sortez vos plus belles robes, Messieurs, enfilez Perfectos et Teddys. Et comme dirait Fonzy, ça va être cool!HEAVY TRASH(Rock'n'Roll, Rockabilly, Blues / New-York)BAPTIZEIN & SECRET YOLK(Rock, Garage, Punk / Ardennes)THE JUNGLE SHAKERS(Rockabilly, Folk, Americana / Ardennes)MIGHTY TSAR(Folk, Hillbilly, Country / Ardennes)BILLETTERIE6 (adhérent), 7 (en prévente), 10 (sur place)LE VERT BOCK (Charleville-Mézières), MJC Calonne (Sedan), Ba'ROCK Café (Sedan), Fnac, Carrefour, Géant, Système U, Intermarché, www.fnac.com, www.carrefour.fr, www.francebillet.com, 0 892 68 36 22 (0,34/min)",,,,,,,,,,,,,,,,,http://cnstlltn.com/master/73377cc5-9fe7-451b-bb25-789b02efa83a/heavy+trash+en+concert.jpg,,,,,,,,,,,,,08/05/16,08/05/16,,,,,,,,,,,,,,,,,,,,,,,,,,,,,français,,,,,,,,,,,,,,,,,,,,,,,,,,,,,,,,,,,,,,,,,,,,,,,,,,,,,,,,,,,,,,,,,,,,,,,,,,,,,,,,,,,,,,,,,,,,,,,,,,,,,,,,,,,,,,,,,,,,,,,,,,,,,,,,,,
FMACHA0080011901,Histoire d'un sentier de découverte,Fêtes et Manifestations,Animation locale,Divers,,,,,,,,,,8290,LE FRETY,FRANCE,,,,,,,,49.73355,4.260337,,,,Histoire d'un sentier de découverte ,,Du projet à la réalité,"de 14h à 17h avec le PNR circuit de 4 kilomètres, gratuit",,,,,,,,,,,,,,,,,http://cnstlltn.com/master/634c449a-34e0-4c31-936a-a25cd7294808/t%c3%a9l%c3%a9chargement+(1).jpg,,,,,,,,,,,,,08/10/16,08/10/16,,,,,,,,,,,,,,,,,,,,,,,,,,,,,français,,,,,,,,,,,,,,,,,,,,,,,,,,,,,,,,,,,,,,,,,,,,,,,,,,,,,,,,,,,,,,,,,,,,,,,,,,,,,,,,,,,,,,,,,,,,,,,,,,,,,,,,,,,,,,,,,,,,,,,,,,,,,,,,,,
FMACHA0080011775,Inauguration de la  Transemoysienne  et  Festival des Randonnées ,Fêtes et Manifestations,,,,,,,,,,,,8800,MONTHERME,FRANCE,324544673,,,ot.montherme@wanadoo.fr,,http://www.meuse-semoy-tourisme.com,,49.89996,4.750521,,,,Inauguration de la  Transemoysienne  et  Festival des Randonnées ,,,"Samedi 14 mai 2016Inauguration de la  Transemoysienne  et  Festival des Randonnées  Randonnée pédestres, balades contées, animations diverses Départ au lieu dit de  La Racine  à Monthermé",,,,,,,,,,,,,,,,,http://cnstlltn.com/master/a4c36dee-f991-42e2-9b7b-52c36e557e20/passerelle+voie+transsemoysienne+%c3%a0+phades+06+07+15.jpg,,,,,,,,,,,,,14/05/16,14/05/16,,,,,,,,,,,,,,,,,,,,,,,,,,,,,français,,,,,,,,,,,,,,,,,,,,,,,,,,,,,,,,,,,,,,,,,,,,,,,,,,,,,,,,,,,,,,,,,,,,,,,,,,,,,,,,,,,,,,,,,,,,,,,,,,,,,,,,,,,,,,,,,,,,,,,,,,,,,,,,,,
FMACHA0080011789,Initiation au tir à l'arc,Fêtes et Manifestations,,,,,,,,,,,,8270,WIGNICOURT,FRANCE,,,,ot.cretes@orange.fr,,,,49.57873,4.578579,,,,Initiation au tir à l'arc,,,Envie de découvrir et d'apprendre à faire du tir à l'arc ? Rendez-vous le 28 août à Wignicourt.,,,,,,,,,,,,,,,,,http://cnstlltn.com/master/7df879bf-4ec5-4496-bb67-85a282e8d9ee/tiralarc.jpg,,,,,,,,,,,,,28/08/16,28/08/16,,,,,,,,,,,,,,,,,,,,,,,,,,,,,français,,,,,,,,,,,,,,,,,,,,,,,,,,,,,,,,,,,,,,,,,,,,,,,,,,,,,,,,,,,,,,,,,,,,,,,,,,,,,,,,,,,,,,,,,,,,,,,,,,,,,,,,,,,,,,,,,,,,,,,,,,,,,,,,,,
FMACHA0080010717,Initiations au canoe kayak,Fêtes et Manifestations,Manifestation sportive,Divers,,,,,,,Rue du Pont de la Folie,,,8190,ASFELD,FRANCE,07 81 93 58 15,,,csna08@gmail.com,,http://www.canoe-kayak-asfeld.org,,49.51503,4.383214,,,,Initiation au canoe kayak,,du lundi au vendredi de 14h à 16h30 pour les 7-15 ans,Initiations gratuites pendant les vacances scolaires8 pour les + de 15 ans et adultesPlaces limitées sur réservationRendez-vous Pont de la Folie,,,,,,,,,,,,,,,,,http://cnstlltn.com/master/c6612c33-65c6-4f3d-b4da-a4a312ae91e0/asfeld_challenge_mai2014_otpr+(58).jpg,,,,,,,,,,,,,04/04/16,08/04/16,11/04/16,15/04/16,,,,,,,,,,,,,,,,,,,,,,,,,,,français,,,,,,,,,,,,,,,,,,,,,,,,,,,,,,,,,,,,,,,,,,,,,,,,,,,,,,,,,,,,,,,,,,,,,,,,,,,,,,,,,,,,,,,,,,,,,,,,,,,,,,,,,,,,,,,,,,,,,,,,,,,,,,,,,,
FMACHA0080012083,Installez-vous en Maraîchage,Fêtes et Manifestations,Autres Evènements ,Divers,,,,,,,,,,8130,ATTIGNY,FRANCE,03 24 35 22 22,,,,,,,49.47819,4.577652,,,,Installez-vous en Maraîchage,,Gratuit,"Vous souhaitez développer une activité de maraîchage, venez à notre rencontre!Rendez-vous à 14h.Renseignements auprès de la Communauté de Communes des Crêtes Préardennaises.",,,,,,,,,,,,,,,,,http://cnstlltn.com/master/272c8857-0b52-4b5d-b902-85afcf60f20c/20+ans+cr%c3%aates.jpg,,,,,,,,,,,,,27/04/16,27/04/16,,,,,,,,,,,,,,,,,,,,,,,,,,,,,français,,,,,,,,,,,,,,,,,,,,,,,,,,,,,,,,,,,,,,,,,,,,,,,,,,,,,,,,,,,,,,,,,,,,,,,,,,,,,,,,,,,,,,,,,,,,,,,,,,,,,,,,,,,,,,,,,,,,,,,,,,,,,,,,,,
FMACHA0080008810,J-365 Week-end Marionnette ,Fêtes et Manifestations,Son et Lumière,Spectacle,,,Marionnette,Théâtre de rue,,,Centre ville,,,8000,CHARLEVILLE MEZIERES,FRANCE,03 24 59 94 94 ,,,,,http://www.festival-marionnette.com,,49.76208,4.726096,,,,J-365 Week-end Marionnette ,,,"Un an avant le 19e Festival Mondial des Théâtres de Marionnettes de septembre 2017...Au programme : spectacles, exposition, présentation des projets 2017, apéritif, rencontres, etc.Il s'agit de la 4e édition du  Weekend Marionnettes J-365 .Programme et réservation : juin 2016. www.festival-marionnette.com",,,,,,,,,,,,,,,,,http://cnstlltn.com/master/2a0809a9-2eca-4e8e-9e82-dac57eea972f/j-365.jpg,,,,,,,,,,,,,23/09/16,25/09/16,,,,,,,,,,,,,,,,,,,,,,,,,,,,,français,,,,,,,,,,,,,,,,,,,,,,,,,,,,,,,,,,,,,,,,,,,,,,,,,,,,,,,,,,,,,,,,,,,,,,,,,,,,,,,,,,,,,,,,,,,,,,,,,,,,,,,,,,,,,,,,,,,,,,,,,,,,,,,,,,
FMACHA0080008319,Jeux Découvre la Ferme en Famille dans les Ardennes,Fêtes et Manifestations,Nature et détente,Jeune public,,,Animaux,,,,,,11 la croix colas,8380,SIGNY LE PETIT,FRANCE,03 24 53 11 25,,,myriam.vignier@gmail.com,,http://jeuxfermefamilleardennes.jimdo.com/,,49.91295,4.260957,,,,jeux découvre la ferme en famille dans les Ardennes,Visite de la ferme ,"Tous les après midi à 17h30, le mercredi et le dimanche toute la journée sur réservation.","Venez visiter une vraie ferme en activité, à Signy le petit dans le hameau de la Croix Colas à la sortie du village.Lla visite commence avec les animaux à plumes, reconnaître les mamans des papas, la reproduction..., les enfants sont libres de donner à manger, ramassage des oeufs. Visite des chèvres et les bébés, les moutons, l'âne et sa couleur originale. Les lapins qui adorent les carottes, les poneys, photos possibles avec tous les animaux qui ont un nom (Bijoux, Flocon, Fleurette, Filou, Etoile, Neige, Lili, Caramel). La mascotte de la visite c'est Flocon qui a été élevé au biberon il est super amical.A la fin de la visite il est possible d'apporter le goûter et rester sur place ou de continuer la visite avec un jeu dans la ferme ou dans le hameau de la Croix Colas.",,,,,,,,,,,,,,,,,http://cnstlltn.com/master/8244aeac-a2bd-4deb-a8d6-90d4e690a147/1920444_578126428939360_717343649_n.jpg,http://cnstlltn.com/master/286c8128-e612-4dc9-a9b0-9b636714133f/1656151_578126278939375_1142997977_n.jpg,http://cnstlltn.com/master/3880f4c4-2d79-4b26-98cd-16b0acf2b1cb/1798622_578126865605983_1925826589_n.jpg,,,,,,,,,,,07/02/16,05/03/16,03/04/16,30/04/16,03/07/16,03/09/16,23/10/16,06/11/16,,,Autres,,VIGNIER,Myriam,,,03 24 53 11 25,,,,,,,,,,,,,,français,anglais,,,,Chèques bancaires et postaux,Chèques Vacances,Espèces,,,,,,,,Aire de pique-nique,Parking,Sur une exploitation agricole,,,,,,,,,,,,,,,,,,Circuits touristiques,Commerce alimentaire,Location de vélos,Médecin,Plats à emporter/Plats cuisinés,Point argent,Vente de produits touristiques,Visites guidées,,,,,,,,,,,,,,,,,,Point d'eau potable,,,,,Y,20,5,,,,forfait famille,5.00,5.00,,,,,,,,,,,,,,,,,,,,,,,,,,,,,,,,,,,,,,,,,,,,,,,,,,,,,,,,,
FMACHA0080011645,Johnny Hallyday en concert,Fêtes et Manifestations,Musique,Concert,,,,,,,Boulevard de Lattre de Tassigny,Stade Louis Duguauguez,,8200,SEDAN,FRANCE,,,,,,,,49.69411,4.938887,,,,Johnny Hallyday en concert exceptionnel,,"Pour sa tournée  Rester vivant , Johnny passera le 29 juin prochain par Sedan","Le compte à rebours est dores et déjà lancé pour lassociation FLAP,en charge de lévénement et à linitiative de ce concert XXL de Johnny Hallyday négocié en coulisses depuis plusieurs semaines. Sauf cataclysme, Johnny Hallyday sera bien devant ses fans ardennais le29 juin, sur une scène exceptionnellement bâtie pour loccasion, à partir de 22 heures. Deux groupes, dont le nom na pas été divulgué, assureront la mise en bouche du début de soirée. Côté public, 24 500 places seront mises en vente dici deux semaines  aucune information na filtré quant au prix des places",,,,,,,,,,,,,,,,,http://cnstlltn.com/master/8e85ae61-ac99-4121-abeb-6193da6b1f8e/johnny-hallyday-credit-warn-2823659ahkma-jpg-160210164613.jpg,,,,,,,,,,,,,29/06/16,29/06/16,,,,,,,,,,,,,,,,,,,,,,,,,,,,,français,,,,,,,,,,,,,,,,,,,,,,,,,,,,,,,,,,,,,,,,,,,,,,,,,,,,,,,,,,,,,,,,,,,,,,,,,,,,,,,,,,,,,,,,,,,,,,,,,,,,,,,,,,,,,,,,,,,,,,,,,,,,,,,,,,
FMACHA0080009129,Journée Américaine,Fêtes et Manifestations,Manifestation Culturelle,,,,,,,,Lieu dit le Ranch de Corbon,,,8400,ST MOREL,FRANCE,06 84 37 99 81,03 24 30 68 29 ,,aba.08@hotmail.fr,,,,49.33929,4.704906,,,,Journée Américaine,,De 10h à 19h,"Journée organisée par Arden Buckaroos. Animations diverses: Manifestation équitation western, avec exposants, plusactivités divers liées a l'esprit américaine. Buvette et petite restauration sur place.",,,,,,,,,,,,,,,,,http://cnstlltn.com/master/26f3ce0a-19de-4b7d-bc26-79829723ee02/journ%c3%a9e+am%c3%a9ricaine.jpg,,,,,,,,,,,,,21/08/16,21/08/16,,,,,,,,,,,,,,,,,,,,,,,,,,,,,français,,,,,,,,,,,,,,,,,,,,,,,,,,,,,,,,,,,Bar,,,,,,,,,,,,,,,,,,,,,,,,,,,,,,,,,,,,Tarif ,0.00,2.00,,,,,,,,,,,,,,,,,,,,,,,,,,,,,,,,,,,,,,,,,,,,,,,,,,,,,,,,,
FMACHA0080011811,Journée de la femme,Fêtes et Manifestations,,,,,,,,,,,,8200,SEDAN,FRANCE,03 24 27 73 73,,,contact@tourisme-sedan.fr,,,,49.70349,4.93863,,,,Journée de la femme,,entrée libre,"Conférences et expositions :5 mars : galerie des Antiques, Château Fort8 mars : amphithéâtre P. Mendés France8 mars au 15 avril : à l'hôtel de Ville",,,,,,,,,,,,,,,,,http://cnstlltn.com/master/a046b1e4-54c8-478e-b55e-8657a6586f24/capture+d%27%c3%a9cran+2016-02-24+%c3%a0+16.54.53.png,,,,,,,,,,,,,05/03/16,05/03/16,08/03/16,15/04/16,,,,,,,,,,,,,,,,,,,,,,,,,,,français,,,,,,,,,,,,,,,,,,,,,,,,,,,,,,,,,,,,,,,,,,,,,,,,,,,,,,,,,,,,,,,,,,,,,,,,,,,,,,,,,,,,,,,,,,,,,,,,,,,,,,,,,,,,,,,,,,,,,,,,,,,,,,,,,,
FMACHA0080005243,Journée Patrimoine de Pays ,Fêtes et Manifestations,Manifestation Culturelle,Portes ouvertes,,,Historique,,,,Rue tranquille,,,8400,FALAISE,FRANCE,06 86 12 91 38,,,m.coistia@free.fr,,,,49.4582,4.879044,,,,Journée Patrimoine de Pays ,,,"Visites et animations des sites patrimoniaux du village, expositions d'artisans locaux sur le thème  Les savoir-faire , circuit pédestre dans Falaise et concert en l'église à 18h. Visite gratuite. Organisée par l'Association de Sauvegarde du Patrimoine Vouzinois",,,,,,,,,,,,,,,,,http://cnstlltn.com/master/74944744-f790-40ec-b227-93e5a31ecbb5/img_7593.jpg,,,,,,,,,,,,,19/06/16,19/06/16,,,,,,,,,,,,,,,,,,,,,,,,,,,,,français,,,,,,,,,,,,,,,,,,,,,,,,,,,,,,,,,,,Gratuit,,,,,,,,,,,,,,,,,,,,,,,,,,,,,,,,,,,,,,,,,,,,,,,,,,,,,,,,,,,,,,,,,,,,,,,,,,,,,,,,,,,,,,,,,,,,,,,
FMACHA0080011700,Journées Américaines,Fêtes et Manifestations,Insolite,Fête traditionnelle,,,Animaux,Artisanat,Sport équestre,,,,,8130,CHUFFILLY ROCHE,FRANCE,03 24 30 76 08,,,,,,,49.44751,4.605751,,,,Journées Américaines,,,"L'association Arden Buckaroos organise un week-end américain.Découvrez de nombreuses disciplines équestres, marché artisanal...",,,,,,,,,,,,,,,,,http://cnstlltn.com/master/0a404201-c5e4-40c0-9a9a-5d0b4eef21d1/cheval.jpg,http://cnstlltn.com/master/aac5ff90-5915-4395-8f67-2a7aec6942dc/indien.jpg,,,,,,,,,,,,20/08/16,21/08/16,,,,,,,,,,,,,,,,,,,,,,,,,,,,,français,,,,,,,,,,,,,,,,,,,,,,,,,,,,,,,,,,,,,,,,,,,,,,,,,,,,,,,,,,,,,,,,,,,,,,,,,,,,,,,,,,,,,,,,,,,,,,,,,,,,,,,,,,,,,,,,,,,,,,,,,,,,,,,,,,
FMACHA0080005918,Journées du Patrimoine aux Portes du Luxembourg,Fêtes et Manifestations,Manifestation Culturelle,Exposition,,Journées du Patrimoine,,,,,Aux portes du Luxembourg,,,8110,CARIGNAN,FRANCE,03 24 27 73 73,,,contact@tourisme-sedan.fr,,,,49.63249,5.168674,,,,Journées du Patrimoine aux Portes du Luxembourg,,Rendez vous en Trois Cantons.,"CARIGNAN Exposition Exposition thématique autour des archives anciennes de la ville d'Yvois-Carignan Remparts des XVIe - XVIIe s., construits par Charles Quint à la place de lenceinte du Moyen Âge, puis remaniés à lépoque de Louis XIVSam. 14h-18h Dim. 9h-12h - 14h-18h03 24 22 07 89 - www.chay08.free.fr - 1 Place de du Docteur GairalCHEMERY-SUR-BAR Église Notre-Dame de Malmy Église romane du XIe s.Vis. libre sam-dim 9h-18h Vis. guidée sam-dim 14h-17h Église Saint-Sulpice Bas-côtés, chur et transept voûtés sur croisées dogives du XIIIe s.Vis. sam 14h-18h - dim 10h-19h03 24 35 42 58 - dom.pontoise@orange.frLA FERTÉ-SUR-CHIERSOuvrage de la Ferté Fort réalisé entre 1935 et 1938. Dernier maillon de la ligne Maginot à louest. Théâtre de combats en mai 1940Vis. guidée int. avec guides en uniforme : sam-dim 10h-17h 4 par adulte et 2 de 4-14 ans Vis. nocturne. sam-21h 5 par adulte et 3 de 4-14 ans (sur réas)Croix de Villy : 03 24 42 35 76 - schmidt-villy-laferte@orange.fr - www.ouvragelaferte.frLE MONT DIEUGrange de la Correrie de la Chartreuse du Mont Dieu Vestige le plus ancien de la chartreuse, faisait partie d'un ensemble de bâtiments assurant le temporel des Chartreux.Vis. sam-dim 10h-13h -14h-17hLa correrie - 03 24 30 14 51La Chartreuse du Mont Dieu Fondée en 1137, la chartreuse va connaître un formidable développement économique et spirituel. Reconstruite au début du XVIIe s., transformée en prison et vendue comme carrière à la Révolution, elle est sauvée de la destruction totale par Le manufacturier Poupart de NeuflizeVis. sam-dim 14h30 ; 16h ; et 17h30 - RDV à l'entrée06 86 12 91 38MAISONCELLE-ET-VILLERS Château de Villers Château du XVIe s. remanié au XVIIIe s., flanqué de 4 tours, avec des douves sur 3 côtés.Vis. libre ou guidée sam-dim 10h-12h / 14h-18h03 24 35 43 13MOUZON Église abbatiale Notre-Dame Majestueuse église du premier art gothique fin XIIIe s.Vis. int. sam-dim 15h-19h ; Promenade musicale  Découverte de l'orgue  dim 15h-19h 06 87 24 23 55 - amismouzon@free.fr - http://amismouzon.free.frMusée du feutre Place du ColombierLa collection permet de découvrir lévolution de la production du plus ancien textile au monde, de lartisanat à la production industrielle, jusquaux uvres dartistes contemporainsVis. sam-dim 14h-18h 03 24 26 19 91 - musee.atelier.du.feutre@wanadoo.fr - www.mouzon.fr/musee.aspREMILLY-AILLICOURT Château de Remilly Maison de plaisance, construite en 1774, pour un manufacturier en drap sedanaisVis. guidée dim 14h ; 15h et 16h - 203 24 26 79 77",,,,,,,,,,,,,,,,,http://cnstlltn.com/master/64a07594-2321-47e5-9746-70c6d6c8fc21/jep-2014-vignette.jpg,,,,,,,,,,,,,17/09/16,18/09/16,,,,,,,,,,,,,,,,,,,,,,,,,,,,,français,,,,,,,,,,,,,,,,,,,,,,,,,,,,,,,,,,,,,,,,,,,,,,,,,,,,,,,,,,,,,,,,,,,,,,,,,,,,,,,,,,,,,,,,,,,,,,,,,,,,,,,,,,,,,,,,,,,,,,,,,,,,,,,,,,
