"PCUCHA0080000097","Fortifications de Mézières","Patrimoine culturel","Site et monument historiques",,,,"Ensemble fortifié","Militaire","Moyen Age",,,," ",8000,"CHARLEVILLE MEZIERES","FRANCE","03.24.55.69.90",,"03.24.55.69.89","charl.mez@wanadoo.fr",,"www.charleville-tourisme.com",,"49.77361","4.72021",,,,"FORTIFICATIONS DE MEZIERES",,,"Mézières, la médiévale : vous avez rendez-vous avec l'Histoire de France ! En saison : balades des remparts / visites aux flambeaux En 1521, Charles Quint, qui tente d'entrer dans le Royaume de France est arrêté à Mézières par le Chevalier Bayart, envoyé par François 1er, pour prêter main forte aux macériens. Le siège de Mézières fut héroïquement tenu et les armées de l'Empire abandonnèrent. La ville s'étant affirmée comme un lieu stratégique de défense du Royaume à la frontière, les fortifications de Mézières ont été renforcées.",,,,,,,,,,,,,,,,,"http://cnstlltn.com/master/5e43cb0a-2e4f-497f-b27f-a9e7c0acf175/001_les_remparts_de_mezieres_david-truillard.jpg","http://cnstlltn.com/master/e8997ce9-272f-44e5-a528-5474ac1e4b30/002_les_remparts_de_mezieres_david-truillard.jpg","http://cnstlltn.com/master/6105e7b5-019c-4631-a70e-cf43d3f8dcfa/003_les_remparts_de_mezieres_philippe_mangen.jpg",,,,,,,,,,,,,,,,,,,,,"Renseignement/Information",,"OFFICE DE TOURISME DE CHARLEVILLE MEZIERES",,,"charl.mez@wanadoo.fr","03.24.55.69.90","03.24.55.69.89","Autres",,"OFFICE DE TOURISME DE CHARLEVILLE MEZIERES",,,"charl.mez@wanadoo.fr","03.24.55.69.90",,,,,,,,,,,,,,,,,,,,,,,,,,,,,,,,,,,,,,,,,,,,,,,,,,,,,,,,,,,,,,,,,,,,,,,,,,,,,,,,,,,,,,,,,,,,,,,,,,,,,,,,,,,,,,,,,,,,,,,,,,,,,,,,,,,,,,,,
"PCUCHA0080000106","FORTIFICATIONS DE ROCROY","Patrimoine culturel","Site et monument historiques","Petites cités de caractère",,,"Ensemble fortifié","Histoire","Militaire",,,," ",8230,"ROCROI","FRANCE","03.24.54.20.06",,"03.24.54.20.06","ot.rocroi@wanadoo.fr",,"www.otrocroi.com",,"49.92491","4.520786",,,,"FORTIFICATIONS DE ROCROY",,"FORTIFICATIONS","Rocroi, ville étoile! Site unique en France dû à son urbanisme radio concentrique. Les premières fortifications datent de 1555 sous Henry II. Les dernières ont été remaniées par Vauban jusqu'en 1675.Venez visiter notre ville et ses fortifications en visite libre ou guidés. Les visites guidées vous ferons découvrir les entrailles des murailles, elles n'auront plus de secret pour vous.En famille ou entre amis ou club Rocroi vous accueil, sur le projet de Ville Etape arrêtez vous tous les services sont à votre disposition. Restaurants, produits du terroir, air de jeux et camping car.L'office de Tourisme sur la place est ouvert tous les jours.",,,,,,,,,,,,,,,,,"http://cnstlltn.com/master/d6e803ad-986c-4c32-92f8-1bf63b7038b1/d6e803ad-986c-4c32-92f8-1bf63b7038b1_134.jpg","http://cnstlltn.com/master/c463f0bd-dc34-44ad-a1b6-16d8fd103387/11709492_838920869510598_4648575878346422348_n.jpg","http://cnstlltn.com/master/bf41245f-9832-419c-9db8-eeab199f6927/11745752_836435156425836_8533428093970649203_n.jpg",,"Villages et Petites cités de caractère","Village étape",,"Animaux acceptés",,,,,,,,,,,,,,,,"Renseignement/Information",,"BENTZ","Sylviane",,"info@otrocroi.com","03.24.54.20.06","03.24.54.20.06","Autres",,"BENTZ","Sylviane",,"info@otrocroi.com","03.24.54.20.06",,,,,,"néerlandais","anglais",,,,,,,,,,,,,,"Aire de pique-nique","Bar","Boutiques","Jeux pour enfants","Parking","Parking autocar","Restaurant","Salle des fêtes-spectacle","Sentiers balisés","Tables de pique-nique",,,,,,,,,,,"Ouverture 24/24",,,,,,,,,,,,,,,,,,,,"Atelier pour adultes","Atelier pour enfants","Visite guidée",,,"Point d'eau potable",,,,,"Y",100,8,,,,"adulte","0.00","3.00",,,,,,,,,,,,,,,,,,,,,,,,,,,,,,,,,,,,,,,,,,,,,,,,,,,,,,,,,
"PCUCHA0080000069","The fresco of the  Scailleteux ","Patrimoine culturel","Site et monument historiques",,,,"Arts décoratifs","Métiers",,,,," ",8170,"FUMAY","FRANCE","03 24 41 10 34",,"03 24 42 67 68",,,,,"49.99357","4.706954",,,,"Fresque des Scailleuteux - Fumay-Ardenne-France",,"Fresque en hommage aux Scailleteux, ardoisiers du bassin de Fumay. Inaugurée en 1988, cette fresque est l'oeuvre du sculpteur Georges-Armand FAVAUDON, artiste réputé.","Elle représente diverses phases du travail de l'Ardoise et symbolise un réel hommage rendu aux mineurs du bassin de Fumay.","The fresco of the  Scailleteux  Givet-Ardenne-France",,"The fresco of the  Scailleteux  is the work of G.A Fauvaudon, a well-known artist in the Val d'Ardenne region.","The fresco is dedicated to the men who extracted blocks of slate from the mines.",,,,,,,,,,,,,"http://cnstlltn.com/master/b2b012b9-bd80-49c1-8313-3ab2a1b41ba3/1287000248_1.jpg",,,,"2 fleurs","Villes et villages fleuris",,,,,,,,,,,,,,,,,,"Renseignement/Information",,"RODRIGUEZ","Pascal",,"info.tourisme@ardennerivesdemeuse.com","03 24 42 92 42",,"Direction",,"MAIRIE DE FUMAY",,,"fumay.site@wanadoo.fr","03.24.41.10.34","03.24.41.26.90",,,,,,,,,,,,,,,,,,,,,,,,,,,,,,,,,,,,,,,,,,,,,,,,,,,,,,,,,,,,,,,,,,,,,,,,,,,,,,,,,,,,,,,,,,,,,,,,,,,,,,,,,,,,,,,,,,,,,,,,,,,,,,,,,,,,,,,
"PCUCHA0080000155","Givet and its gates","Patrimoine culturel","Site et monument historiques",,,,"Ensemble fortifié","Militaire","Ville",,"RN51 quai de Rancennes-quai Dervaux",," ",8600,"GIVET","FRANCE","03 24 42 06 84",,,,,,,"50.13592","4.825061",,,,"Givet et ses portes - Givet-Ardenne-France",,"Ville fortifiée sous Louis XIV, Givet s'ouvrait alors par six portes, toutes équipées de pont levis et près desquelles se trouvait un garde de corps, abritant un soldat chargé du guet.","Aujourd'hui de ces six portes, il n'en reste que trois : - Porte de France sur la route 8051 - Porte de Rancennes à proximité du quai de Rancennes - Porte Charbonnière au bout du quai Dervaux.","Givet and its gates Ardenne-France",,"In the olden days, at the time of Vauban and Louis XIV, the town of Givet was fortified. There was 6 gates all equipped with a drawbridge and a guardroom.","Of these 6 gates, 3 still exist : La porte de France  : the only access towards France (main road 8051) La porte de Rancennes  : On the right bank of the river, the access towards the village of Rancennes. La porte Charbonnière  : Also on the right bank of the river, one of the accesses towards Belgium.",,,,,,,,,,,,,"http://cnstlltn.com/master/923e91c1-08e8-411c-b74a-0df703aeb7d4/923e91c1-08e8-411c-b74a-0df703aeb7d4_134.jpg","http://cnstlltn.com/master/297ea8b0-bee6-44e4-a9c6-c397f172acb9/297ea8b0-bee6-44e4-a9c6-c397f172acb9_134.jpg","http://cnstlltn.com/master/becbf6e2-6008-4115-a554-dc746b258bb7/becbf6e2-6008-4115-a554-dc746b258bb7_134.jpg",,,,,,,,,,,,,,,,,,,,,,,,,,,,,,,,,,,,,,,,,,,,,,,,,,,,,,,,,,,,,,,,,,,,,,,,,,,,,,,,,,,,,,,,,,,,,,,,"Visite guidée",,,,,,,,,,,,,,,,,,,,,,,,,,,,,,,,,,,,,,,,,,,,,,,,,,,,,,,,,,,,,,,,,,,,,,,,,,,
"PCUCHA0080000276","Hameau de Chaumont","Patrimoine culturel","Site et monument historiques",,,,,,,,"Rue de l'école",,,8350,"NOYERS PONT MAUGIS","FRANCE","03 24 27 73 73",,,"contact@tourisme-sedan.fr",,,,"49.64951","4.918013",,,,"Hameau de Chaumont",,,"Sur un des chemins de Compostelle, Chaumont qui tire son nom de Ğ Calvus Mons ğ (le mont chauve) est situe´ a` proximite´ de lancien prieure´ de StQuentin. Ils formaient autrefois la commune inde´pendante de Chaumont-St Quentin.Le´glise Saint Pierre de Chaumont, qui date du XIIe`me, a surve´cu a` lassaut des panzers allemands en mai 1940. De la pe´riode appele´e Ğ dro^le de guerre ğ(3 septembre 1939  10 mai 1940), il ne subsiste, a` Chaumont que quelques linteaux de porte grave´s : Ğ Au plat du jour, chez Maxims, Caverne des Grognards, Aux gueules casse´es ğ ! Traces dhumour dun sculpteur parmides milliers dhommes de´sempare´s.La Ğ dro^le de guerre ğ en anglais phoney war, Ğ fausse guerre ğ ; en allemand Sitzkrieg, Ğ guerre assise ğ;est la pe´riode entre la de´claration de guerre par la France et le Royaume-Uni (les Allie´s) a` l'Allemagne nazie le 3 septembre 1939 et l'invasion par cette dernie`re de la France, de la Belgique, du Luxembourg et des Pays-Bas le 10 mai 1940. Les arme´es allie´es attendaient l'offensive dans les villages en trompant l'ennui. Les communique´s des arme´es ne faisaient e´tat d'aucune activite´ notoire, tout au plus quelques escarmouches.Le´tat-major franc¸ais est convaincu que la fore^t des Ardennes est infranchissable me^me pour les panzers de Hitler. Les travaux de´fensifs aux frontie`res sont en retard et contrairement aux mises en garde de la de´le´gation parlementaire venue inspecter les travaux de fortification et larmement des troupes du secteur sedanais, le Ge´ne´ral Huntziger e´tait inconscient de ce degre´ dimpre´paration.Des blockhaus sont de´pourvus de portes et ne sont pas tous e´quipe´s darmes.Ces soldats sont dautant plus de´mobilise´s psychologiquement quils vivent au milieu de la population civile comme en temps de paix.","Hameau de Chaumont",,,"On one of the roads to Compostelle, Chaumont, the name of which originates from Calvus Mons - the bare mount - is located near the ancient priory of Saint Quentin. Both towns originally formed the independent district of Chaumont-St Quentin. Saint Peters church in Chaumont, which dates back to the 12th century, survived the German panzers' attacks in 1940.Of the period called the phoney war (September 3, 1939  May 10, 1940), only a few engraved door lintels remain : Today's special, at Maxim's, Caverne des Grognards, At the smashed faces! like many very innocent traces of humour left by a sculpter among thousands of distraught men.The phoney war, known as the Sitzkrieg in German (the sitting down war), is the period between the declaration of war by France and the United Kingdom (The Allies) against Nazi Germany on the 3 September 1939, and the invasion by the latter of France, Belgium, Luxembourg, and Holland on the 10 May 1940. The Allies were waiting for the offensive in the villages by whiling away boredom. The information from the armies made no mention of any notable activity, except for a few skirmishes.The French army officers were convinced that the Ardennes Forest was insurmountable even for Hitlers panzers. The defence system on the borders was behind schedule, and contrary to the warnings of the parliamentary delegation who came to inspect the fortification work and the arming of the troops in the Sedan sector, general Huntziger was unaware of the degree of lack of preparation.The blockhouses were without doors and not all armed. These soldiers were psychologically demobilised even more because they were living in the middle of the civil population just as they would in time of peace.","Hameau de Chaumont",,,"Der Name Chaumont kommt von Ğ Calvus Mons ğ (der kahle Berg). Die Stadt liegt auf dem Weg nach Compostelle und befindet sich in der Na¨he der ehemaligen Klosterkirche von St Quentin. Fru¨her war dies die unabha¨ngige Gemeinde Chaumont-St Quentin. Die Kirche Saint Pierre von Chaumont, datiert aus dem XII. Jahrhundert, hat den Angriff der deutschen Panzer im Mai 1940 u¨berstanden.Von der als Ğ komischer Krieg ğ genannten Periode (3. September 1939 - 10. Mai 1940), gibt es in Chaumont nur noch einige gravierte Tu¨ren: Ğ Tagesgericht bei Maxims, Keller der Grognard (Soldat der Napoleonischen Garde), Zur eingeschlagenen Fresse ğ ! Spuren eines eigenartigen Humors, hinterlassen von einem Schnitzer zwischen den ratlosen Soldaten.Von der als Ğ komischer Krieg ğ genannten Periode (3. September 1939 - 10. Mai 1940), gibt es in Chaumont nur noch einige gravierte Tu¨ren: Ğ Tagesgericht bei Maxims, Keller der Grognard (Soldat der Napoleonischen Garde), Zur eingeschlagenen Fresse ğ ! Spuren eines eigenartigen Humors, hinterlassen von einem Schnitzer zwischen den ratlosen Soldaten.Was in franzo¨sisch dro^le de guerre, in englisch phoney war und in deutsch Sitzkrieg  benannt ist, entspricht der Zeitperiode zwischen der Kriegserkla¨rung an Nazi Deutschland von Frankreich und Grossbritannien (den Alliierten) am 3. September 1939 und dem Einfall in Frankreich, Belgien, Luxemburg und die Niederlande von den deutschen Truppen am 10.Mai 1940. Die alliierten Armeen warteten auf die Angriffe in den Do¨rfern und bescha¨ftigten sich umsonst, um sich nicht zu langweilen. In den Frontberichten der Armeen war nichts u¨ber einer kriegerischen Aktivita¨t ausser unbedeutenden Scharmu¨tzeln zu lesen.Der franzo¨sische Generalstab ist u¨berzeugt, dass der Ardennenwald auch fu¨r die Panzer von Hitler unu¨berschreitbar ist. An den Grenzen haben die Verteidigungswerke und Schutzarbeiten Verspa¨tung und trotz der Warnungen der Parlamentabgeordneten, die das Befestigungswerk und die Ausru¨stung der Truppen im Sedaner Sektor inspiziert hatten, war der General Huntziger dieses Mangels an Vorbereitungen nicht bewusst.Blockha¨user haben keine Tu¨ren und sind nicht alle mit Waffen ausgeru¨stet. Die Soldaten sind um so mehr entlassen und unmotiviert, als sie mitten in der Zivilbevo¨lkerung leben, als ob sie in einer Zeit von Frieden wa¨ren.",,,,,,,,,"http://cnstlltn.com/master/a96c40e8-a94e-4b65-9fbb-dea13eed1270/logo-me%c2%b4moire.jpg",,,,,,,,,,,,,,,,,,,,,,,,,,,,,,,,,,,,,,,,,,,"français",,,,,,,,,,,,,,,,,,,,,,,,,,,,,,,,,,,,,,,,,,,,,,,,,,,,,,,,,,,,,,,,,,,,,,,,,,,,,,,,,,,,,,,,,,,,,,,,,,,,,,,,,,,,,,,,,,,,,,,,,,,,,,,,,,
"PCUCHA0080000021","Hôtel de Ville de Rethel","Patrimoine culturel",,,,,,,,,,,,8300,"RETHEL","FRANCE",,,,,,,,"49.51503","4.383214",,,,"Hôtel de ville de Rethel",,,"Beau bâtiment de style Renaissance construit après la première Guerre mondiale. Un escalier dhonneur donne accès à lédifice et sur les murs de la salle dhonneur sont accrochées des toiles du peintre rethélois Eugène Thiéry, représentant Rethel au début du XXème siècle. Une plaque rappelle lemplacement de lancien hôtel de ville qui se trouvait à quelques mètres, rue Pierre Curie, à côté du café Ğ le Marcassin ğ.",,,,,,,,,,,,,,,,,"http://cnstlltn.com/master/df021c75-d6ee-4308-9ef9-ddc418e122c4/df021c75-d6ee-4308-9ef9-ddc418e122c4_134.jpg","http://cnstlltn.com/master/a801d4c1-c768-4e5d-986a-dfc7f56cd56d/a801d4c1-c768-4e5d-986a-dfc7f56cd56d_134.jpg",,,,,,,,,,,,,,,,,,,,,,,,,,,,,,,,,,,,,,,,,,"français",,,,,,,,,,,,,,,,,,,,,,,,,,,,,,,,,,,,,,,,,,,,,,,,,,,,,,,,,,,,,,,,,,,,,,,,,,,,,,,,,,,,,,,,,,,,,,,,,,,,,,,,,,,,,,,,,,,,,,,,,,,,,,,,,,
"PCUCHA0080000230","La Chapelle Saint Anne ","Patrimoine culturel",,"Non Classé",,,,,,,"Rue Emile Zola",,,8500,"REVIN","FRANCE","03 24 41 55 65",,,"contact@ville-revin.fr",,"http://www.ville-revin.net",,"49.94252","4.639964",,,,"La Chapelle Saint-Anne - Revin-Ardenne-France",,"Cette chapelle est très ancienne, bien abritée en haut de La Vau (rue Emile Zola) en centre ville.","On voit son autel pimpant, toujours bien entretenu.Sur le cintre surmontant la porte existait une inscription avec la vocable  Sainte-Anne  suivie de :  Anne Catherine Darche, fille de Guillaume Darche et de Marie Barbe Baudet .  Sa passion a été pour elle pendant le cours de sa vie .Anciennement, les jeunes filles lui disaient:  Bonne Sainte Anne dol vau? ;  C'est s't'in galant qui m'faut .Visite libre","Sainte Anne chapel - Revin-Ardenne-France",,"This very old chapel is located in the town centre of Revin (Rue Emile Zola).","Altar in good repair.On the arch surmounting the door was the following inscription:  Sainte-Anne  followed by  Anne Catherine Darche, daughter of Guillaume Darche and Marie Barbe Baudet .  Her passion was for her during the course of her life.  In the past, the girls used to say to Sainte Anne,  Bonne Sainte Anne dol vau ? ;  C'est s't'in galant qui m'faut .(In order words, they were looking for a good husband)Free visit",,,,,,,,,,,,,"http://cnstlltn.com/master/cc6aaae9-4e63-46a9-a86b-11a12587f136/cc6aaae9-4e63-46a9-a86b-11a12587f136_134.jpg",,,,,,,"Animaux acceptés","Accès handicapés",,,,,,,,,,,,,,,,,,,,,,,,,,,,,,,,,,,"français",,,,,,,,,,,,,,,,,,,,,,,,,,,,,,,,,,,,,,,,,,,,,,,,,,,,,,,,,,,,,,,,,,,,,,,,,,,,,,,,,,,,,,,,,,,,,,,,,,,,,,,,,,,,,,,,,,,,,,,,,,,,,,,,,,
"PCUCHA0080000229","La Chapelle Saint Eloi","Patrimoine culturel",,"Non Classé",,,,,,,,"Rue du Commandant Roland Pérot",,8500,"REVIN","FRANCE","03 24 41 55 65",,,"contact@ville-revin.fr",,"http://www.ville-revin.net",,"49.94189","4.637199",,,,"La Chapelle Saint Eloi - Revin-Ardenne-France",,"C'est la famille Faure, industriels de Revin, qui fit construire les cités qui portent leur nom dès 1930.Les travaux s'achevèrent alors par l'édification de cette chapelle en 1936.","La chapelle fut bâtie en deux temps: d'abord le fond actuel et les deux salles sur les côtés, puis en récupérant la charpente d'une usine démontée de la Petite Commune, on construisit la partie principale où se déroulent les messes aujourd'hui.La famille Faure en fit donation au diocèse pour le  franc symbolique .Visite libre.","Saint-Eloi chapel - Revin-Ardenne-France",,"The Faure family, industrialists in Revin, built the council estates in 1930. At the end of the construction, in 1936 more exactly, we built this chapel.","The chapel was built in two stages: first of all the far room, then the two rooms on each side. With the timber of a demolished firm was built the main part of the chapel where the masses take place today. The Faure family donated the chapel to the diocese for the  symbolic franc . Free visit.",,,,,,,,,,,,,,,,,,,,,,,,,,,,,,,,,,,,,,,,,,,,,,,,,,,,,,,,"français",,,,,,,,,,,,,,,,,,,,,,,,,,,,,,,,,,,,,,,,,,,,,,,,,,,,,,,,,,,,,,,,,,,,,,,,,,,,,,,,,,,,,,,,,,,,,,,,,,,,,,,,,,,,,,,,,,,,,,,,,,,,,,,,,,
"PCUCHA0080000055","La Chartreuse du Mont Dieu","Patrimoine culturel","Site et monument historiques","Classé ou inscrit (CNMHS)",,,"Abbaye","Chartreuse",,,"D977",," ",8390,"LE MONT DIEU","FRANCE","03 24 29 79 91",,,"contact@tourisme-sedan.fr",,,,"49.55305","4.856548",,,,"La Chartreuse du Mont Dieu",,"Plus ancienne chartreuse de France !","Située au cur des Ardennes, la chartreuse du Mont-Dieu (dont le domaine était très étendu) fut construite dans une vaste clairière, au milieu d'une forêt de 1 123 hectares, pleine d'arbres séculaires (chênes de Montpy) et constellée de sources, alimentant jadis de nombreux étangs.",,,,,,,,,,,,,,,,,"http://cnstlltn.com/master/679fbd84-c338-452d-94c1-fc2f24d08b79/679fbd84-c338-452d-94c1-fc2f24d08b79_134.jpg","http://cnstlltn.com/master/e321628e-49cc-4aee-919a-3bc630630d6b/e321628e-49cc-4aee-919a-3bc630630d6b_134.jpg","http://cnstlltn.com/master/2ebb85f9-9f40-47ef-b389-f810e7c435fc/2ebb85f9-9f40-47ef-b389-f810e7c435fc_134.jpg",,,,,,,,,,,,,,,,,,,,,,,,,,,,,,,,,,,,,,,,,,,,,,,,,,,,,,,,,,,,,,,,,,,,,,,,,,,,,,,,,,,,,,,,,,,,,,,,,,,,,,,,,,,,,,,,,,,,,,,,,,,,,,,,,,,,,,,,,,,,,,,,,,,,,,,,,,,,,,,,,,,,,,,,,,,
"PCUCHA0080000051","LA COUR DES PRES","Patrimoine culturel","Visite guidée","Musée prive","Renaissance",,"Ensemble fortifié","Histoire","Maison",,"La Cour des Prés","Rue Louis Martin","Route de Champlin ",8290,"RUMIGNY","FRANCE","03 24 35 52 66",,,"la-cour-des-pres@laposte.net",,,,"49.8077","4.266168",,,,"LA COUR DES PRES","Ouvert du 14 juillet au 31 aout ","autres périodes sur réservation","La plus romantique de vos visites. Dans la douceur de la Thiérache Ardennaise, vous serez accueillis par les descendants du fondateur de cette maison fortifiée Renaissance, flanquée de deux tours avec douves en eau pour une visite, une soirée musicale suivie d'un souper aux chandelles ou une nuit (chambres d'hôtes). Maison familliale depuis plusieurs génération qui l'améliore et lui donne un aspect modernisé à chaque transmission.Les visites sont possibles tous les jours de 14h à 18h sauf le samedi.",,,,,,,,,,,,,,,,,"http://cnstlltn.com/master/e32746dc-4948-498f-9256-deb15cd8098c/e32746dc-4948-498f-9256-deb15cd8098c_134.jpg","http://cnstlltn.com/master/7c473d8e-54a2-428b-9ac6-17f39da5b78d/1287000280_2.jpg","http://cnstlltn.com/master/7c1af2a2-8d10-4670-85ac-f6f8399ea289/1287000280_1.jpg",,,,,,,,,,,,,,,,,,,,,"Renseignement/Information",,"AVRIL","Philippe",,"la-cour-des-pres@laposte.net","03 24 35 52 66","09 59 77 82 26","Autres",,"AVRIL","Philippe",,"la-cour-des-pres@laposte.net","03 24 35 52 66",,,,,,"français","anglais",,,,"Chèques","Chèques bancaires et postaux","Espèces",,,,,,,,"Jardin","Parking","Salle d'animation",,,,,,,,,,,,,,,,,,,,,,,,,,,,,,,,,,,,,,"Animation thématique spécifique","Concerts","Visite guidée",,,,,,,,"Y",,,,,,,,,,,,,,,,,,,,,,,,,,,,,,,,,,,,,,,,,,,,,,,,,,,,,,,,,,,,,,,,,
"PCUCHA0080000286","La Croix MacMahon","Patrimoine culturel","Site et monument historiques",,,,,,,,"D17",,,8140,"LA MONCELLE","FRANCE","03 24 27 73 73",,,"contact@tourisme-sedan.fr",,,,"49.68827","4.982858",,,,"La Croix MacMahon",,,"Le 1er septembre 1870, la bataille de Sedan commence, dès 4 heures du matin, par lattaque des Bavarois contre Bazeilles.A 5 heures 45, le Maréchal de Mac Mahon arrive à cheval sur la hauteur de la Rapaille entre Balan et La Moncelle.Vers 6 heures, alors quil observe les positions françaises et allemandes, un éclat dobus tirés de Pont-Maugis le blesse grièvement.Au cours de son évacuation, il fait porter un message au Général Ducrot, commandantle1er Corps dArmée, pour lui demander de le remplacer à la tête de son armée. Son message ne parviendra à son destinataire quà 7 heures et demie.","La Croix MacMahon",,,"On 1 September 1870 the Sedan battle began in the early hours of 4 am, with the attack of the Bavarians against Bazeilles.At 5.45am, Marshal MacMahon rode up to Rapaille between Balan and La Moncelle.Around 6 am, while he observed the French and German positions, shrapnel fired from Pont-Maugis seriously injured him.During his escape, he sent a message to General Ducrot, who was commanding the 1st Army Corps, to ask him to replace him at the head of his army. His message reached its destination at 7.30.",,,,,,,,,,,,,"http://cnstlltn.com/master/b5c82495-4544-48a8-91b5-bec79f3184ee/logo-me%c2%b4moire.jpg",,,,,,,,,,,,,,,,,,,,,,,,,,,,,,,,,,,,,,,,,,,"français",,,,,,,,,,,,,,,,,,,,,,,,,,,,,,,,,,,,,,,,,,,,,,,,,,,,,,,,,,,,,,,,,,,,,,,,,,,,,,,,,,,,,,,,,,,,,,,,,,,,,,,,,,,,,,,,,,,,,,,,,,,,,,,,,,
