"PCUCHA0080000044","Château Fort de Sedan","Patrimoine culturel","Site et monument historiques","Ville d'art et d'histoire",,,"Château fort","Cimetière militaire et mémorial","Citadelle",,"Promenoir des prêtres / Cour du Château Fort",,,8200,"SEDAN","FRANCE","03 24 29 98 80",,"03 24 29 25 62","contact@chateau-sedan.fr",,"http://www.chateau-fort-sedan.fr",,"49.70218","4.949225",,,,"Château Fort de Sedan","La Forteresse des Princes de Sedan","Certificat d'excellence TripAdvisor 2013","Édifié en 1424, par Evrard de La Marck, limprenable Château Fort de Sedan a toujours eu une double fonction : forteresse redoutable et résidence princière luxueuse.Halte et protection sur la route du cuivre, témoin grandiose de larchitecture militaire et de lart des fortifications, il a garanti l'indépendance de la petite Genève du Nord à lépoque des guerres de religion.Revenu à la Couronne de France, au temps des La Tour dAuvergne, il a vu se développer la ville autour de son industrie drapière.Témoin des grands conflits du XXème siècle, le Château Fort est une page incontournable de notre Histoire de France. Il abrite dans ses murs une salle dédiée au conflit franco-prussien de 1870.","Sedan Castle","The Princes of Sedan Fortress","TripAdvisor Certificate of Excellence 2013","Built in 1424 by Evrard de La Marck, the impregnable Sedan Castle always had a dual function: formidable fortress and luxurious royal residence.A secure place for making a stop on the Copper Trail and great testimony to military architecture and the art of fortification, it guaranteed the independence of the little Geneva of the North at the time of the religion wars.Returned to the French Crown during the time of La Tour d'Auvergne, the town developed around its textile industry.Having witness the great conflicts of the twentieth century, the Castle is an essential part of French History.It houses a room dedicated to the Franco-Prussian War of 1870 within its walls.",,,,,,,,,,,,,"http://cnstlltn.com/master/2df192e9-16d2-4de0-a62b-9247a10a776e/loisir_culturel-chateau-_fort-sedan-%c2%a9s.ortega-dubois-049.jpg","http://cnstlltn.com/master/a5b43dce-1a91-49ac-815c-a63c5c1d4b85/loisir_culturel-chateau-_fort-sedan-%c2%a9s.ortega-dubois-026.jpg","http://cnstlltn.com/master/227ec54f-0c7e-4711-a618-79ce005db9ca/loisir_culturel-chateau-_fort-sedan-%c2%a9s.ortega-dubois-037.jpg",,"Villes d'art et d'histoire",,,,"Accès handicapés",,,,,2014-01-15,2015-03-31,2015-04-01,2015-12-31,,,,,,,"Propriétaire",,"DABLAIN","Jérome",,"contact@chateau-sedan.fr","03 24 29 98 80",,"Renseignement/Information",,"Accueil du Château Fort",,,"contact@chateau-sedan.fr","03 24 29 98 80",,,,,,"anglais","néerlandais","allemand","français",,"Carte de crédit","Chèques","Chèques bancaires et postaux","Chèques Vacances","Espèces","Eurocard - Mastercard","Visa","Carte bancaire",,,"Audioguide","Bar","Bibliothèque","Boutiques","Parking","Parking autocar","Restaurant","Salle des fêtes-spectacle","Sentiers balisés",,,,,,,,,,,,,,,,,,,,,,,,,,,,,,,,"Concerts","Expositions temporaires","Visite guidée",,,,,,,,"Y",,20,,,,"Film 1000 ans d'Histoire - Enfant (6 à 18 ans)","2.90","2.90","Location audioguide","3.00","3.00","Entrée Adulte 1000 ans d'histoire","0.00","0.00","Film 1000 ans d'Histoire - Adulte","3.90","3.90","Visite Principauté - Adulte","6.90","6.90","Guide conférencier (forfait 2heures)","100.00","100.00","Visite 1000 ans d'Histoire - Adulte","8.40","8.40","Visite Principauté - Enfant (6 à 18 ans)","5.40","5.40","Guide papier","2.00","2.00","Entrée Enfant 1000 ans d'histoire","0.00","0.00","Visite 1000 ans d'Histoire - Enfant (6 à 18 ans)","6.40","6.40",,,,,,,,,,,,,,,,,,,,,,,,,,,
"PCUCHA0080000272","Cimetière 1870 de Floing","Patrimoine culturel","Site et monument historiques",,,,"Cimetière militaire et mémorial","Histoire","Militaire",,"Rue des Braves Gens",,,8200,"FLOING","FRANCE","03 24 27 73 73",,,"contact@tourisme-sedan.fr",,,,"49.72179","4.938859",,,,"Cimetière 1870 de Floing",,,"Le cimetière est le carré militaire réservé aux tombes des combattants morts pour la France en 1870 sur le territoire de la commune de Floing et de sa périphérie.Dans laxe de lentrée se trouve la grande stèle aux côtés de laquelle sont réparties 16 stèles le long du mur du fond.Ceux qui gravissent les pentes qui mènent de léglise de Floing à ce cimetière et au plateau du Terme peuvent avoir en marchant une réaction double : au bonheur de voir un paysage magnifique, succède le plus souvent limpression de revivre le calvaire sanglant de quelques milliers de cavaliers héroïques qui, à la fin dune bataille perdue, se sacrifièrent pour sauver lhonneur.En moins de deux heures, laprès-midi du 1er septembre 1870, lancés dans des charges de cavalerie hallucinantes, plus dun millier dentre eux tombent foudroyés par le feu intense des tirailleurs ennemis qui ont réussi à prendre position en rangs serrés à flanc de coteau du Terme.","Floings 1870 Cemetry",,,"This cemetery is the military area reserved for tombs of French soldiers fallen for their country in 1870 on the land of the municipality of Floing and its surrounding area.In the middle of the entrance to it, there is a large stele alongside 16 other steles spread along the edge of the back wall.Those who climb the slopes leading to the cemetery and Le Terme Plateau from Floing Church may experience two feelings: the joy of seeing the beautiful scenery, but even more powerful, the reliving of the bloody ordeal of a few thousand heroic cavalrymen who, at the end of a losing battle, sacrificed themselves to save honour.In less than two hours on the afternoon of 1 September 1870, over a thousand men set out upon incredible cavalry charges and died in the intense gunfire of the enemy soldiers positioned in tight rows along the hills of Le Terme.","Friedhof von 1870",,,"Der quadratische Militärfriedhof ist für die für Frankreich in der Gegend von Floing und Umgebung in 1870 gefallenen Soldaten reserviert.In der Achse des Eingangs befindet sich eine große Stele, neben der 16 Stele der Mauer des Hintergrundes lang aufgestellt sind. Diejenigen, die die Anhöhe von der Kirche von Floing zum Friedhof und zum Hochplateau von Terme hochgehen, können zwei Reaktionen haben: die wunderschöne Landschaft bewundern und sich dann die grausamen Bilder der hier stattgefundenen Schlachten vor Augen führen, in denen tausende sich für die Ehre opferten.In weniger als zwei Stunden fielen hier am Nachmittag des 1.Septembers 1870 über tausend wahnsinnigen Stürmer im Kugelhagel der feindlichen Schützen, die sich auf den Seiten derTerme in Position gestellt hatten.",,,,,,,,,"http://cnstlltn.com/master/274adde3-c8a7-4d3c-be98-69a33f9b796c/logo-me%c2%b4moire.jpg",,,,,,,,,,,,,,,,,,,,,,,,,,,,,,,,,,,,,,,,,,,"français",,,,,,,,,,,,,,,,,,,,,,,,,,,,,,,,,,,,,,,,,,,,,,,,,,,,,,,,,,,,,,,,,,,,,,,,,,,,,,,,,,,,,,,,,,,,,,,,,,,,,,,,,,,,,,,,,,,,,,,,,,,,,,,,,,
"PCUCHA0080000079","Cimetière militaire Allemand","Patrimoine culturel","Site et monument historiques",,,,,,,,"Route de la Marfée",,,8350,"NOYERS PONT MAUGIS","FRANCE","03 24 27 73 73",,,"contact@tourisme-sedan.fr",,,,"49.66158","4.936598",,,,"Cimetière militaire Allemand",,,"Le cimetière militaire allemand renferme 14 055 sépultures de soldats de la première guerre et 12 788 de la Seconde Guerre.Le général Gunther Schauorfzkopff père du Stuka (avion de combat en piqué) y est inhumé. Dans cette imposante nécropole parfaitement entretenue, le visiteur peut découvrir une chapelle au toit de cuivre  avec à l'intérieur la statue d'une femme en pleurs. Un peu plus loin une croix en granit de 11 mètres de hauteur tournée vers l'est à la demande des autorités allemandes.","Cimetière militaire Allemand",,,"The German military cemetery contains graves of 14,055 soldiers from the first war and 12 788 from the Second World War.General Gunther Schauorfzkopff, the creator of the Stuka (dive bomber plane) was buried there.In this imposing and perfectly maintained necropolis, visitors can discover a copper roofed chapel - with the statue of a crying woman inside.A little further on, a 11 metre granite cross faces east at the request of the German authorities.",,,,,,,,,,,,,"http://cnstlltn.com/master/bfd073bb-a315-44f3-b061-753a554724ce/logo-me%c2%b4moire.jpg",,,,,,,,,,,,,,,,,,,,,,,"Gestionnaire",,"HANDSCHKE",,,,"03.24.27.07.96","03.24.27.96.93","Gestionnaire",,"MAIRIE DE NOYERS PONT MAUGIS",,,,"03.24.27.22.64",,,,,,,,,,,,,,,,,,,,,,,,,,,,,,,,,,,,,,,,,,,,,,,,,,,,,,,,,,,,,,,,,,,,,,,,,,,,,,,,,,,,,,,,,,,,,,,,,,,,,,,,,,,,,,,,,,,,,,,,,,,,,,,,,,,,,,,,
"PCUCHA0080000265","Cimetière militaire allemand d'Apremont","Patrimoine culturel","Site et monument historiques",,,,"Cimetière militaire et mémorial","Histoire","Militaire",,"RD 442 (entre Binarville et Apremont-sur-Aire)",,,8250,"APREMONT","FRANCE",,,,,,,,"49.26667",5,,,,"Cimetière militaire allemand d'Apremont",,,"1111 soldats allemands en tombes individuelles. Ce cimetière, créé en novembre 1915 pour les tués en forêt d'Argonne, est le seul à conserver une grande partie des emplacements d'inhumation dans leur état d'origine.Tombe et stèle du commandant baron Von Müllenheim-Rechberg, commandant le 5ème bataillon de chasseurs, tué à la Haute-Chevauchée le 8 avril 1916. Monument du 27ème régiment de Landwher.",,,,,,,,,,,,,,,,,"http://cnstlltn.com/master/62ec0f01-fa66-4ff2-9cc1-5ea3ee23a547/apremont_cimeti%c3%a8re+allemand+(3).jpg",,,,,,,,,,,,,,,,,,,,,,,,,,,,,,,,,,,,,,,,,,,"français",,,,,,,,,,,,,,,"Parking",,,,,,,,,,,,,,,,,,,,,,,,,,,,,,,,,,,,,,,,,,,,,,,,,,,,,,,,,,,,,,,,,,,,,,,,,,,,,,,,,,,,,,,,,,,,,,,,,,,,,,,,,,,,,,,,,,,
"PCUCHA0080000274","Cimetière militaire Français","Patrimoine culturel","Site et monument historiques",,,,,,,,"Route de la Marfée",,,8350,"NOYERS PONT MAUGIS","FRANCE","03 24 27 73 73",,,"contact@tourisme-sedan.fr",,,,"49.66491","4.926767",,,,"Cimetière militaire Français",,,"Le cimetière militaire français abrite des soldats de la première guerre mondiale :1200 dans une fosse commune et 528 dans des tombes individuelles. Les 26, 27 et 28 août 1914 des régiments bretons et vendéens résistent et repoussent l'ennemi : ils ne battront en retraite que sur ordre de l'état-major. Le colonel Marolles meurt le 27 août, ses dernières paroles furent :  Je meurs content, mes soldats sont des braves .","Cimetière militaire Français",,,"The French military cemetery is home to the fallen soldiers from the First World War:1200 in a mass grave and 528 in individual graves. On 26, 27 and 28 August 1914, Vendean and Brittany regiments withstood and pushed back the enemy: they forced them to retreat by order of the General Staff.Colonel Marolles died on 27 August, with his last words:  I die happy, my soldiers are so courageous. ",,,,,,,,,,,,,"http://cnstlltn.com/master/89ae3ac5-f826-4179-9df7-0c26681fbba0/logo-me%c2%b4moire.jpg",,,,,,,"Animaux acceptés","Accès handicapés",,,,,,,,,,,,,,,,,,,,,,,,,,,,,,,,,,,"français",,,,,,,,,,,,,,,,,,,,,,,,,,,,,,,,,,,,,,,,,,,,,,,,,,,,,,,,,,,,,,,,,,,,,,,,,,,,,,,,,,,,,,,,,,,,,,,,,,,,,,,,,,,,,,,,,,,,,,,,,,,,,,,,,,
"PCUCHA0080000289","Cimetière Saint Charles","Patrimoine culturel","Site et monument historiques",,,,"Cimetière militaire et mémorial","Histoire","Militaire",,"Rampe Saint Charles",,,8200,"SEDAN","FRANCE","03 24 27 73 73",,,"contact@tourisme-sedan.fr",,,,"49.71047","4.940286",,,,"Cimetière Saint Charles",,,"Le cimetie`re Saint Charles posse`de un me´morial allemand de la guerre de 1870 et un vaste cimetie`re militaire franc¸ais des trois guerres.En contrebas a` gauche, imme´diatement au-dessous de la maison du gardien, se trouvent le cimetie`re israe´lite et le me´morial des victimes de la guerre de 1939-1945, victimes mortes au champ dhonneur, de´porte´es ou fusille´es.","Cimetière Saint Charles",,,"The Saint Charles Cemetery has a German war memorial from 1870 and a large French military cemetery from three wars.To the bottom left, immediately after the keeper's house, are the Jewish cemetery and war memorial for the victims of the 1939-1945 war, victims who died in battle or were deported or shot.",,,,,,,,,,,,,"http://cnstlltn.com/master/613e4001-13ca-48af-8b7b-e140b6aebf0f/logo-me%c2%b4moire.jpg",,,,,,,,,,,,,,,,,,,,,,,,,,,,,,,,,,,,,,,,,,,"français",,,,,,,,,,,,,,,,,,,,,,,,,,,,,,,,,,,,,,,,,,,,,,,,,,,,,,,,,,,,,,,,,,,,,,,,,,,,,,,,,,,,,,,,,,,,,,,,,,,,,,,,,,,,,,,,,,,,,,,,,,,,,,,,,,
"PCUCHA0080000264","Circuit historique du Sergeant York","Patrimoine culturel","Site et monument historiques",,,,"Histoire","Militaire","Ruines et vestiges",,,,,8250,"CHATEL CHEHERY","FRANCE","03 24 30 79 95",,,"chatel.loisirs@orange.fr",,,,"49.28276","4.95374",,,,"Circuit historique du Sergeant York",,,"Alvin York (1887-1964) est l'un des américains les plus célèbres de la Grande Guerre suite aux faits d'armes accomplis en forêt sur les hauteurs de Châtel. Le 8 octobre 1918, après de violentes attaques de mitrailleuses, le Caporal York (328ème RI - 82ème DI) prend le commandement d'un groupe réduit à 7 hommes et se lance à l'attaque des positions allemandes. Après avoir repoussé une attaque de baïonnettes, ils prennent d'assaut les nids de mitrailleuses ennemis. 132 soldats allemands seront fait prisonnier dont 4 officiers. York sera immédiatement nommé Sergeant. Selon le maréchal Foch, commandant en chef des armées alliées, il s'agit du  plus grand exploit jamais réalisé par un simple soldat de toutes les armées en Europe.  Son fait d'arme lui vaut la médaille d'honneur du Congrès et la célébrité aux États-Unis. Hollywood lui consacre un film réalisé par Howard Hawks en 1941 avec Gary Cooper dans le rôle du Sergeant York.Aujourdhui, un circuit historique de 3 km en forêt permet de découvrir le lieu des combats. Visite guidée possible sur demande au 03 24 30 79 95","Sergeant York Historical Tour",,,"Alvin York (1887-1964) was one of the most famous Americans of the Great War following his fighting exploits accomplished in the woods on the Châtel hills. On 8th October 1918, following violent attacks from machine guns, Corporal York (328th infantry - 82nd division) took command of a small group of 7 men and launched an attack on German positions. After repelling a bayonet attack, they stormed the enemy machinegun nests.132 German soldiers were taken prisoner, including 4 officers. York was to immediately be appointed Sergeant. According to Marshal Foch, commander of the Allied Armies, it was,  The greatest feat carried out by a simple soldier fighting for any of the armies in Europe.  His feat earned him the Congressional Medal of Honor and fame in the United States.Hollywood devotes a film to him directed by Howard Hawks in 1941 with Gary Cooper in the role of Sergeant York.As for the present, a 3-km long historical tour in the forest can help you discover where the fighting took place.",,,,,,,,,,,,,"http://cnstlltn.com/master/4d76a452-30cb-44ec-9664-a9736b36fe41/circuit+du+sgt+york+%c2%a9sophie+bettig.jpg",,,,,,,,,,,,,,,,,,,,,,,,,,,,,,,,,,,,,,,,,,,"français",,,,,,,,,,,,,,,"Boutiques","Parking","Sentiers balisés",,,,,,,,,,,,,,,,,,,,,,,,,,,,,,,,,,,,,,"Visite guidée",,,,,,,,,,,,,,,,,,,,,,,,,,,,,,,,,,,,,,,,,,,,,,,,,,,,,,,,,,,,,,,,,,,,,,,,,,,
"PCUCHA0080000033","COLLEGIALE SAINT VIVENT","Patrimoine culturel",,,,,,,,,,," ",8120,"BOGNY SUR MEUSE","FRANCE","03.24.54.46.73.",,"03.24.54.87.88.",,,,,"49.846979","4.756083",,,,"COLLEGIALE SAINT VIVENT",,,"Ce monument est une des plus anciennes églises de la Vallée de la Meuse ; s'il a gardé de sa fondation carolingienne son plan en croix de basilique romane, il est maintenant très composite : du chevet pré - roman à la façade du XVIIIe siècle. (On notera un changement d'axe de 3 degrés entre le choeur et le transept d'une part, et la nef d'autre part).",,,,,,,,,,,,,,,,,"http://cnstlltn.com/master/a0dd7adf-5c07-4467-9cca-65b7ad98cc19/1287000246_1.jpg",,,,,,,,,,,,,,,,,,,,,,,"Autres",,"OT COMMUNAUTAIRE BOUCLES DE MEUSE ET SEMOY",,,,"03.24.54.46.73.",,"Renseignement/Information",,"OT COMMUNAUTAIRE BOUCLES DE MEUSE ET SEMOY",,,,"03.24.54.46.73.","03.24.54.87.88.",,,,,,,,,,,,,,,,,,,,,,,,,,,,,,,,,,,,,,,,,,,,,,,,,,,,,,,,,,,,,,,,,,,,,,,,,,,,,,,,,,,,,,,,,,,,,,,,,,,,,,,,,,,,,,,,,,,,,,,,,,,,,,,,,,,,,,,
"PCUCHA0080000005","The Saint Ermel collegiate church","Patrimoine culturel","Site et monument historiques","Classé ou inscrit (CNMHS)","Gothique",,"Collégiale",,,,"Rue Gambetta",," ",8320,"VIREUX MOLHAIN","FRANCE","03 24 42 92 42",,,"info@valdardennetourisme.com",,"www.valdardennetourisme.com",,"50.08932","4.709208",,,,"La collégiale Saint Ermel - Vireux-Molhain-Ardenne-France",,"Cette collégiale fut fondée en 752 par Dame Ada, sous la protection de Pépin le Bref. Elle possède: une série de dalles funéraires, un décor et un mobilier représentatifs de la renaissance italienne, d'admirables statues en bois polychrome du XVIe siècle et un retable au XVIIe siècle qui ornent l'édifice.","Classée monument historique en 1963. Lhistoire veut que Pépin le Bref ait été enterré sous léglise primitive. La crypte pré-romane est un magnifique exemple de larchitecture carolingienne. Le site est ouvert toute l'année, sur demande auprès de l'office de tourisme de Vireux-Wallerand - place du château.A noter : Ouverture office de tourisme: D'avril à septembre: tous les jours de 10h à 18hD'octobre à mars: du lundi au vendredi de 10h à 13h et de 14h à 17h, le samedi de 13h à 17h, fermé le dimanche.","The Saint Ermel collegiate church Vireux-Molhain-Ardenne-France",,"The Saint-Ermel collegiate church has been found in 752 by Dame Ada under the protection of Pépin le Bref, the father of Charlemagne.The edifice contains representative furniture of the Italian Renaissance and several gravestones. You will also discover a crypt from the Romanesque period with blue stone columns, a magnificent series of 16th century polychrome wooden statues.","The collegiate church is listed as historic monument since 1963. The history says Pépin le Bref might be buried under the former church. The crypt is a magnificent example of the carolingian architecture.The Collegiate church is opened all year long.If you want to visit it you have to ask the keys of the church at the Val d'Ardenne Tourist Information Centre (Vireux-Wallerand) - Place du château. Note : Opening hours of the Tourist Information Centre:From April to the end of September: Open every day from 10am till 6pmFrom October to the end of March: Open from Monday to Friday, from 10am till 1pm and from 2pm till 5pm, every saturday afternoon from 1pm till 5pm. Closed on Sundays.",,,,,,,,,,,,,"http://cnstlltn.com/master/531dda16-22b9-4003-bdf7-3b28e544c98e/1287000484_1.jpg","http://cnstlltn.com/master/52f712b0-f112-490f-8347-96e30bb5aca3/52f712b0-f112-490f-8347-96e30bb5aca3_134.jpg","http://cnstlltn.com/master/e8a53517-d08f-481a-925a-d13be527239d/e8a53517-d08f-481a-925a-d13be527239d_134.jpg",,,,,"Animaux acceptés",,,,,,2010-02-15,2010-12-31,2011-01-01,2011-12-31,2015-01-01,2015-12-31,,,,,"Autres",,"Service Accueil",,,"direction@valdardennetourisme.com","03 24 42 92 42","03 88 64 42 38","Autres",,"Service commercial",,,"commercial@valdardennetourisme.com","+33 (0)324429243","03 88 64 42 38",,,,,"français","anglais","néerlandais",,,"American Express","Carte de crédit","Chèques","Espèces","Eurocard - Mastercard","Visa","Carte bancaire","Mandats internationaux","Virements",,"Parking",,,,,,,,,,,,,,,,,,,,,,,,,,,,,,,,,,,,,,,,"Visite guidée",,,,,,,,,,"Y",50,15,,,,"Groupe : forfait moins de 15 personnes en semaine","60.00","60.00","Groupe : le guide supplémentaire au dessus de 50 personnes week end et jours fériés","75.00","75.00","Groupe : Visites guidées (de 15 à 40 personnes)","2.00","4.00","Groupe : le guide supplémentaire au dessus de 50 personnes en semaine","60.00","60.00","Groupe : forfait moins de 15 personnes week end et jours fériés","75.00","75.00",,,,,,,,,,,,,,,,,,,,,,,,,,,,,,,,,,,,,,,,,,,,,
"PCUCHA0080000024","The convent of the  Récollectines ","Patrimoine culturel","Site et monument historiques",,"De curé / monastique",,"Couvent",,,,"18 rue Méhul",," ",8600,"GIVET","FRANCE","03 24 42 06 84",,,,,,,"50.13893","4.822048",,,,"Couvent des Récollectines - Givet -Ardenne-France",,"Ce couvent fondé au XVIIe par une lettre patente du roi Louis XIV, abrite aujourd'hui un important centre culturel qui propose, entre autre, des expositions thématiques et permanentes (pipes Gambier).","Bibliothèque-Médiathèque de la Ville de Givet, salle de Conférences, salle d'expositions.","The convent of the  Récollectines  Givet-Ardenne-France",,"The convent of the Récollectines was founded in the 17th century by a letter patent from King Louis XIV.","Nowadays, the convent is an important cultural centre (public library-media library-video library), meeting rooms and showroom.Conitnuous exhibition in the hall of the public library (Gambier pipes).",,,,,,,,,,,,,"http://cnstlltn.com/master/61e6ffe7-a71e-408f-99de-47c413878740/ro010173.jpg","http://cnstlltn.com/master/ae377dca-a723-43b0-915d-ff1c4519ef01/ae377dca-a723-43b0-915d-ff1c4519ef01_134.jpg",,,,,,,,,,,,,,,,,,,,,,,,,,,,,,,,,,,,,,,,,,,,,,,,,,,,,,,,,,,,,,,,,,,,,,,,,,,,,,,,,,,,,,,,,,,,,,,,,,,,,,,,,,,,,,,,,,,,,,,,,,,,,,,,,,,,,,,,,,,,,,,,,,,,,,,,,,,,,,,,,,,,,,,,,,,,
"PCUCHA0080000151","The cross of the duel (Hierges)","Patrimoine culturel","Site et monument historiques",,,,"Souvenirs de guerre",,,,,," ",8320,"HIERGES","FRANCE","03 24 41 75 94",,,,,,,"50.10536","4.74086",,,,"Croix du duel à Hierges - Hierges-  Ardenne- France",,"Depuis 1579, dans un mur de Hierges, se trouve la Croix du Duel... Tenaillé par le remords, Jehan Collin l'a érigé pour conjurer le meurtre de Thiry Mayreau, soldat de Charlemont.","Accès libre.","The cross of the duel -  Hierges-Ardenne-France",,"In Hierges, the  Croix du Duel  dates from 16th century (1579).The cross is on the façade of a house facing the fountain of the village.Expiatory cross, the  Cross of the duel  was erected by Jehan Collin, the murderer of Thiry Mayreau, soldier in Charlemont.","Free access.",,,,,,,,,,,,,"http://cnstlltn.com/master/281dadd6-7e4b-4d87-a3f0-570e0b321e1e/281dadd6-7e4b-4d87-a3f0-570e0b321e1e_134.jpg",,,,,,,,,,,,,,,,,,,,,,,,,,,,,,,,,,,,,,,,,,,,,,,,,,,,,,,,,,,,,,,,,,,,,,,,,,,,,,,,,,,,,,,,,,,,,,,,,,,,,,,,,,,,,,,,,,,,,,,,,,,,,,,,,,,,,,,,,,,,,,,,,,,,,,,,,,,,,,,,,,,,,,,,,,,,,
