"PCUCHA0080000294","Monument des 21ème et 22ème Régiments de Chasseurs Tchécoslovaques","Patrimoine culturel","Site et monument historiques",,,,"Cimetière militaire et mémorial","Histoire","Militaire",,"RD 977 - Chestres",,,8400,"VOUZIERS","FRANCE",,,,,,,,"49.40206","4.711936",,,,"Monument des 21ème et 22ème Régiments de Chasseurs ",,,"Monument en hommage aux 21ème et 22ème Régiments de Chasseurs Tchécoslovaques tombés en octobre 1918 sur le secteur. Il représente un soldat tchécoslovaque, la grenade à la main. On peut y lire :  Passant, ici et aux environs, les 21ème et 22ème régiments de volontaires tchécoslovaques ont versé leur sang pour la liberté de la Tchécoslovaquie ainsi que pour la gloire et la grandeur de la France aimée. Honneur aux Héros tombés. PRAVDA-VITEZI 1914-1918 .Offert par la nation tchécoslovaque, il est l'uvre de l'architecte tchèque John Zázvorka.",,,,,,,,,,,,,,,,,"http://cnstlltn.com/master/6155265f-62d7-44de-b8ff-795458abc37b/monument+bobo+%c2%a9jeanty.jpg",,,,,,,,,,,,,,,,,,,,,,,,,,,,,,,,,,,,,,,,,,,"français",,,,,,,,,,,,,,,,,,,,,,,,,,,,,,,,,,,,,,,,,,,,,,,,,,,,,,,,,,,,,,,,,,,,,,,,,,,,,,,,,,,,,,,,,,,,,,,,,,,,,,,,,,,,,,,,,,,,,,,,,,,,,,,,,,
"PCUCHA0080000067","Musée Arthur Rimbaud","Patrimoine culturel","Musée","Classé ou inscrit (CNMHS)","Baroque",,"Littérature","Moulin",,,"Quai Charcot",," ",8000,"CHARLEVILLE MEZIERES","FRANCE","03.24.32.44.65",,"03.24.32.44.69","musees@mairie-charlevillemezieres.fr",,,,"49.77653","4.719963",,,,"Musée Arthur Rimbaud",,"horaires d'ouverture : du mardi au dimanche - de 10h à 12h et de 14h à 18h - pass musées valable 48h pour Musée Arthur Rimbaud, Musée de l'Ardenne et Maison Rimbaud","Musée consacré à la vie et à l'oeuvre d'Arthur Rimbaud, poète né à Charleville en 1854. Découverte de la vie de ce génie : photos, correspondances, objets familiers - de son oeuvre : manuscrits, dont le célèbre   Voyelles  . Sa découverte de l'Europe et les dix années passées en Afrique y sont évoquées. L'hommage rendu par les artistes du XXe siècle complète cette présentation. Après 2 ans de travaux de complète rénovation et une nouvelle scénographie moderne, le Musée est ouvert depuis le 20 octobre. Un parcours intérieur transformé L'enveloppe du bâtiment n'a pas été modifiée, mais l'intérieur du musée est complètement repensé en vue d'offrir trois espaces principaux de visite : le grenier est rendu accessible au public. Grâce à des archives sonores, il évoque l'intensité de l'écriture tout en renvoyant à l'uvre elle-même. Ce grenier fait, bien sûr, référence au Ğ grenier de Roche ğ où Rimbaud écrivit Ğ Une saison en enfer ğ. La première travée (entrée actuelle du musée) est libérée de ses planchers sur les trois niveaux et mets en valeur l'uvre de Claude Lévêque Ğ le cadran ğ. L'arche de franchissement de la Meuse est libérée de son plafond et le visiteur emprunte un passage le plaçant au-dessus de l'eau.Pour compléter la visite intérieure, plusieurs espaces d'expositions permettent de montrer la richesse de la collection et cela particulièrement grâce à la présentation plus fréquente de manuscrits originaux. Les uvres des artistes du 20e siècle sinscrivent au fil de ce parcours qui fait également une large place à l'expérience parisienne d'Arthur Rimbaud, à ses voyages en Europe ainsi qu'à sa vie en Afrique, cela sans oublier ses attaches ardennaises.",,,,,,,,,,,,,,,,,"http://cnstlltn.com/master/bd171cdc-f329-4b35-8971-c14ce6e0ebdc/img_4975.jpg","http://cnstlltn.com/master/ccc4cf9a-f5f1-40ce-a53a-6498b2cf66b4/010_dt.jpg","http://cnstlltn.com/master/42da8ad6-4cfb-45a7-aa35-266ee410b3c0/dsc00081.jpg",,"Musée de France","Villes d'art et d'histoire",,,"Accès handicapés",,,,,,,,,,,,,,,"Renseignement/Information",,"MUSEE RIMBAUD",,,"musees@mairie-charlevillemezieres.fr","03.24.32.44.65","03.24.32.44.69","Direction",,"OFFICE DE TOURISME DE CHARLEVILLE MEZIERES",,,"charl.mez@wanadoo.fr","03.24.55.69.90",,,,,,,,,,,"Carte de crédit","Espèces","Eurocard - Mastercard","Visa",,,,,,,"Ascenseur","Jardin ombragé",,,,,,,,,,,,,,,,,,,,,,,,,,,,,,,,,,,,,,,"Animation groupe","Expositions temporaires","Visite guidée",,,,,,,,"Y",8,,,,,"tarif plein pass","5.00","5.00",,,,,,,,,,,,,,,,,,,,,,,,,,,,,,,,,,,,,,,,,,,,,,,,,,,,,,,,,
"PCUCHA0080000136","MUSÉE DE LA BATAILLE DE MAI - JUIN 40 - DUPONT-FROMAGEOT Pascal","Patrimoine culturel","Musée","Musée prive",,,"Histoire","Militaire","Moulin",,"Le Moulin de Waroux",," ",8130,"SEMUY","FRANCE","03 24 71 41 09","03 24 71 23 16",,"chriswaroux@wanadoo.fr",,"http://www.museedesemuy.com/",,"49.48728","4.658646",,,,"Musée de la Bataille de Mai-Juin 1940 - DUPONT-FROMAGEOT Pascal","Moulin de Waroux","Ouvert sur RDV de MAI à SEPTEMBRE Entrée libre","Musée situé en bordure du canal des Ardennes, dans les combles d'un ancien moulin datant de la fin du 18éme siècle.Vous pourrez y découvrir une collection privée d'objets, d'uniformes, de coiffures, d'équipements et armements qui évoquent les combats qui eurent lieu dans les Ardennes de la mi-mai à la mi-juin 1940.OUVERT TOUTE L'ANNÉE SUR RDV DE MAI A SEPTEMBRE (tous les jours) de 10h00 à 19h00","Museum of the Battle of May-June 1940",,,"Museum located along the Canal des Ardennes in the attic of an old mill dating from the late 18th century. You can discover a collection of private objects, uniforms, headgear, equipment and weapons that evoke the fighting that took place in the Ardennes from mid-May to mid-June 1940. Open from May to September every day from 10 am to 7 pm. By reservation.",,,,,,,,,,,,,"http://cnstlltn.com/master/e9243489-ea95-4c28-8f09-43761bb39575/e9243489-ea95-4c28-8f09-43761bb39575_134.jpg","http://cnstlltn.com/master/f453748b-37f1-4d58-b237-f76327e4eaa8/mus%c3%a9e+semuy.jpg",,,,,,"Animaux acceptés",,,,,,,,,,,,,,,,"Renseignement/Information",,"DUPONT-FROMAGEOT","Christian",,,"03.24.71.41.09","03.24.71.23.16.","Autres",,"DUPONT-FROMAGEOT","Christian",,,"03.24.71.41.09",,,,,,"français",,,,,"Chèques","Espèces",,,,,,,,,"Parking",,,,,,,,,,,,,,,,,,,,,,,,,,,,,,,,,,,,,,,,"Visite guidée",,,,,,,,,,"Y",,,,,,,,,,,,,,,,,,,,,,,,,,,,,,,,,,,,,,,,,,,,,,,,,,,,,,,,,,,,,,,,,
"PCUCHA0080000047","MUSEE DE LA BATAILLE DE ROCROY","Patrimoine culturel","Musée",,"Non Classé",,,,,,"16 place d'Armes",," ",8230,"ROCROI","FRANCE","03 24 54 10 22",,"03 24 54 23 42","mairie.rocroi@wanadoo.fr",,"www.rocroi-ville.com",,"49.92491","4.520786",,,,"Musée de la Bataille de Rocroy","Ouvert d'avril à septembre",,"Ce musée, situé dans un ancien poste de garde du 17ème siècle, retrace la victoire du Grand Condé sur les Espagnols le 16 mai 1643, au coeur d'une guerre de Trente Ans qui ouvrit le règne du Roi Soleil.",,,,,,,,,,,,,,,,,"http://cnstlltn.com/master/723c1cd7-95f5-4af8-9081-2fa398bf5a84/723c1cd7-95f5-4af8-9081-2fa398bf5a84_134.jpg","http://cnstlltn.com/master/37e776fc-1277-4e19-9d4a-885ac3423157/37e776fc-1277-4e19-9d4a-885ac3423157_134.jpg",,,,,,,,,,,,,,,,,,,,,,"Autres",,"MAIRIE",,,"mairie.rocroi@wanadoo.fr","03 24 54 10 22","03 24 54 23 42","Renseignement/Information",,"MAIRIE",,,"mairie-rocroi@wanadoo.fr","03 24 54 10 22",,,,,,,,,,,"Chèques","Chèques bancaires et postaux","Espèces",,,,,,,,"Auditorium","Boutiques","Parking","Parking autocar","Restaurant",,,,,,,,,,,,,,,,,,,,,,,,,,,,,,,,,,,,"Animation groupe","Visite guidée",,,,"Point d'eau potable",,,,,"Y",,,,,,"étudiant","0.00","3.00","groupe","0.00","3.50","Handicapé","0.00","3.00","Scolaire","0.00","1.50","Professionnel","0.00","3.15","enfant -12 ans","0.00","1.50","Individuel","0.00","4.00",,,,,,,,,,,,,,,,,,,,,,,,,,,,,,,,,,,,,,,
"PCUCHA0080000112","Musée de la forêt","Patrimoine culturel","Musée",,,,"Artisanat","Eco Musée","Musée pour enfants",,,"Route de Sécheval"," ",8150,"RENWEZ","FRANCE","03.24.54.82.66",,"03.24.54.81.20","musee-de-la-foret@wanadoo.fr",,"http://www.renwez.fr",,"49.83885","4.60243",,,,"MUSEE DE LA FORET","Sur la route de Sécheval","Ouvert d'avril à mi-novembre du mardi au dimanche de 10h à 18h fermé le lundi","A l'intérieur du bâtiment d'accueil, totalement en bois, sur pilotis abritant du gros matériel, découvrez 7 salles de muséographie électronique à thèmes différents, des maquettes, des marionnettes.... A l'extérieur, bénéficiant d'un audio-guidage en 4 langues : musée, promenade sur 1km800 en forêt, 35 chantiers avec personnages en bois donnant vie aux différentes activités forestières. Une collection de plus de 4000 outils et machines. Le concours de bûcheronnage a lieu le 2ème dimanche de juin. Restauration possible sur réservation. Salle de conférence ou de réunion. Musée situé dans un cadre entièrement naturel retraçant l'évolution de la forêt et les métiers qui lui sont rattachés. A l'extérieur, est aménagé un parcours-promenade où des personnages en bois restituent les gestes et les techniques d'hier.  Venez visiter ce musée sur 2 parties intérieure et extérieure, en famille, individuel ou entre amis, une petite cafétéria est ouverte à l' intérieur.  Une boutique vous permet d'acheter des objets fabriqués sur place. Le musée s'engage à embaucher des personnes pour un tremplin professionnel.",,,,,,,,,,,,,,,,,"http://cnstlltn.com/master/b7262bf9-ced0-49c4-8d11-1df1708bbd98/1287000219_2.jpg","http://cnstlltn.com/master/6ae70b29-bbe9-494e-94a0-ab872f25f2a2/1287000219_1.jpg","http://cnstlltn.com/master/957c0725-b1b5-40cc-b39b-2e9305da7790/957c0725-b1b5-40cc-b39b-2e9305da7790_134.jpg",,"2 fleurs","Villes et villages fleuris",,"Animaux acceptés","Accès handicapés","Handicap mental","Handicap moteur","Handicap visuel",,,,,,,,,,,,"Autres",,"FLECHE",,,"musee-de-la-foret@wanadoo.fr","03.24.54.82.66","03.24.54.81.20","Renseignement/Information",,"MUSEE DE LA FORET",,,"musee-de-la-foret@wanadoo.fr","03.24.54.82.66",,,,,,"français",,,,,"Chèques","Chèques bancaires et postaux","Espèces",,,,,,,,"Aire de pique-nique","Bar","Boutiques","Parking","Parking autocar","Restaurant","Salle d'animation","Salle de projection","Sentiers balisés","Tables de pique-nique",,,,,,,,,,,,,,,,,,,,,,,,,,,,,,,"Animation groupe","Animation thématique spécifique","Atelier pédagogique","Atelier pour adultes","Atelier pour enfants","Point d'eau potable",,,,,"Y",100,10,,,,"Entrée complète intérieure extérieure ","8.00","8.00","Tarif groupe à partir de 15 personnes ","6.00","6.00","Entrée intérieure muséographie","4.00","4.00","enfant de 5 à 12 ans ","4.00","4.00","Entrée extérieure parc ","5.00","5.00",,,,,,,,,,,,,,,,,,,,,,,,,,,,,,,,,,,,,,,,,,,,,
"PCUCHA0080000056","MUSEE DE LA METALLURGIE ARDENNAISE","Patrimoine culturel","Musée",,,,,,,,"103, rue de la Vallée",," ",8120,"BOGNY SUR MEUSE","FRANCE","+33 (0)3 24 35 06 71",,,"contactmma08@orange.fr",,"http://musee-metallurgie-ardennes.fr/",,"49.85965","4.757085",,,,"Musée de la Métallurgie Ardennaise",,,"Le Musée de la Métallurgie Ardennaise situé à Bogny sur Meuse est une véritable vitrine dun savoirfaire et dun patrimoine sans équivoque.Retraçant lhistoire de la métallurgie ardennaise de la clouterie aux produits industriels daujourdhui, il sest doté, grâce aux dons de nombreuses entreprises, danciennes machines comme un spectaculaire marteau pilon anglais exposé en extérieur dans le jardin de machines.Implanté dans un décor de rêve, entre Meuse et forêt ardennaise, les célèbres quatre fils Aymon surplombant le musée, cest à la fois un véritable témoignage du passé industriel des vallées de la Meuse et la Semoy, et un balcon valorisant les produits actuels.Fermé du 17décembre 2015 au 29 février 2016, sauf pour les groupes sur réservation.",,,,,,,,,,,,,,,,,"http://cnstlltn.com/master/6f263e08-c020-4bbe-bc62-51da1b86308c/6f263e08-c020-4bbe-bc62-51da1b86308c_134.jpg","http://cnstlltn.com/master/1281b7a0-d982-407e-860b-88b87db2a496/1281b7a0-d982-407e-860b-88b87db2a496_134.jpg","http://cnstlltn.com/master/0babb57b-b350-4812-8857-5b07be5b2ad2/0babb57b-b350-4812-8857-5b07be5b2ad2_134.jpg",,,,,,"Accès handicapés","Handicap mental","Handicap moteur","Handicap visuel",,2015-12-09,2015-12-16,2016-03-01,2016-03-05,2016-03-08,2016-03-12,2016-03-15,2016-03-19,2016-03-22,2016-03-26,"Direction",,"COMMUNAUTÉ DE COMMUNES MEUSE ET SEMOY",,,"ccmeuse.semoy@wanadoo.fr","03.24.36.08.61",,,,,,,,,,,,,,,,,,,,,,,,,,,,,,,,,,,,,,,,,,,,,,,,,,,,,,,,,,,,,,,,,,,,,,,,,,,,,,,,,,,,,"Groupe","4.50","4.50","Tarif jeunes de - 16 ans; personnes handiapées; demandeurs d'emplois","3.00","3.00","Enfant de - 5 ans","0.00","0.00","Scolaires","1.50","1.50","Tarif Adulte","6.00","6.00",,,,,,,,,,,,,,,,,,,,,,,,,,,,,,,,,,,,,,,,,,,,,
"PCUCHA0080000256","Musée de la Statuaire","Patrimoine culturel","Musée","Non Classé",,,"Art sacré","Eglise",,,"Place de la République",,,8350,"DONCHERY","FRANCE","03 24 26 00 89",,,"mairie.donchery@orange.fr",,,,"49.69507","4.875685",,,,"Musée de la Statuaire","Les Saintes Statues de Donchery","Pour mettre le mécanisme en fonction, il vous suffira d'insérer une pièce de 1 euro.","Situé dans l'ex sacristie de l'Eglise Sainte-Onésime, le musée de Donchery recèle de trésors inestimables à ne pas manquer ; la collection de statues vaut d'ailleurs qu'on s'y attarde un moment. De façon ludique et intéressante, vous pénétrerez dans l'évolution de l'art catholique en Champagne septentrionale. Avec des jeux de lumières, les statues parlantes vous raconteront les artistes et artisans mosans, dont les uvres sont exposées au musée.Bienvenue dans linteractivité du musée de la statuaire !","Museum of Statuary ","The Holy Statues of Donchery","To set the mechanism into motion, simply insert a 1 euro coin.","Located in the former sacristy of the Church of St. Onesimus, the Donchery Museum conceals priceless treasures not to be missed; the collection of statues is also worth a look.Experience the evolution of Catholic art in northern Champagne in a fun and interesting way.Light displays and talking statues will tell you all about the artists and artisans of Meuse, whose works are displayed at the museum.Welcome to the interactive of the museum of sculpture!",,,,,,,,,,,,,"http://cnstlltn.com/master/02befa7e-dca5-467d-acfa-2ed7ba9962ba/02befa7e-dca5-467d-acfa-2ed7ba9962ba_134.png",,,,,,,,,,,,,,,,,,,,,,,"Propriétaire",,"Mairie de Donchery",,,"mairie.donchery@orange.fr","03 24 26 00 89",,"Information",,"Mairie de Donchery",,,"mairie.donchery@orange.fr","03 24 26 00 89",,,,,,"français",,,,,,,,,,,,,,,,,,,,,,,,,,,,,,,,,,,,,,,,,,,,,,,,,,,,,,,"Son et Lumière",,,,,,,,,,,,,,,,"Visite libre","0.00","0.00","Visite commentée","1.00","1.00",,,,,,,,,,,,,,,,,,,,,,,,,,,,,,,,,,,,,,,,,,,,,,,,,,,,,,
"PCUCHA0080000017","Musée de l'Ardenne","Patrimoine culturel","Musée","Musée de France","Contemporain",,"Anthropologie","Archéologie","Art moderne / contemporain",,"31, Place Ducale",," ",8000,"CHARLEVILLE MEZIERES","FRANCE","03 24 32 44 60",,"03 24 32 44 69","musees@mairie-charlevillemezieres.fr",,"http://www.mairie-charleville-mezieres.fr.",,"49.77306","4.721243",,,,"Musée de l'Ardenne",,"Le musée de l'Ardenne est ouvert : de 10 h à 12 h et de 14 h à 18 h tous les jours, fermeture hebdomadaire le lundi","Ouvert en 1994, le Musée de l'Ardenne propose sur 3000m2 des collections uniques, en particulier pour les amateurs d'art, d'histoire et d'archéologie. On y remonte le cours de l'histoire ; du savoir-faire forgeron gaulois à celui du maître-armurier jusqu'à celui des cloutiers de la Semoy. Une superbe collection de marionnettes au premier étage permet de découvrir l'histoire du festival mondial des théâtres de marionnettes et de comprendre les différentes traditions marionnétiques. Une galerie d'expositions temporaires est accessible à tous librement à droite de l'entrée du Musée.Le musée propose des visites guidées et des animations toute l'année.",,,,,,,,,,,,,,,,,"http://cnstlltn.com/master/deeb8e8b-6614-4907-bb02-979c8384f195/001_musee_de_l_ardenne_david-truillard.jpg","http://cnstlltn.com/master/46f135e4-88a3-4d25-b446-c0fd53bbacac/002_musee_de_l_ardenne_jean_marie_lecomte.jpg","http://cnstlltn.com/master/2f4a9b56-f851-4db6-a6e6-e40baf37b6f8/003_musee_de_l_ardenne_jean_marie_lecomte.jpg",,"Musée de France","Villes d'art et d'histoire",,,"Accès handicapés",,,,,,,,,,,,,,,"Renseignement/Information",,"MUSEE DE L'ARDENNE",,,"musees@mairie-charlevillemezieres.fr","03.24.32.44.60","03.24.32.44.69",,,,,,,,,,,,,"anglais","français",,,,"Carte de crédit","Chèques","Chèques bancaires et postaux","Espèces","Visa",,,,,,"Ascenseur","Auditorium","Boutiques","Jardin","Jardin ombragé","Salle d'animation","Salle de réunion",,,,,,,,,,,,,,,,,,,,,,,,,,,,,,,,,,"Animation groupe","Animation thématique spécifique","Atelier pédagogique","Atelier pour adultes","Atelier pour enfants",,,,,,"Y",50,10,,,,"tarif réduit","3.70","3.70","entrée gratuite les 1ers dimanches de chq mois","0.00","0.00","gratuit pour les carolomacériens, - de 18 ans, chômeurs, étudiants ","0.00","0.00","tarif groupe","4.00","4.00","tarif normal adulte (accès aux 3 musées de la ville)","5.00","5.00",,,,,,,,,,,,,,,,,,,,,,,,,,,,,,,,,,,,,,,,,,,,,
"PCUCHA0080000046","Musée de l'école de Montgon","Patrimoine culturel","Musée",,,,"Eco Musée",,,,"3 place de la Mairie",,,8390,"MONTGON","FRANCE","03 24 30 12 92",,,"mairiemontgon08@wanadoo.fr",,"http://www.mairiemontgon08.org",,"49.50527","4.713953",,,,"Ecomusée de l'école des années 50",,"Au cur de la vallée des Écluses, l'ancienne école à classe unique de MONTGON","Venez revivre les années 50 au temps où loin du Web, du photocopieur, et des imprimantes, on écrivait à la plume dans les écoles primaires.Come and visit Montgon school museum from the 1950's. A time when school Kids still used their quill to write, computers didn't exist and Wikipedia was not an option !",,,,,,,,,,,,,,,,,"http://cnstlltn.com/master/5266e56f-e1e6-4435-8746-cd36ae62341f/5266e56f-e1e6-4435-8746-cd36ae62341f_134.jpg",,,,,,,,"Accès handicapés",,,,,,,,,,,,,,,"Mairie",,"Mairie de Montgon",,,"mairiemontgon08@wanadoo.fr","+33 (0)3 24 30 44 43",,,,,,,,,,,,,,"français",,,,,,,,,,,,,,,"Aire de pique-nique","Parking privé","Salle hors-sac couverte","Tables de pique-nique",,,,,,,,,,,,,,,,,,,,,,,,,,,,,,,,,,,,,"Atelier pédagogique","Visite guidée",,,,,,,,,"Y",10,2,,,,"Tarif groupe et scolaires sur demande","0.00","0.00",,,,,,,,,,,,,,,,,,,,,,,,,,,,,,,,,,,,,,,,,,,,,,,,,,,,,,,,,
"PCUCHA0080000062","Musée de Warcq et la Tour de l'eau","Patrimoine culturel","Musée",,,,"Arts et traditions populaires","Eco Musée","Ensemble fortifié",,"44, rue des Ferronniers",," ",8000,"WARCQ","FRANCE","03.24.33.43.26","03.24.59.48.20",,,,,,"49.76951","4.680432",,,,"MUSEE DU VIEUX WARCQ ET LA TOUR DE L'EAU",,"ouvert certains jours sur demande - entrée : 2 (les 2 sites) - gratuit pour les enfants","Le Musée des Armuriers, de la ferronnerie et du conservatoire de la vie d'autrefois, 44 rue des Ferronniers, présente la ferronnerie locale au siècle dernier, la vie domestique, l'école, les souvenirs émouvants des 3 guerres et ceux de la vie religieuse du village (statues, tableaux, objets de culte).La Tour de l'Eau (Fortification du X°-X° siècle), rue du rivage était à l'origine une tour de garde (11e siècle) en bordure de Meuse réhabilitée en   boutique   de serrurerie, jouxtant la pièce d'habitation. Ouverture sur Rendez-vous. Visite de l'église possible sur demande.",,,,,,,,,,,,,,,,,"http://cnstlltn.com/master/3c891c48-7540-4b9a-8f87-f4dc4e616754/warcq-(6).jpg","http://cnstlltn.com/master/92893458-a3de-434f-9852-9c78e78ad1d3/la-tour-03-001-(1).jpg","http://cnstlltn.com/master/9bcb268f-a760-405f-8176-84f212a0d74a/la-tour-02-001.jpg",,,,,,"Accès handicapés",,,,,2015-07-14,2015-07-14,2015-07-26,2015-07-26,2015-08-09,2015-08-09,2015-08-23,2015-08-23,2015-09-19,2015-09-20,"Autres",,"GILLOT","Guy",,"guy.gillot2@wanadoo.fr","03.24.56.19.65",,"Renseignement/Information",,"SARFATI","Clara",,,"03.24.59.48.20",,,,,,,,,,,"Espèces",,,,,,,,,,"Aire de pique-nique","Parking",,,,,,,,,,,,,,,,,,,,,,,,,,,,,,,,,,,,,,,"Expositions temporaires","Visite guidée",,,,,,,,,"Y",50,10,,,,"tarif d'entrée pour les 2 sites","2.00","2.00",,,,,,,,,,,,,,,,,,,,,,,,,,,,,,,,,,,,,,,,,,,,,,,,,,,,,,,,,
"PCUCHA0080000123","Musée des Débuts de l'Aviation","Patrimoine culturel","Musée","Musée prive",,,"Sciences et techniques",,,,"Aérodrome","Route de Mouzon"," ",8140,"DOUZY","FRANCE","03 24 26 38 70","03 24 26 10 63",,,,,,"49.66467","5.044763",,,,"Musée des Débuts de l'Aviation",,"Durée de la visite : 1heure","Sommer et l'aviation Autour du Biplan de Roger Sommer 1910, reconstitué grandeur nature, le Musée des Débuts de l'Aviation propose à ses visiteurs une biographie du pilote et constructeur de 1908 à 1912, de nombreux documents photographiques ainsi qu'une importante collection de cartes postales d'époque. Bar à l'aérodrome. Plusieurs maquettes d'avions à l'échelle 1/4e.","Beginnings of Aviation Museum ",,"Duration of tour: 1 hour","14.00 Sommer and l'aviation Autour du Biplan de Roger Sommer 1910 at the Musée des Débuts de l'Aviation, with life size reconstructions, offers visitors a biography from 1908 to 1912 of the pilot and manufacturer, lots of photographic documents and a major collection of vintage postcards. Bar at the aerodrome. Several plane models in ĵ scale. Normal 0 21 false false false FR X-NONE X-NONE /* Style Definitions */ table.MsoNormalTable","{mso-style-name: Tableau Normal ;","mso-tstyle-rowband-size:0;","mso-tstyle-colband-size:0;","mso-style-noshow:yes;","mso-style-priority:99;","mso-style-parent:  ;","mso-padding-alt:0cm 5.4pt 0cm 5.4pt;","mso-para-margin:0cm;","mso-para-margin-bottom:.0001pt;","mso-pagination:widow-orphan;","font-size:10.0pt;","font-family: Times New Roman , serif ;}","http://cnstlltn.com/master/77f95d34-f388-42da-9525-1396092919c0/77f95d34-f388-42da-9525-1396092919c0_134.jpg","http://cnstlltn.com/master/ebef93d0-db95-4ecf-8b49-3182d905065f/img_3982.jpg","http://cnstlltn.com/master/a8b08242-5d32-440e-b4db-c29bc7c19b29/img_3983.jpg",,,,,,"Accès handicapés",,,,,,,,,,,,,,,"Point d'information",,"MUSEE DES DEBUTS DE L'AVIATION",,,,"03.24.26.38.70","03.24.26.10.63","Direction",,"MAIRIE DE MOUZON",,,,"03.24.26.10.63","03.24.26.27.73",,,,,"français",,,,,"Chèques bancaires et postaux","Espèces",,,,,,,,,"Parking autocar","Parking privé",,,,,,,,,,,,,,,,,,,,,,,,,,,,,,,,,,,,,,,,,,,,"Point d'eau potable",,,,,"Y",,,,,,"Tarif Groupe","1.50","1.50","Tarif Adulte","2.00","2.00","Tarif Enfant (-12 ans)","1.00","1.00",,,,,,,,,,,,,,,,,,,,,,,,,,,,,,,,,,,,,,,,,,,,,,,,,,,
"PCUCHA0080000164","Musée des deux Guerres Mondiales - WARNESSON Yohan","Patrimoine culturel","Musée",,,,"Histoire","Militaire","Souvenirs de guerre",,"Haut de Chagny",,,8430,"CHAGNY","FRANCE","03 24 32 15 24",,,"yohan.warnesson@orange.fr",,"http://musee-militaire-08.pagesperso-orange.fr/",,"49.57377","4.700377",,,,"Musée des deux Guerres Mondiales ",,"Visite GRATUITE toute l'année sur demande","Collection privée d'armes, de véhicules, d'éléments d'uniformes, d'objets divers des deux guerres mondiales.Le Musée vous propose la visite de deux salles sur le thème de la 1ère et de la 2ème Guerre Mondiale. Le Musée est en permanence à la recherche de tous objets militaires OUVERT TOUTE L'ANNÉE SUR RDV","Museum commemorating the two World Wars",,,"Private collection of weapons, vehicles, elements of uniforms and various objects from the two world wars. The Museum proposes a tour of two rooms on the theme of the 1st and 2nd World Wars. Visit free all year by appointment. The Museum is always looking to collect military objects of any type.",,,,,,,,,,,,,"http://cnstlltn.com/master/4aef625c-6f0d-4a06-a075-91d45531edb0/4aef625c-6f0d-4a06-a075-91d45531edb0_134.jpg","http://cnstlltn.com/master/a580d2a2-6eb8-4035-99ef-1a18debba098/a580d2a2-6eb8-4035-99ef-1a18debba098_134.jpg",,,,,,,,,,,,,,,,,,,,,,,,,,,,,,,,,,,,,,,,,,"français",,,,,"Chèques","Espèces",,,,,,,,,"Parking",,,,,,,,,,,,,,,,,,,,,,,,,,,,,,,,,,,,,,,,"Visite guidée",,,,,,,,,,"Y",,,,,,"Entrée gratuite","0.00","0.00",,,,,,,,,,,,,,,,,,,,,,,,,,,,,,,,,,,,,,,,,,,,,,,,,,,,,,,,,
